authors,title,abstract,authors_trans,abstract_trans
Juliano C. S. Neves,Wormholes from beyond,"In a brane-world context in which our universe would be a four-dimensional brane embedded into a five-dimensional spacetime or bulk, wormhole geometries are induced on branes. In this article, the Morris-Thorne wormhole and the Molina-Neves wormhole are obtained on the brane using the Nakas-Kanti approach, which starts from a regular five-dimensional spacetime to obtain known black hole and wormhole solutions on the four-dimensional brane. From the bulk perspective, these wormholes are five-dimensional solutions supported by an exotic fluid, but from the brane perspective, such objects are wormholes not supported by any fields or particles that live on the four-dimensional spacetime. Thus, the cause of these wormholes is the bulk influence on the brane.",向こうからのワームホール,私たちの宇宙が5次元の時空またはバルクに埋め込まれた4次元のブレーンとなるブレーン世界の文脈では、ワームホールのジオメトリはブーンに誘導されます。この記事では、Morris-Thorne WormholeとMolina-Neves Wormholeは、通常の5次元の時空から始まるNakas-kantiアプローチを使用してブレーンで取得され、4次元のブレーンの既知のブラックホールとワームホールソリューションを取得します。バルクの観点から見ると、これらのワームホールはエキゾチックな流体によってサポートされている5次元ソリューションですが、ブレーンの観点からは、そのようなオブジェクトは、4次元の時空に生息する領域または粒子によってサポートされていないワームホールです。したがって、これらのワームホールの原因は、ブレーンに対するバルクの影響です。
"Delong Kong, Yu Tian, Hongbao Zhang, Jinan Zhao",Dynamical black hole entropy beyond general relativity from the Einstein frame,"Recently Hollands, Wald and Zhang proposed a new formula for the entropy of a dynamical black hole for an arbitrary theory of gravity obtained from a diffeomorphism covariant Lagrangian via the Noether charge method. We present an alternative, pedagogical derivation of the dynamical black hole entropy for $f(R)$ gravity as well as canonical scalar-tensor theory by means of conformal transformations. First, in general relativity we generalize Visser and Yan's pedagogical proof of the non-stationary physical process first law to black holes that may not be in vacuum, and give a pedagogical derivation of the second-order behavior of the dynamical black hole entropy for vacuum perturbations by considering the second-order variation of the Raychaudhuri equation. Second, we apply the derivation for general relativity to theories in the Einstein frames, and then recast the conclusions in their original frames. We show that the dynamical black hole entropy formulae of these theories satisfy both the non-stationary physical process first law and the non-stationary comparison first law via the Einstein frame. We further study the second-order behavior of the dynamical black hole entropy for vacuum perturbations, and observe that the second law is obeyed at second order in those theories. Using the Einstein frame, we also determine the relationship between the dynamical black hole entropy and the Wald entropy of the generalized apparent horizon in the original frame.",アインシュタインフレームからの一般相対性理論を超えたダイナミカルブラックホールエントロピー,最近、オランダ、ウォルド、チャンは、ノーザー電荷法を介してdiffeyomorphys covariantラグランジアンから得られた任意の重力理論のための動的なブラックホールのエントロピーのための新しい式を提案しました。 $ f（r）$の重力の動的ブラックホールエントロピーの代替の教育学的導出と、コンフォーマル変換による標準的なスカラーテンソル理論を提示します。第一に、一般的な相対性理論では、VisserとYanの非定常物理プロセスの教育的証拠を、真空ではない可能性のあるブラックホールに最初の法則を一般化し、Raychaudhuri Equationの2次バリエーションを同時に確認することにより、真空摂動の動的ブラックホールエントロピーの2次挙動の教育学的導出を与えます。第二に、アインシュタインフレームの理論に一般的な相対性の派生を適用し、元のフレームの結論を再作成します。これらの理論の動的なブラックホールエントロピー式は、非定常物理プロセス第一法と、アインシュタインフレームを介した非定常比較第一法則の両方を満たすことを示します。さらに、真空摂動のための動的ブラックホールエントロピーの2次挙動を研究し、これらの理論では第2の法則が2次に従っていることを観察します。アインシュタインフレームを使用して、元のフレームの一般化された見かけの地平線の動的ブラックホールエントロピーとWALDエントロピーとの関係も決定します。
"Masood Valipour, Gniewomir Sarbicki, Karolina Słowik, Anita Dąbrowska",Optimization of two-photon absorption for three-level atom,"This work discusses the problem of optimal excitation of a three-level atom of ladder-configuration by light in the two-photon state and coherent light carrying an average of two photons. The applied atom-light interaction model is based on the Wigner-Weisskopf approximation. We characterize the properties of the optimal two-photon state that excites an atom perfectly, i.e. with probability equal to one: We find that the spectro-temporal shape of the optimal state of light is determined by the lifetimes of the atomic states, with the degree of photonic entanglement in the optimal state depends on the lifetime ratio. In consequence, two distinct interaction regimes can be identified in which the entanglement of the input state of light has qualitatively different impact.
As the optimal states may be challenging to prepare in general, we compare the results with those obtained for photon pairs of selected experimentally-relevant pulse shapes. As these shapes are optimized for maximal atomic excitation probability, the results can be interpreted in terms of the overlap between the optimal and investigated pulse shapes.",3レベルの原子の2光子吸収の最適化,"この研究では、2光子状態の光によるはしご濃度の3レベルの原子と平均2つの光子を運ぶコヒーレントな光の問題について説明しています。 Applied Atom-Light相互作用モデルは、Wigner-Weisskopf近似に基づいています。原子を完全に興奮させる最適な2光子状態の特性を特徴づけます。つまり、1つに等しい確率で、最適な光の状態のスペクトロ時代の形状は、原子状態の寿命によって決定されることがわかります。その結果、光の入力状態の絡み合いが定性的に異なる影響を与える2つの異なる相互作用体制を特定できます。
最適な状態は一般的に準備するのが難しい可能性があるため、結果を、選択した実験的に関連するパルス形状の光子ペアについて得られた状態と比較します。これらの形状は最大の原子励起確率のために最適化されているため、結果は、最適なパルス形状と調査されたパルス形状の重複の観点から解釈できます。"
"Akitoshi Shiotari, Shuyi Liu, George Trenins, Toshiki Sugimoto, Martin Wolf, Mariana Rossi, Takashi Kumagai",Picocavity-enhanced Raman spectroscopy of physisorbed H2 and D2 molecules,"We report on tip-enhanced Raman scattering (TERS) of H2 and D2 molecules physisorbed within a plasmonic picocavity at 10 K. The intense Raman peaks resulting from the rotational and vibrational transitions are observed at sub-nanometer gap distances of the junction formed by an Ag tip and Ag(111) surface, where a picocavity-enhanced field plays a crucial role. A significant red-shift of the H-H stretch frequency is found as the gap distance decreases, while the D-D stretch frequency is unaffected. Density functional theory, path-integral molecular dynamics, and quantum anharmonic vibrational energy calculations suggest that this unexpected isotope effect is explained by a different molecular density between H2 and D2 on the surface.",Picocavityが強化したラマン分光医学的H2およびD2分子の分光法,10 Kでプラズモニックピコカビティ内で物理的に吸収されたH2およびD2分子の先端強化ラマン散乱（TER）を報告します。 H-Hストレッチ周波数の大幅な赤方偏移は、ギャップ距離が減少するにつれて見られますが、D-Dストレッチ周波数は影響を受けません。密度官能理論、経路統合分子動力学、および量子アンハーモニック振動エネルギー計算は、この予期しない同位体効果が、表面上のH2とD2の間の異なる分子密度によって説明されることを示唆しています。
"Taro Kimura, Go Noshita",Gauge origami and quiver W-algebras III: Donaldson--Thomas $qq$-characters,"We further develop the BPS/CFT correspondence between quiver W-algebras/$qq$-characters and partition functions of gauge origami. We introduce $qq$-characters associated with multi-dimensional partitions with nontrivial boundary conditions which we call Donaldson--Thomas (DT) $qq$-characters. They are operator versions of the equivariant DT vertices of toric Calabi--Yau three and four-folds. Moreover, we revisit the construction of the D8 $qq$-characters with no boundary conditions and give a quantum algebraic derivation of the sign rules of the magnificent four partition function. We also show that under the proper sign rules, the D6 and D8 $qq$-characters with no boundary conditions all commute with each other and discuss its physical interpretation.",ゲージ折り紙とQuiver W-algebras III：ドナルドソン - トーマス$ qq $  - キャラクター,さらに、Quiver w-algebras/$ qq $ -characterとゲージ折り紙のパーティション関数の間のBPS/CFT対応を開発します。 Donaldson-Thomas（DT）$ QQ $ -Charactersと呼ばれる非重要な境界条件を持つ多次元パーティションに関連する$ QQ $ -Charactersを紹介します。それらは、トーリックカラビの等垂直dt頂点のオペレーターバージョンです - ヨーは3倍と4倍です。さらに、境界条件のないD8 $ QQ $ -Characterの構築を再検討し、壮大な4つのパーティション関数の符号ルールの量子代数派生を提供します。また、適切な標識ルールの下で、境界条件のないD6およびD8 $ QQ $ -Charactersはすべて互いに通勤し、その物理的な解釈について議論することを示します。
"Sunjin Choi, Diksha Jain, Seok Kim, Vineeth Krishna, Eunwoo Lee, Shiraz Minwalla, Chintan Patel",Dual Dressed Black Holes as the end point of the Charged Superradiant instability in ${\cal N} = 4$ Yang Mills,"Charged Black holes in $AdS_5 \times S^5$ suffer from superradiant instabilities over a range of energies. Hairy black hole solutions (constructed within gauged supergravity) have previously been proposed as endpoints to this instability. We demonstrate that these hairy black holes are themselves unstable to the emission of large dual giant gravitons. We propose that the endpoint to this instability is given by Dual Dressed Black Holes (DDBH)s; configurations consisting of one, two, or three very large dual giant gravitons surrounding a core $AdS$ black hole with one, two, or three $SO(6)$ chemical potentials equal to unity. The dual giants each live at $AdS$ radial coordinates of order $\sqrt{N}$ and each carry charge of order $N^2$. The large separation makes DDBHs a very weakly interacting mix of their components and allows for a simple computation of their thermodynamics. We conjecture that DDBHs dominate the phase diagram of ${\cal N}=4$ Yang-Mills over a range of energies around the BPS plane, and provide an explicit construction of this phase diagram, briefly discussing the interplay with supersymmetry. We develop the quantum description of dual giants around black hole backgrounds and explicitly verify that DDBHs are stable to potential tunneling instabilities, precisely when the chemical potentials of the core black holes equal unity. We also construct the 10-dimensional DDBH bulk solutions.",$ {\ cal n} = 4 $ Yang Millsの充電されたスーパーレディアンな不安定性のエンドポイントとしてのデュアルドレスブラックホール,$ ADS_5 \ TIMES S^5 $の充電されたブラックホールは、さまざまなエネルギーにわたって超放牧された不安定性に苦しんでいます。毛むくじゃらのブラックホールソリューション（測定された超重力内で構築）は、以前にこの不安定性のエンドポイントとして提案されています。これらの毛むくじゃらのブラックホールは、それ自体が大きなデュアル巨大グラビトンの放出に不安定であることを実証します。この不安定性のエンドポイントは、デュアルドレスブラックホール（DDBH）によって与えられることを提案します。コア$ ADS $ブラックホールを囲む1つ、2つ、または3つの非常に大きなデュアルジャイアントグラビトンで構成される構成は、1つ、2つ、または3つの$（6）$ $の化学電位を統一します。デュアルジャイアンツはそれぞれ$ ads $ radial座標$ \ sqrt {n} $の$ ads $ radial座標であり、それぞれ注文$ n^2 $のキャリーチャージ。大規模な分離により、DDBHSはコンポーネントの非常に弱い相互作用の組み合わせになり、熱力学の簡単な計算が可能になります。 DDBHSは、BPS平面周辺のさまざまなエネルギーを介して$ {\ cal n} = 4 $ Yangミルの位相図を支配し、この相図の明示的な構造を提供し、超対称性と相互作用を簡単に議論することを推測します。ブラックホールの背景周りのデュアルジャイアントの量子記述を開発し、DDBHが潜在的なトンネルの不安定性に対して安定していることを明示的に確認します。また、10次元DDBHバルクソリューションを構築します。
"Harald Putterman, Kyungjoo Noh, Connor T. Hann, Gregory S. MacCabe, Shahriar Aghaeimeibodi, Rishi N. Patel, Menyoung Lee, William M. Jones, Hesam Moradinejad, Roberto Rodriguez, Neha Mahuli, Jefferson Rose, John Clai Owens, Harry Levine, Emma Rosenfeld, Philip Reinhold, Lorenzo Moncelsi, Joshua Ari Alcid, Nasser Alidoust, Patricio Arrangoiz-Arriola, James Barnett, Przemyslaw Bienias, Hugh A. Carson, Cliff Chen, Li Chen, Harutiun Chinkezian, Eric M. Chisholm, Ming-Han Chou, Aashish Clerk, Andrew Clifford, R. Cosmic, Ana Valdes Curiel, Erik Davis, Laura DeLorenzo, J. Mitchell D'Ewart, Art Diky, Nathan D'Souza, Philipp T. Dumitrescu, Shmuel Eisenmann, Essam Elkhouly, Glen Evenbly, Michael T. Fang, Yawen Fang, Matthew J. Fling, Warren Fon, Gabriel Garcia, Alexey V. Gorshkov, Julia A. Grant, Mason J. Gray, Sebastian Grimberg, Arne L. Grimsmo, Arbel Haim, Justin Hand, Yuan He, Mike Hernandez, David Hover, Jimmy S.C. Hung, Matthew Hunt, Joe Iverson, Ignace Jarrige, Jean-Christophe Jaskula, Liang Jiang, Mahmoud Kalaee, Rassul Karabalin, Peter J. Karalekas, Andrew J. Keller, Amirhossein Khalajhedayati, Aleksander Kubica, Hanho Lee, Catherine Leroux, Simon Lieu, Victor Ly, Keven Villegas Madrigal, Guillaume Marcaud, Gavin McCabe, Cody Miles, Ashley Milsted, Joaquin Minguzzi, Anurag Mishra, Biswaroop Mukherjee, Mahdi Naghiloo, Eric Oblepias, Gerson Ortuno, Jason Pagdilao, Nicola Pancotti, Ashley Panduro, JP Paquette, Minje Park, Gregory A. Peairs, David Perello, Eric C. Peterson, Sophia Ponte, John Preskill, Johnson Qiao, Gil Refael, Rachel Resnick, Alex Retzker, Omar A. Reyna, Marc Runyan, Colm A. Ryan


        , Abdulrahman Sahmoud, Ernesto Sanchez, Rohan Sanil, Krishanu Sankar, Yuki Sato, Thomas Scaffidi, Salome Siavoshi, Prasahnt Sivarajah, Trenton Skogland, Chun-Ju Su, Loren J. Swenson, Stephanie M. Teo, Astrid Tomada, Giacomo Torlai, E. Alex Wollack, Yufeng Ye, Jessica A. Zerrudo, Kailing Zhang, Fernando G.S.L. Brandão, Matthew H. Matheny, Oskar Painter


    et al. (21 additional authors not shown)
 You must enable JavaScript to view entire author list.",Hardware-efficient quantum error correction via concatenated bosonic qubits,"In order to solve problems of practical importance, quantum computers will likely need to incorporate quantum error correction, where a logical qubit is redundantly encoded in many noisy physical qubits. The large physical-qubit overhead typically associated with error correction motivates the search for more hardware-efficient approaches. Here, using a microfabricated superconducting quantum circuit, we realize a logical qubit memory formed from the concatenation of encoded bosonic cat qubits with an outer repetition code of distance $d=5$. The bosonic cat qubits are passively protected against bit flips using a stabilizing circuit. Cat-qubit phase-flip errors are corrected by the repetition code which uses ancilla transmons for syndrome measurement. We realize a noise-biased CX gate which ensures bit-flip error suppression is maintained during error correction. We study the performance and scaling of the logical qubit memory, finding that the phase-flip correcting repetition code operates below threshold, with logical phase-flip error decreasing with code distance from $d=3$ to $d=5$. Concurrently, the logical bit-flip error is suppressed with increasing cat-qubit mean photon number. The minimum measured logical error per cycle is on average $1.75(2)\%$ for the distance-3 code sections, and $1.65(3)\%$ for the longer distance-5 code, demonstrating the effectiveness of bit-flip error suppression throughout the error correction cycle. These results, where the intrinsic error suppression of the bosonic encodings allows us to use a hardware-efficient outer error correcting code, indicate that concatenated bosonic codes are a compelling paradigm for reaching fault-tolerant quantum computation.",連結されたボソンキビットを介したハードウェア効率の高い量子エラー補正,実用的な重要性の問題を解決するために、量子コンピューターは、多くの騒々しい物理的なキュービットで論理的なキュービットが冗長にエンコードされている量子誤差補正を組み込む必要がある可能性があります。通常、エラー補正に関連する大きな物理的なクビットオーバーヘッドは、よりハードウェア効率の高いアプローチの検索を動機付けます。ここでは、マイクロファブリケートの超伝導量子回路を使用して、距離$ d = 5 $の外側の繰り返しコードとエンコードされたボソン猫のキビットの連結から形成された論理的なキットメモリを実現します。ボソン猫のキュービットは、安定化回路を使用してビットフリップから受動的に保護されています。 Cat-qubit Phase-Flipエラーは、症候群測定にAncilla Transmonsを使用する繰り返しコードによって修正されます。エラー補正中にビットフリップエラー抑制が維持されることを保証するノイズバイアス化されたCXゲートを認識します。論理Qubitメモリのパフォーマンスとスケーリングを調査し、位相フリップ修正繰り返しコードがしきい値以下で動作することを発見し、コード距離が$ d = 3 $から$ d = 5 $に減少します。同時に、論理ビットフリップエラーは、CAT-qubit平均光子数の増加とともに抑制されます。サイクルごとに測定された最小論理エラーは、距離3コードセクションで平均1.75ドル（2）\％$、長距離5コードで1.65ドル（3）\％$であり、エラー修正サイクル全体でビットフリップエラー抑制の有効性を示しています。これらの結果は、ボゾニックエンコーディングの固有のエラー抑制により、ハードウェア効率の高い外部エラー修正コードを使用できる場合、連結されたボソンコードが断層耐性の量子計算に到達するための説得力のあるパラダイムであることを示しています。
"Seok-Hyung Lee, Felix Thomsen, Nicholas Fazio, Benjamin J. Brown, Stephen D. Bartlett",Low-overhead magic state distillation with color codes,"Fault-tolerant implementation of non-Clifford gates is a major challenge for achieving universal fault-tolerant quantum computing with quantum error-correcting codes. Magic state distillation is the most well-studied method for this but requires significant resources. Hence, it is crucial to tailor and optimize magic state distillation for specific codes from both logical- and physical-level perspectives. In this work, we perform such optimization for two-dimensional color codes, which are promising due to their higher encoding rates compared to surface codes, transversal implementation of Clifford gates, and efficient lattice surgery. We propose two carefully designed distillation schemes based on the 15-to-1 distillation circuit and lattice surgery, differing in their methods for handling faulty rotations. Our first scheme employs faulty T-measurement, achieving infidelities of $O(p^3)$ for physical noise strength $p$. To achieve lower infidelities, our second scheme integrates distillation with `cultivation' (a distillation-free approach to fault-tolerantly prepare magic states through transversal Clifford measurements). Our second scheme achieves significantly lower infidelities (e.g., $\sim 2 \times 10^{-16}$ at $p = 10^{-3}$), surpassing the capabilities of both cultivation and single-level distillation. Notably, to reach a given target infidelity, our schemes require approximately two orders of magnitude fewer resources than the previous best magic state distillation schemes for color codes.",カラーコードによる低オーバーヘッドマジック状態の蒸留,非クライフォードゲートのフォールトトレラントな実装は、量子エラー修正コードを使用して、普遍的な断層耐性量子コンピューティングを達成するための主要な課題です。魔法の状態蒸留は、これの最もよく研​​究されている方法ですが、重要なリソースが必要です。したがって、論理レベルと物理レベルの両方の視点から特定のコードの魔法の状態蒸留を調整および最適化することが重要です。この作業では、2次元のカラーコードに対してこのような最適化を実行します。これは、表面コード、クリフォードゲイツの横断的実装、効率的な格子手術と比較して、エンコード速度が高いため有望です。 15対1の蒸留回路と格子手術に基づ​​いて、誤った回転の処理方法が異なる2つの慎重に設計された蒸留スキームを提案します。私たちの最初のスキームは、障害のあるT測定を採用しており、物理ノイズ強度$ P $に対して$ o（p^3）$の不明瞭さを達成しています。より低い不倫を達成するために、当社の2番目のスキームは、蒸留を「栽培」と統合します（横方向のクリフォードの測定を通じて魔法の状態を耐性を耐える蒸留のないアプローチ）。 2番目のスキームは、$ P = 10^{-3} $で$ \ sim 2 \ times 10^{-16} $を大幅に低下させ、栽培とシングルレベルの蒸留の両方の機能を上回ります。特に、特定のターゲットの不倫に到達するために、当社のスキームは、カラーコードの以前の最高の魔法の状態蒸留スキームよりも約2桁少ないリソースを必要とします。
