authors,title,abstract,authors_trans,abstract_trans
"Ashley Montanaro, Leo Zhou",Quantum speedups in solving near-symmetric optimization problems by low-depth QAOA,"We present new advances towards achieving exponential quantum speedups for solving optimization problems by low-depth quantum algorithms. Specifically, we focus on families of combinatorial optimization problems that exhibit symmetry and contain planted solutions. We rigorously prove that the 1-step Quantum Approximate Optimization Algorithm (QAOA) can achieve a success probability of $\Omega(1/\sqrt{n})$, and sometimes $\Omega(1)$, for finding the exact solution in many cases. This allows us to prove a separation of $O(1)$ quantum queries and $\Omega(n/\log n)$ classical queries required to find the planted solution in the latter setting. Furthermore, we construct near-symmetric optimization problems by randomly sampling the individual clauses of symmetric problems, and prove that the QAOA maintains a strong success probability in this setting even when the symmetry is broken. Finally, we construct various families of near-symmetric Max-SAT problems and benchmark state-of-the-art classical solvers, discovering instances where all known general-purpose classical algorithms require exponential time. Therefore, our results indicate that low-depth QAOA may achieve an exponential quantum speedup for optimization problems.",低いQAOAによる近傍最適化問題を解決する際の量子速度,低い量子アルゴリズムによる最適化問題を解決するための指数関数的な量子速度を達成するための新しい進歩を提示します。具体的には、対称性を示し、植え付けられた溶液を含む組み合わせ最適化問題のファミリーに焦点を当てています。正確なソリューションを見つけるために、1ステップの量子概算最適化アルゴリズム（QAOA）が$ \ omega（1/\ sqrt {n}）$の成功確率を達成できることを厳密に証明します。多くの場合。これにより、$ o（1）$ Quantumクエリと$ \ omega（n/\ log n）$ $ solution溶液を後者の設定で見つけるために必要な古典的なクエリの分離を証明できます。さらに、対称問題の個々の条項をランダムにサンプリングすることにより、ほぼ対称の最適化問題を構築し、対称性が破られた場合でもQAOAがこの設定で強い成功の確率を維持していることを証明します。最後に、既知のすべての汎用クラシックアルゴリズムに指数時間が必要なインスタンスを発見するために、ほぼ対称的な最大サット問題のさまざまなファミリを構築し、最先端のクラシックソルバーをベンチマークします。したがって、我々の結果は、低いQAOAが最適化の問題のために指数関数的な量子速度を達成する可能性があることを示しています。
"Mika Göös, Tom Gur, Siddhartha Jain, Jiawei Li",Quantum Communication Advantage in TFNP,We exhibit a total search problem with classically verifiable solutions whose communication complexity in the quantum SMP model is exponentially smaller than in the classical two-way randomized model. Our problem is a bipartite version of a query complexity problem recently introduced by Yamakawa and Zhandry (JACM 2024). We prove the classical lower bound using the structure-vs-randomness paradigm for analyzing communication protocols.,TFNPの量子通信の利点,量子SMPモデルの通信の複雑さが、古典的な双方向ランダム化モデルよりも指数関数的に小さい古典的に検証可能なソリューションで完全な検索問題を示します。私たちの問題は、最近山本とZhandry（JACM 2024）によって導入されたクエリの複雑さの問題の二部バージョンです。通信プロトコルを分析するための構造VSランダムネスパラダイムを使用して、古典的な下限を証明します。
"Li Zhang, Yongguan Ke, Chaohong Lee",Zero-energy Quantum Many-Body Scar under Emergent Chiral Symmetry and Pseudo Hilbert Space Fragmentation,"Hilbert space fragmentation (HSF) is a mechanism for generating quantum many-body scar (QMBS), which provides a route to weakly break ergodicity. The zero-energy QMBSs widely exist across various systems due to the intertwining of chiral symmetry and spatial inversion symmetry. In this work, we study the phenomenology of the zero-energy QMBS under the interplay between the chiral symmetry and pseudo HSF, where the Hilbert space is approximately fragmented into different blocks. We consider a model of tilted chain of interacting spinless fermions with periodically varying tunneling strength. At small tunneling strength and under resonance condition, the system is described by an effective model with chiral symmetry and pseudo HSF. We find that the interplay between the two gives rise to a highly localized zero-energy QMBS when the particle number is even. We identify a simple product state to signalize the zero-energy QMBS, which gives rise to unusual scarred dynamics. The fidelity oscillates around a fixed value without decaying instead of showing the usual collapse and revival in common scarred systems. We show that the signature of the zero-energy QMBS can also be captured by the original Hamiltonian. Our results uncover a new scar phenomenon and provide an example that does not need the intertwining of chiral and spatial symmetries to support zero-energy QMBS.",ゼロエネルギー量子多体瘢痕緊急のキラル対称性と擬似ヒルベルト空間の断片化,Hilbert Space Fragmentation（HSF）は、量子多体瘢痕（QMBS）を生成するためのメカニズムであり、緊張性を弱く壊すためのルートを提供します。ゼロエネルギーQMBSは、キラルの対称性と空間反転対称性の絡み合いにより、さまざまなシステム全体に広く存在します。この作業では、ヒルベルト空間がほぼ異なるブロックに断片化されているキラルの対称性と擬似HSFの相互作用の下で、ゼロエネルギーQMBの現象学を研究します。私たちは、定期的に異なるトンネル強度を持つ相互作用するスピンレスフェルミオンの傾斜チェーンのモデルを検討します。小さなトンネル強度と共鳴状態では、システムはキラル対称性と擬似HSFを備えた効果的なモデルによって記述されます。 2つの間の相互作用により、粒子数が均一な場合、高度にローカライズされたゼロエネルギーQMBが生まれることがわかります。ゼロエネルギーQMBを信号するための単純な製品状態を特定します。これにより、異常な傷跡のダイナミクスが生じます。忠実度は、一般的な傷跡システムで通常の崩壊と復活を示すのではなく、崩壊することなく固定値の周りで振動します。ゼロエネルギーQMBの署名も、元のハミルトニアンによってキャプチャできることを示します。私たちの結果は、新しい瘢痕現象を明らかにし、ゼロエネルギーQMBをサポートするためにキラルと空間の対称性の絡み合いを必要としない例を提供します。
"Heino Falcke, Michael F. Wondrak, Walter D. van Suijlekom",An upper limit to the lifetime of stellar remnants from gravitational pair production,"Black holes are assumed to decay via Hawking radiation. Recently we found evidence that spacetime curvature alone without the need for an event horizon leads to black hole evaporation. Here we investigate the evaporation rate and decay time of a non-rotating star of constant density due to spacetime curvature-induced pair production and apply this to compact stellar remnants such as neutron stars and white dwarfs. We calculate the creation of virtual pairs of massless scalar particles in spherically symmetric asymptotically flat curved spacetimes. This calculation is based on covariant perturbation theory with the quantum field representing, e.g.,\ gravitons or photons. We find that in this picture the evaporation timescale, $\tau$, of massive objects scales with the average mass density, $\rho$, as $\tau\propto\rho^{-3/2}$. The maximum age of neutron stars, $\tau\sim 10^{68}\,\text{yr}$, is comparable to that of low-mass stellar black holes. White dwarfs, supermassive black holes, and dark matter supercluster halos evaporate on longer, but also finite timescales. Neutron stars and white dwarfs decay similarly to black holes, ending in an explosive event when they become unstable. This sets a general upper limit for the lifetime of matter in the universe, which in general is much longer than the Hubble--Lemaître time, although primordial objects with densities above $\rho_\text{max} \approx 3\times 10^{53}\,\text{g/}\text{cm}^3$ should have dissolved by now. As a consequence, fossil stellar remnants from a previous universe could be present in our current universe only if the recurrence time of star forming universes is smaller than about $\sim 10^{68}\,\text{years}$.",重力ペア生産からの恒星の残党の寿命の上限,ブラックホールは、ホーキング放射線を介して崩壊すると想定されています。最近、イベントの地平線を必要とせずに時空の曲率だけでブラックホールの蒸発につながるという証拠が見つかりました。ここでは、時空の曲率誘発ペア生成による一定の密度の非回転星の蒸発速度と減衰時間を調査し、これを中性子星や白いd星などのコンパクトな星の残骸に適用します。球面的に対称的に漸近的に平らな湾曲した時空における質量のないスカラー粒子の仮想ペアの作成を計算します。この計算は、\グラビトンまたは光子を表す量子界を表す共変摂動理論に基づいています。この写真では、大規模なオブジェクトの蒸発タイムスケール、$ \ tau $、平均質量密度、$ \ rho $、$ \ tau \ propto \ rho^{ -  3/2} $として拡大することがわかります。中性子星の最大年齢、$ \ tau \ sim 10^{68} \、\ text {yr} $は、低質量の恒星ブラックホールのそれに匹敵します。白いd星、超大型のブラックホール、ダークマタースーパークラスターハローは、より長く蒸発しますが、有限のタイムスケールも蒸発します。中性子の星と白い小人はブラックホールと同様に崩壊し、不安定になる爆発的なイベントで終わります。これは、宇宙の物質の生涯の一般的な上限を設定します。これは、一般的にハッブルよりもはるかに長いです - レマイトレ時間ですが、$ \ rho_ \ text {max} \ emollx 3 \ times 10^を超える原始オブジェクト{53} \、\ text {g/} \ text {cm}^3 $は今までに溶解するはずです。結果として、星形成宇宙の再発時間が約$ \ sim 10^{68} \、\ text {years} $よりも小さい場合にのみ、以前の宇宙からの化石星の残骸が現在の宇宙に存在する可能性があります。
"Nils Hüsken, Elisabetta Spadaro Norella, Ivan Polyakov",A Brief Guide to Exotic Hadrons,"Exotic hadrons are a new class of hadronic states whose properties do not allow them to be classified as conventional quark-antiquark mesons or three quark baryons. Finding new and understanding established exotic states is the most important topic in today's hadron spectroscopy and a promising avenue to advance our knowledge on Quantum Chromodynamics in the non-perturbative regime. While several high-quality reviews on the topic exist, they are all at an advanced level. The present article aims to address new-comers to the field with a simple introduction to exotic hadrons with an emphasis on the experimental studies.",エキゾチックなハドロンの簡単なガイド,エキゾチックなハドロンは、新しいクラスのハドロニクス状態であり、その特性は、従来のクォークアンチクルクメソンまたは3つのクォークバリオンとして分類することを許可していません。新しいエキゾチックな状態を理解することは、今日のハドロン分光法の中で最も重要なトピックであり、非摂動体制における量子クロモダイナミクスに関する知識を促進するための有望な道です。トピックに関するいくつかの高品質のレビューが存在しますが、それらはすべて高度なレベルです。現在の記事は、実験的研究に重点を置いて、エキゾチックなハドロンを簡単に紹介して、新たなコーマーにフィールドに対処することを目的としています。
"Julia H. Yang, Amanda Whai Shin Ooi, Zachary A. H. Goodwin, Yu Xie, Jingxuan Ding, Stefano Falletta, Ah-Hyung Alissa Park, Boris Kozinsky",Room-temperature decomposition of the ethaline deep eutectic solvent,"Environmentally-benign, non-toxic electrolytes with combinatorial design spaces are excellent candidates for green solvents, green leaching agents, and carbon capture sources. Here, we examine one particular green solvent, ethaline, a 2:1 molar ratio of ethylene glycol and choline chloride. Despite its touted green credentials, we find partial decomposition of ethaline into toxic chloromethane and dimethylaminoethanol at room temperature, limiting its sustainable advantage. We experimentally characterize these decomposition products and computationally develop a general, quantum chemically-accurate workflow to understand decomposition. We find that fluctuations of the hydrogen bonds bind chloride near reaction sites, initiating the reaction between choline cations and chloride anions. In summary, in the design of green solvents, we do not recommend the use of choline chloride due to its susceptibility to undergo decomposition in strongly hydrogen-bound mixtures.",エタリンの深部共溶媒の室温分解,組み合わせの設計スペースを備えた環境に覆われた非毒性電解質は、緑色の溶媒、緑色の浸出剤、炭素捕獲源の優れた候補です。ここでは、エチレングリコールと塩化コリンの2：1モル比である特定の緑色の溶媒であるエタリンを調べます。宣伝された緑の資格情報にもかかわらず、室温での毒性クロロメタンとジメチルアミノエタノールへのエタリンの部分的な分解が認められ、その持続可能な利点が制限されています。これらの分解製品を実験的に特徴付け、分解を理解するために、一般的な量子化学的に活用されるワークフローを計算します。水素結合の変動は、反応部位の近くで塩化物に結合し、コリンカチオンと塩化物陰イオンの間の反応を開始することがわかります。要約すると、緑色の溶媒の設計では、強力な水素結合混合物で分解を受ける可能性があるため、塩化コリンの使用をお勧めしません。
"Harrison Siegel, Maximiliano Isi, Will M. Farr",Analyzing black-hole ringdowns II: data conditioning,"Time series data from observations of black hole ringdown gravitational waves are often analyzed in the time domain by using damped sinusoid models with acyclic boundary conditions. Data conditioning operations, including downsampling, filtering, and the choice of data segment duration, reduce the computational cost of such analyses and can improve numerical stability. Here we analyze simulated damped sinsuoid signals to illustrate how data conditioning operations, if not carefully applied, can undesirably alter the analysis' posterior distributions. We discuss how currently implemented downsampling and filtering methods, if applied too aggressively, can introduce systematic errors and skew tests of general relativity. These issues arise because current downsampling and filtering methods do not operate identically on the data and model. Alternative downsampling and filtering methods which identically operate on the data and model may be achievable, but we argue that the current operations can still be implemented safely. We also show that our preferred anti-alias filtering technique, which has an instantaneous frequency-domain response at its roll-off frequency, preserves the structure of posterior distributions better than other commonly used filters with transient frequency-domain responses. Lastly, we highlight that exceptionally long data segments may need to be analyzed in cases where thin lines in the noise power spectral density overlap with central signal frequencies. Our findings may be broadly applicable to any analysis of truncated time domain data with acyclic boundary conditions.",ブラックホールのリングダウンの分析II：データコンディショニング,ブラックホールリングダウン重力の観測からの時系列データは、非環境境界条件を持つ減衰副鼻腔モデルを使用することにより、時間領域でしばしば分析されます。ダウンサンプリング、フィルタリング、データセグメントの期間の選択を含むデータコンディショニング操作は、そのような分析の計算コストを削減し、数値の安定性を改善することができます。ここでは、シミュレートされた減衰罪の信号を分析して、データコンディショニング操作が慎重に適用されない場合、分析の後部分布を望ましく変化させる方法を説明します。現在実装されているダウンサンプリングおよびフィルタリング方法が、積極的に適用されている場合、一般相対性理論の系統的エラーとスキューテストを導入する方法について説明します。現在のダウンサンプリングおよびフィルタリング方法がデータとモデルで同一に動作しないため、これらの問題は発生します。データとモデルで同一に動作する代替のダウンサンプリングおよびフィルタリング方法が達成可能である可能性がありますが、現在の操作は依然として安全に実装できると主張します。また、ロールオフ周波数に瞬時の周波数ドメイン応答を備えた好ましい抗ALIASフィルタリング技術が、一時的な周波数ドメイン応答を備えた他の一般的に使用されるフィルターよりも後部分布の構造をよりよく保存することを示しています。最後に、ノイズパワースペクトル密度の細い線が中央信号周波数と重複する場合、非常に長いデータセグメントを分析する必要がある場合があることを強調しています。私たちの調査結果は、非環式境界条件を持つ切り捨てられた時間領域データの分析に広く適用される可能性があります。
Oliver Siebert,On the thermodynamic limit of interacting fermions in the continuum,"We study the dynamics of non-relativistic fermions in $\mathbb R^d$ interacting through a pair potential. Employing methods developed by Buchholz in the framework of resolvent algebras, we identify an extension of the CAR algebra where the dynamics acts as a group of *-automorphisms, which are continuous in time in all sectors for fixed particle numbers. In addition, we identify a suitable dense subalgebra where the time evolution is also strongly continuous. Finally, we briefly discuss how this framework could be used to construct KMS states in the future.",連続体で相互作用するフェルミオンの熱力学的限界について,私たちは、ペア電位を介して相互作用する$ \ mathbb r^d $の非相対的フェルミオンのダイナミクスを研究します。レゾルベント代数のフレームワークでブッフホルツが開発した方法を採用して、ダイナミクスが * - 自動化動態のグループとして機能する自動車代数の拡張を特定します。さらに、時間の進化も強く連続している適切な密度の高い亜代数を特定します。最後に、このフレームワークを将来KMS状態を構築するためにどのように使用できるかを簡単に説明します。
"Jiale Chen, Pengfei Li, Jun Hu",Strain-engineering quantum anomalous Hall effect in janus MnBi2SexTe4-x monolayers,"Exploring intrinsic magnetic topological insulators (TIs) for next-generation spintronic devices is still challenging in recent years. Here, we present a theoretical investigation on the electronic, magnetic and topological properties of monolayer (ML) Janus MnBi2TexSe4-x, derived from two trivial magnetic semiconductors ML MnBi2Se4 and MnBi2Te4. Our band structure analysis reveals that two out of the eight Janus structures exhibit band inversion induced by spin-orbit coupling. These structures are confirmed to have nonzero integer Chern numbers, indicating their topological nature. Moreover, the topological state is robust under moderate biaxial strains. Interestingly, applying compressive strain results in a high Chern number of 2 and enhances their magnetic stability at elevated temperatures. Our findings offer an effective strategy to engineer magnetic TI states within the ML MnBi2Te4 family.",Janus Mnbi2Sexte4-X単層における歪みの量子異常ホール効果,近年、次世代のスピントロニックデバイスの固有の磁気トポロジー絶縁体（TIS）を探索することは依然として困難です。ここでは、2つの些細な磁気半導体ML MNBI2SE4およびMNBI2TE4に由来する、単層（ML）Janus MNBI2TEXSE4-Xの電子、磁気、およびトポロジーの特性に関する理論的調査を提示します。私たちのバンド構造分析により、8つのヤヌス構造のうち2つがスピン軌道カップリングによって誘導されるバンドの反転を示すことが明らかになりました。これらの構造は、ゼロ以外の整数チェルン数があることが確認されており、それらのトポロジー的性質を示しています。さらに、トポロジー状態は中程度の二軸株下で堅牢です。興味深いことに、圧縮ひずみを適用すると、Chern数が高くなり、高温での磁気安定性が向上します。私たちの調査結果は、ML MNBI2TE4ファミリー内の磁気TI状態を設計するための効果的な戦略を提供します。
