authors,title,abstract,authors_trans,abstract_trans
"Junyi An, Chao Qu, Yun-Fei Shi, XinHao Liu, Qianwei Tang, Fenglei Cao, Yuan Qi",Equivariant Masked Position Prediction for Efficient Molecular Representation,"Graph neural networks (GNNs) have shown considerable promise in computational chemistry. However, the limited availability of molecular data raises concerns regarding GNNs' ability to effectively capture the fundamental principles of physics and chemistry, which constrains their generalization capabilities. To address this challenge, we introduce a novel self-supervised approach termed Equivariant Masked Position Prediction (EMPP), grounded in intramolecular potential and force theory. Unlike conventional attribute masking techniques, EMPP formulates a nuanced position prediction task that is more well-defined and enhances the learning of quantum mechanical features. EMPP also bypasses the approximation of the Gaussian mixture distribution commonly used in denoising methods, allowing for more accurate acquisition of physical properties. Experimental results indicate that EMPP significantly enhances performance of advanced molecular architectures, surpassing state-of-the-art self-supervised approaches. Our code is released in this https URL.",効率的な分子表現のための等量マスクされた位置予測,グラフニューラルネットワーク（GNNS）は、計算化学にかなりの約束を示しています。ただし、分子データの利用可能性が限られているため、物理学と化学の基本原則を効果的にキャプチャするGNNの能力に関する懸念が生じ、一般化能力を制約します。この課題に対処するために、分子内の潜在性と力理論に基づいた、等掘りマスクされた位置予測（EMPP）と呼ばれる新しい自己監視アプローチを紹介します。従来の属性マスキング手法とは異なり、EMPPは、より明確に定義された微妙な位置予測タスクを策定し、量子機械的特徴の学習を強化します。 EMPPはまた、除去方法で一般的に使用されるガウス混合物分布の近似をバイパスし、物理的特性のより正確な獲得を可能にします。実験結果は、EMPPが高度な分子アーキテクチャのパフォーマンスを大幅に向上させ、最先端の自己監視アプローチを上回ることを示しています。私たちのコードは、このHTTPS URLでリリースされています。
"Dang Bao An Tran (LPL), Mathieu Manceau (LPL), Olivier Lopez (LPL), Andrey Goncharov (LPL, ILP), Anne Amy-Klein (LPL), Benoît Darquié (LPL)",Extending frequency metrology to increasingly complex molecules: SI-traceable sub-Doppler mid-IR spectroscopy of trioxane,"Bringing increasingly complex polyatomic molecules within reach of precision measurement experiments offers fascinating and far-reaching prospects ranging from Earth sciences and astrophysics, to metrology and quantum sciences. Here, we demonstrate sub-Doppler spectroscopic measurements in the mid-IR fingerprint region of, to our knowledge, the largest molecule to date. To this end, we use a high-resolution ~10.3 $\mu$m spectrometer based on a sub-Hz quantum cascade laser remotely calibrated against state-of-the-art primary frequency standards via a metrology-grade fibre link. We perform saturated absorption spectroscopy in the v5 CO stretching mode of 1,3,5-trioxane, (H2CO)3, at a resolution of ~100 kHz, allowing us to measure the absolute frequency of hundreds of rovibrational transitions at unprecedented uncertainties for such a complex species, as low as ~5 kHz. Our work demonstrates the extension of frequency metrology methodologies to ever larger molecular system, confirming the potential of the technologies we develop for bringing increasingly complex species within reach of ultra-precise measurement experiments.",ますます複雑な分子に周波数計量を拡張する：Si-traceableサブドップラートリオキサンのMid-IR分光法,"精密測定実験の範囲内でますます複雑な多原子分子を​​もたらすことは、地球科学や天体物理学から計量科学や量子科学に至るまで、魅力的で広範囲に及ぶ見通しを提供します。ここでは、私たちの知る限り、これまでで最大の分子の中央指紋領域でサブドップラー分光測定を示します。この目的のために、メトロロジーグレードファイバーリンクを介して最先端のプライマリ周波数標準に対してリモートで較正されたサブHZ量子カスケードレーザーに基づいた高解像度〜10.3 $ \ MU $ M分光計を使用します。 1,3,5-トリオキサン（H2CO）3のV5 COストレッチモード（H2CO）3の飽和吸収分光法を〜100 kHzの解像度で実行し、そのような前例のない不確実性で数百のro岩遷移の絶対周波数を測定できるようにします。 〜5 kHzの低い複雑な種。私たちの研究は、周波数計測方法論の拡張がかつてないほどの分子系に拡張され、超高速測定実験の範囲内でますます複雑な種をもたらすために開発する技術の可能性を確認します。"
"Gokhan Alkac, Ege Özgün",Simulating Hawking radiation in quantum many-body systems: deviations from the thermal spectrum,"We investigate a recently proposed one-to-one correspondence between quantum field theories in two-dimensional curved spacetime and quantum many-body systems, which enables the simulation of Hawking radiation in static background spacetimes. In particular, we demonstrate that deviations from the thermal spectrum, as predicted by the well-known tunneling method, can be observed in many-body simulations.",量子多体システムのホーキング放射線のシミュレーション：熱スペクトルからの逸脱,2次元湾曲時空と量子多体系の量子フィールド理論との間に最近提案された1対1の対応を調査します。特に、よく知られているトンネリング法で予測されるように、熱スペクトルからの偏差が多体シミュレーションで観察できることを実証します。
"Pietro Brighi, Marko Ljubotina, Maksym Serbyn",Probing the many-body localized spin-glass phase through quench dynamics,"Eigenstates of quantum many-body systems are often used to define phases of matter in and out of equilibrium; however, experimentally accessing highly excited eigenstates is a challenging task, calling for alternative strategies to dynamically probe nonequilibrium phases. In this work, we characterize the dynamical properties of a disordered spin chain, focusing on the spin-glass regime. Using tensor-network simulations, we observe oscillatory behavior of local expectation values and bipartite entanglement entropy. We explain these oscillations deep in the many-body localized spin glass regime via a simple theoretical model. From perturbation theory, we predict the timescales up to which our analytical description is valid and confirm it with numerical simulations. Finally, we study the correlation length dynamics, which, after a long-time plateau, resumes growing in line with renormalization group (RG) expectations. Our work suggests that RG predictions can be quantitatively tested against numerical simulations and experiments, potentially enabling microscopic descriptions of dynamical phases in large systems.",クエンチダイナミクスを通じて、多体局所的なスピングラス相を調査します,量子多体系の固有状態は、多くの場合、均衡内外の物質の段階を定義するために使用されます。ただし、非常に励起された固有状態に実験的にアクセスすることは困難なタスクであり、非平衡フェーズを動的にプローブするための代替戦略を求めています。この作業では、スピンガラス領域に焦点を当てた、無秩序なスピンチェーンの動的特性を特徴付けます。テンソルネットワークシミュレーションを使用して、局所期待値と二部エンタングルメントエントロピーの振動挙動を観察します。これらの振動は、単純な理論モデルを介して、多体局所的なスピンガラス領域の奥深くに説明します。摂動理論から、分析の説明が有効なタイムスケールを予測し、数値シミュレーションで確認します。最後に、長年のプラトーの後、繰り込み群（RG）の期待に沿って成長することを再開する相関長ダイナミクスを研究します。私たちの研究は、RG予測は数値シミュレーションや実験に対して定量的にテストできることを示唆しており、大規模システムの動的フェーズの顕微鏡記述を潜在的に可能にします。
"Chunxiang Song, Yanan Liu, Guofeng Zhang, Huadong Mo, Daoyi Dong",Learning-Based Design of LQG Controllers in Quantum Coherent Feedback,"In this paper, we propose a differential evolution (DE) algorithm specifically tailored for the design of Linear-Quadratic-Gaussian (LQG) controllers in quantum systems. Building upon the foundational DE framework, the algorithm incorporates specialized modules, including relaxed feasibility rules, a scheduled penalty function, adaptive search range adjustment, and the ``bet-and-run'' initialization strategy. These enhancements improve the algorithm's exploration and exploitation capabilities while addressing the unique physical realizability requirements of quantum systems. The proposed method is applied to a quantum optical system, where three distinct controllers with varying configurations relative to the plant are designed. The resulting controllers demonstrate superior performance, achieving lower LQG performance indices compared to existing approaches. Additionally, the algorithm ensures that the designs comply with physical realizability constraints, guaranteeing compatibility with practical quantum platforms. The proposed approach holds significant potential for application to other linear quantum systems in performance optimization tasks subject to physically feasible constraints.",量子コヒーレントフィードバックにおけるLQGコントローラーの学習ベースの設計,このホワイトペーパーでは、量子システムにおける線形二頭筋ガウス（LQG）コントローラーの設計に特化した微分進化（DE）アルゴリズムを提案します。基礎DEフレームワークに基づいて、アルゴリズムには、リラックスした実現可能性ルール、スケジュールされたペナルティ関数、適応型検索範囲調整、「BET-and-RUN」初期化戦略など、特殊なモジュールが組み込まれています。これらの機能強化は、量子システムの独自の物理的実現可能性要件に対処しながら、アルゴリズムの探索と搾取機能を改善します。提案された方法は、植物と比較してさまざまな構成を持つ3つの異なるコントローラーが設計されている量子光学システムに適用されます。結果のコントローラーは優れたパフォーマンスを実証し、既存のアプローチと比較してLQGパフォーマンスの低い指数を達成します。さらに、このアルゴリズムは、設計が物理的な実現可能性の制約に準拠し、実用的な量子プラットフォームとの互換性を保証することを保証します。提案されているアプローチは、物理的に実行可能な制約を条件として、パフォーマンス最適化タスクにおける他の線形量子システムへの適用の重要な可能性を保持します。
"Luting Xu, Lingzhen Guo","Chirality, Nonreciprocity and Symmetries for a Giant Atom","Chiral and nonreciprocal quantum devices are crucial for signal routing and processing in a quantum network. In this work, we study the chirality and nonreciprocity of a giant atom coupled to a one-dimensional waveguide. We clarify that the chiral emission of the giant atom is not directly related to the time-reversal symmetry breaking but to the mirror-symmetry breaking. We propose a passive scheme to realize the chiral emission of a giant atom without breaking time-reversal symmetry by extending the legs of the giant atom. We find the time-reversal symmetry breaking via nonuniform coupling phases is artificial and thus cannot result in nonreciprocal single-photon scattering for the giant atom. The nonreciprocity of the giant atom can be obtained by the external dissipation of the giant atom that truly breaks the time-reversal symmetry. Our work clarifies the roles of symmetries in the chirality and nonreciprocity of giant-atom systems and paves the way for the design of on-chip functional devices with superconducting giant atoms.",巨大な原子のキラリティ、非相性、対称性,カイラルおよび非極性量子デバイスは、量子ネットワークでの信号ルーティングと処理に不可欠です。この作業では、1次元の導波路に結合された巨大な原子のキラリティと非再生性を研究します。巨大な原子のキラル放出は、時間反転対称性の破壊に直接関係しているのではなく、鏡口の断片に直接関係していることを明確にします。巨大な原子の脚を伸ばすことにより、時間と反転の対称性を破ることなく、巨大な原子のキラル放出を実現するための受動的なスキームを提案します。不均一なカップリングフェーズを介した時間反転対称性が人工的であるため、巨大な原子の非相性単一光子散乱をもたらすことはできません。巨大な原子の非相性は、時間反転対称性を真に破壊する巨大な原子の外部散逸によって得られることがあります。私たちの作品は、巨大原子システムのカイラリティと非再発性における対称性の役割を明確にし、超伝導巨大原子を備えたオンチップ機能デバイスの設計への道を開きます。
"Saini Lalita, Rathi Aparna, Kaushik Suvigya, Li-Hsien Yeh, Kalon Gopinadhan",Room-Temperature Deuterium Separation in van der Waals Gap Engineered Vermiculite Quantum Sieves,"As the demand for nuclear energy grows, enriching deuterium from hydrogen mixtures has become more important. However, traditional methods are either very energy-intensive because they require extremely cold temperatures, or they don't separate deuterium (D2) from regular hydrogen (H2) very well, with a D2/H2 selectivity of about 0.71. To achieve efficient deuterium separation at room temperature, we need materials with very tiny spaces, on an atomic scale. For the first time, we've successfully created a material with spaces just about 2.1 angstroms wide, which is similar in size to the wavelength of hydrogen isotopes at room temperature. This allows for efficient deuterium separation, with a much higher D2/H2 selectivity of about 2.20, meaning the material can separate deuterium from hydrogen much more effectively at room temperature. The smaller deuterium molecules are more likely to pass through these tiny spaces, showing that quantum effects play a key role in this process. In contrast, a material like graphene oxide, with larger spaces (around 4.0 angstroms) only shows a lower D2/H2 selectivity of approx 1.17, indicating weaker quantum effects. This discovery suggests that materials with very small, atomic-scale spaces could be key to the efficient separation of hydrogen isotopes at room temperature.",van der waalsギャップエンジニアリングバーミキュライト量子ふるいにおける室温重水素分離,原子力エネルギーの需要が高まるにつれて、水素混合物から重水素を濃縮することがより重要になりました。ただし、従来の方法は、非常に寒い温度を必要とするため、非常にエネルギー集約型のいずれかです。または、D2/H2選択性は約0.71で、通常の水素（H2）から大水（D2）を非常によく分離しません。室温で効率的な重水素分離を達成するには、原子スケールで非常に小さなスペースを持つ材料が必要です。初めて、室温での水素同位体の波長とサイズが類似している約2.1の空間のスペースを備えた材料を初めて作成しました。これにより、約2.20のD2/H2選択性がはるかに高いため、効率的な重水素分離が可能になります。つまり、材料は室温でより効果的に重水素をより効果的に分離できます。小さい重水素分子は、これらの小さな空間を通過する可能性が高く、このプロセスで量子効果が重要な役割を果たすことを示しています。対照的に、より大きな空間（約4.0アンストローム）を持つグラフェン酸化グラフェンのような材料は、約1.17のD2/H2選択性が低いことを示しており、量子効果が弱いことを示しています。この発見は、非常に小さな原子スケールスペースを持つ材料が、室温での水素同位体の効率的な分離の鍵となる可能性があることを示唆しています。
Oliver H. E. Philcox,Searching for Inflationary Physics with the CMB Trispectrum: 3. Constraints from Planck,"Is there new physics hidden in the four-point function of the cosmic microwave background (CMB)? We conduct a detailed analysis of the Planck PR4 temperature and polarization trispectrum for $\ell\in[2,2048]$. Using the theoretical and computational tools developed in Paper 1 and Paper 2, we search for 33 template amplitudes, encoding a variety of effects from inflationary self-interactions to particle exchange. We find no evidence for primordial non-Gaussianity and set stringent constraints on both phenomenological amplitudes and couplings in the inflationary Lagrangian. Due to the use of optimal estimators and polarization data, our constraints are highly competitive. For example, we find $\sigma(g_{\rm NL}^{\rm loc})=4.8\times 10^4$ and $\tau_{\rm NL}^{\rm loc} <1500$ (95\% CL), a factor of two improvement on Effective Field Theory amplitudes, and a $43\sigma$ detection of gravitational lensing. Many templates are analyzed for the first time, such as direction-dependent trispectra and the collapsed limit of the `cosmological collider', across a range of masses and spins. We perform a variety of validation tests; whilst our results are stable, the most relevant systematics are found to be lensing bias, residual foregrounds, and mismatch between simulations and data. The techniques discussed in this series can be extended to future datasets, allowing the primordial Universe to be probed at even higher sensitivity.",CMB Trispectrumを使用したインフレ物理学の検索：3。Planckからの制約,"宇宙マイクロ波背景（CMB）の4点関数に隠された新しい物理学はありますか？ $ \ ell \ in [2,2048] $について、Planck PR4温度と偏光トリセプタムの詳細な分析を実施します。 Paper 1およびPaper 2で開発された理論的および計算ツールを使用して、33のテンプレート振幅を検索し、インフレの自己融合から粒子交換までのさまざまな効果をコードします。原始非ガウス性の証拠は見つかりませんでしたし、インフレラグランジアンの現象学的振幅とカップリングの両方に厳しい制約を設定しました。最適な推定量と偏光データの使用により、当社の制約は非常に競争力があります。たとえば、$ \ sigma（g _ {\ rm nl}^{\ rm loc}）= 4.8 \ times 10^4 $および$ \ tau _ {\ rm nl}^{\ rm loc} <1500 $（95 \％cl）、効果的なフィールド理論振幅の2つの改善の係数、および重力レンズの43ドルの\ sigma $検出。さまざまな大衆とスピンにわたって、方向依存のTrispeptraや「宇宙論的コリダー」の崩壊した限界など、多くのテンプレートが初めて分析されます。さまざまな検証テストを実行します。私たちの結果は安定していますが、最も関連性の高い系統学は、シミュレーションとデータの間のレンズバイアス、残留前景、およびミスマッチであることがわかります。このシリーズで説明されている手法は、将来のデータセットに拡張でき、原始宇宙をさらに高い感度で調査することができます。"
"Ertuğrul Ekiz, Emre Onur Kahya, Utku Zorba",Quantization of Carrollian Fermions,"We provide the first example of interacting quantized Carrollian Dirac fermions and investigate their discrete symmetries, including charge conjugation (C), parity (P), and time reversal (T) transformations. As a toy model, we couple these fermions to a Carrollian scalar field using Carrollian Yukawa theory and compute the tree-level diagram, revealing an ultralocal interaction between the Carrollian fermions and the scalar field. This interaction, widely known as a Dirac delta interaction with time-dependent factor, frequently appears in quantum physics. We then address the renormalization of the theory by employing the Wilsonian procedure at one-loop order. Furthermore, we analyze the fixed points and stability properties of Carrollian Yukawa theory, comparing them with their relativistic counterparts. Beyond the specific Yukawa model studied here, we expect that our framework will have broader applications in Carrollian physics, particularly in understanding ultralocal interactions and their role in condensed matter systems, where similar phenomena arise in strongly correlated and non-relativistic regimes.",キャロルのフェルミオンの量子化,相互作用する量子化されたキャロルのディラックフェルミオンの最初の例を提供し、電荷の共役（C）、パリティ（P）、および時間反転（T）変換を含む個別の対称性を調査します。おもちゃのモデルとして、これらのフェルミオンをカロルの卵川理論を使用してカロルのスカラーフィールドと結合し、樹木レベルの図を計算し、キャロルのフェルミオンとスカラーフィールドの間の超焦点相互作用を明らかにします。この相互作用は、時間依存因子とのディラックデルタ相互作用として広く知られており、量子物理学にしばしば現れます。次に、ウィルソンの手順をワンループ順で使用することにより、理論の繰り込みに対処します。さらに、カロルの吉川理論の固定点と安定性特性を分析し、それらを相対論的な対応物と比較します。ここで研究されている特定のユカワモデルを超えて、私たちのフレームワークは、特に超焦点相互作用と凝縮物質システムにおけるそれらの役割を理解する上で、カロルの物理学に幅広いアプリケーションを持つことを期待しています。
