authors,title,abstract,authors_trans,abstract_trans
"Jun Gao, ChongYang Liu, Mengyang Li, XiaoMin Shen, Hongxi Xing, Yuxiang Zhao, Yiyu Zhou",Global analysis of fragmentation functions to light neutral hadrons,"Fragmentation functions (FFs) are crucial non-perturbative components in quantum chromodynamics (QCD), playing a vital role in predictions and understanding of the hadronization process. In this paper, we present the FFs for $K_S^0$, $\eta$, $\pi^0$ mesons, and $\Lambda$ baryons in the context of global QCD analysis. The data included in the fit are from single inclusive $e^+ e^-$ annihilation (SIA), semi-inclusive deep-inelastic scattering (SIDIS) and proton-proton collisions, with kinematic cuts carefully applied to ensure validity of collinear factorization and perturbative QCD expansion. For the first time, data from SIDIS and hadron-in-jet production in SIA have been incorporated into the extraction of FFs for light-flavor neutral hadrons. Our analysis reveals that these data play a critical role in constraining the gluon distribution, and in distinguishing between different quark flavors. Pulls from different datasets are also studied by performing alternative fits with systematically subtracting groups of data from the nominal fit. For the quality of the fit, good $\chi^2$ values are achieved for most of the datasets, and FFs are generally well constrained within the momentum fraction region $\pqty{0.1, 0.5}$. The extracted $K_S^0$ fragmentation functions, together with the $K_S^0$ FFs constructed from $K^{\pm}$ FFs via isospin symmetry, are used to test isospin symmetry in kaon fragmentation. Although a definitive conclusion cannot be reached yet, these studies have identified several potential measurements that can be performed at existing facilities, which may ultimately help us to arrive at a conclusive answer. With the comprehensive species of FFs extracted within the NPC framework, we are able to perform a test on the momentum sum rule with the light-flavor charged and neutral hadrons.",光の中性ハドロンに対する断片化関数のグローバル分析,断片化関数（FFS）は、量子クロモダイナミクス（QCD）における重要な非摂動成分であり、ハドロン化プロセスの予測と理解に重要な役割を果たします。この論文では、グローバルQCD分析のコンテキストで$ k_s^0 $、$ \ eta $、$ \ pi^0 $ meson、および$ \ lambda $ bararyonsのFFSを紹介します。 FITに含まれるデータは、単一の包括的$ e^+ e^ -  $ gention（SIA）、半包括的な深層弾性散乱（SIDIS）、およびプロトンプロトン衝突からのものであり、共生因子化と摂動QCD拡張の妥当性を確保するために、運動学的カットが慎重に適用されます。 SIAのSIDISとHadron-in-Jetの生産のデータは、初めて、光フレーバー中性ハドロンのFFSの抽出に組み込まれました。私たちの分析により、これらのデータは、グルオン分布を制約し、異なるクォークフレーバーを区別する上で重要な役割を果たしていることが明らかになりました。異なるデータセットからのプルは、公称フィットからデータのグループを体系的に減算する代替Fitを実行することによっても調査されます。フィットの品質については、ほとんどのデータセットで適切な$ \ chi^2 $値が達成され、FFは一般に運動量分数領域$ \ pqty {0.1、0.5} $内で十分に制約されます。抽出された$ k_s^0 $断片化関数は、イソスピン対称を介して$ k^{\ pm} $ ffsから構築された$ k_s^0 $ ffsを使用して、Kaon断片化のイソスピン対称性をテストするために使用されます。決定的な結論にはまだ到達することはできませんが、これらの研究では、既存の施設で実行できるいくつかの潜在的な測定値が特定されており、最終的には決定的な答えに到達するのに役立ちます。包括的な種のFFSがNPCフレームワーク内で抽出されたことで、光フレーバーが充電されたニュートラルなハドロンを使用して、運動量合計ルールでテストを実行できます。
"Chence Niu, Elnaz Irannezhad, Casey Myers, Vinayak Dixit",Quantum Computing in Transport Science: A Review,"Quantum computing, leveraging the principles of quantum mechanics, has been found to significantly enhance computational capabilities in principle, in some cases beyond classical computing limits. This paper explores quantum computing's potential to address complex, large-scale problems in transportation systems. It focuses on three principal paradigms: Gate-based quantum computing, Quantum annealing, and Quantum machine learning, which, though based on gate-based quantum computing, is treated as distinct due to its unique methods and applications. Each paradigm's foundational concepts, practical applications, and potential impacts on the field are discussed to provide a comprehensive overview of quantum computing strategies and their future implications.",輸送科学における量子コンピューティング：レビュー,量子力学の原則を活用する量子コンピューティングは、原則として計算能力を大幅に強化することがわかっています。このペーパーでは、輸送システムにおける複雑で大規模な問題に対処する量子コンピューティングの可能性を調査します。ゲートベースの量子コンピューティング、量子アニーリング、および量子機械学習の3つの主要なパラダイムに焦点を当てています。これは、ゲートベースの量子コンピューティングに基づいていますが、そのユニークな方法とアプリケーションのために明確な扱われます。各パラダイムの基本的な概念、実用的なアプリケーション、およびフィールドへの潜在的な影響については、量子コンピューティング戦略とその将来の意味の包括的な概要を提供するために議論されています。
"Liang-Liang Sun, Armin Tavakoli, René Schwonnek, Matthias Kleinmann, Zhen-Peng Xu, Sixia Yu",Specifying the Intrinsic Back-action of a General Measurement,"Understanding the invasive nature of quantum measurement and its implications in quantum foundations and information science demands a mathematically rigorous and physically well-grounded characterization of intrinsic back-action in general measurement processes. However, such a framework remains elusive, leaving a critical gap in quantum theory. Here, we address this issue by conceptualizing a general quantum measurement as a reduction of extended projection measurements ensured by Naimark's theorem and, derive a state-updating rule for the concerned measurement as a reduction of the projective measurements postulate. Our framework provides a detailed analysis by explicitly decomposing the disturbance effects into two distinct contributions: those arising from the measurement elements themselves and those resulting from the dilation process. Notably, this formulation naturally recovers the projection postulate in the case of projective measurements. Beyond providing insights into joint measurability, non-disturbance, our rule establishes quantitaive connections between intrinsic disturbance and other fundamental quantum features, such as randomness, uncertainty, and information gain.",一般的な測定の固有の背行動を指定します,量子測定の侵襲的な性質と量子基礎と情報科学におけるその意味を理解するには、一般的な測定プロセスにおける内因性の逆アクションの数学的に厳密で物理的に根拠のある特性評価が必要です。ただし、このようなフレームワークはとらえどころのないままであり、量子理論に批判的なギャップを残しています。ここでは、Naimarkの定理によって保証された拡張投影測定の減少として一般的な量子測定を概念化することにより、この問題に対処し、射影測定の仮定の減少として、関係する測定の状態を導き出します。私たちのフレームワークは、騒動効果を2つの異なる貢献度に明示的に分解することにより、詳細な分析を提供します。測定要素自体と拡張プロセスから生じるものです。特に、この定式化は、射影測定の場合に予測仮定を自然に回復することです。関節の測定可能性、非妨害に関する洞察を提供するだけでなく、私たちのルールは、内因性の妨害とランダム性、不確実性、情報のゲインなどの他の基本的な量子機能との間の定量的なつながりを確立します。
"Lewis Wooltorton, Peter Brown, Roger Colbeck",Bipartite entanglement is sufficient for standard device-independent conference key agreement,"Conference key agreement (CKA) aims to establish shared, private randomness among many separated parties in a network. Device-independent (DI) CKA is a variant in which no assumptions are placed on the nature of the source, or the measurements performed by each party. So far, DICKA protocols largely fall into two categories: those that rely on violating a joint Bell inequality using genuinely multi-partite entangled states, and those that concatenate many bipartite protocols. The question of whether a hybrid protocol exists, where a multi-partite Bell inequality can be violated using only bipartite entanglement, was asked by Grasselli et al. in [Quantum 7, 980, (2023)]. We answer this question affirmatively, by constructing an asymptotically secure DICKA protocol achieving the same rate as the concatenation of bipartite DIQKD, yet relying on a single joint Bell violation. Our results prompt further discussion on the benefits of multi-partite entanglement for DICKA over its bipartite alternative, and we give an overview of different arguments for near-term devices.",二部の絡み合いは、標準のデバイスに依存しない会議の主要契約に十分です,Conference Key Agreement（CKA）は、ネットワーク内の多くの分離された関係者の間で共有された私的なランダム性を確立することを目指しています。デバイスに依存しない（DI）CKAは、ソースの性質、または各当事者が実行する測定値に仮定が置かれないバリアントです。これまでのところ、Dickaプロトコルは、主に2つのカテゴリに分類されます。本物のマルチパルティテの絡み合った状態を使用した共同ベルの不平等に違反するものと、多くの二部プロトコルを連結するものです。ハイブリッドプロトコルが存在するかどうかの問題、マルチパーティテの鐘の不平等には、二部の絡み合いのみを使用して違反する可能性があることは、Grasselli et al。によって尋ねられました。 [Quantum 7、980、（2023）]で。この質問は、漸近的に安全なディッカプロトコルを構築することにより、二部diqKDの連結と同じ割合を達成し、単一の共同ベル違反に依存しています。私たちの結果は、Dickaの多党のエンタングルメントが二部の代替案をめぐるメリットについてさらに議論し、短期的なデバイスのさまざまな議論の概要を説明します。
"Naritaka Oshita, Emanuele Berti, Vitor Cardoso",Unstable chords and destructive resonant excitation of black hole quasinormal modes,"The quasinormal mode spectrum of black holes is unstable against small modifications of the radial potential describing massless perturbations. We study how these small modifications affect the convergence of the quasinormal mode expansion and the mode excitation by computing the mode amplitudes from first principles, without relying on any fitting procedure. We show that the decomposition of the prompt ringdown waveform is not unique: small modifications in the radial potential produce new quasinormal mode ''basis sets'' that can improve the convergence of the quasinormal mode expansion, even capturing the late-time tail. We also study avoided crossings and exceptional points of the Kerr and Kerr-de Sitter spectrum. We show that while the mode amplitude can be resonantly excited, modes that exhibit avoided crossing destructively interfere with each other, so that the prompt ringdown waveform remains stable.",不安定な和音とブラックホールの第quasinorモードの破壊的な共鳴励起,ブラックホールの準モードモードスペクトルは、質量のない摂動を記述する放射状電位の小さな変更に対して不安定です。これらの小さな変更は、フィッティング手順に依存することなく、第一原理からモード振幅を計算することにより、準定量モード拡張の収束とモード励起にどのように影響するかを研究します。プロンプトリングダウン波形の分解が一意ではないことを示します。ラジアル電位の小さな修正は、新しい準周波数モード「基底セット」を生成し、準定量モード拡張の収束を改善し、遅い尾を捕獲することさえあります。また、KerrおよびKerr-De Sitter Spectrumの交差点と例外的なポイントを回避したことを研究します。モード振幅は共鳴して励起される可能性がありますが、示すモードは互いに破壊的に干渉することを避け、プロンプトの着信波形が安定したままであることを示します。
"Cong Li, Bing Dong",Quantum Resistor-Capacitor Circuit with two Majorana Bound States,"In this paper, we derive the equations of motion for a system composed of a spinless quantum dot coupled to two normal leads and two Majorana bound states (MBSs), utilizing the auxiliary-mode expansion method and the nonequilibrium Green function technique. Subsequently, we use these equations to analyze the linear conductance, adiabatic linear capacitance, and adiabatic linear relaxation resistance of the system. We find that when the phase difference between the two MBSs is an integer multiple of $\pi$, the MBSs enter the zero mode, leading to the complete suppression of the linear relaxation resistance. In this case, the relaxation resistance is highly sensitive to the MBSs modes. On the other hand, when the phase difference is not an integer multiple of $\pi$, the linear conductance is fully suppressed. Furthermore, the linear relaxation resistance remains completely suppressed, even when the MBSs are not in the zero mode, and the system loses its sensitivity to the MBSs modes.",2つのマヨラ系結合状態を備えた量子抵抗器キャパシタ回路,このホワイトペーパーでは、補助モード拡張方法と非平衡緑関数関数技術を利用して、2つの通常のリードと2つのマヨラ系結合状態（MBSS）に結合したスピンレス量子ドットで構成されるシステムの運動方程式を導き出します。その後、これらの方程式を使用して、システムの線形コンダクタンス、断熱線形容量、および断熱線形緩和抵抗を分析します。 2つのMBSS間の位相差が$ \ Pi $の整数倍である場合、MBSSはゼロモードに入り、線形緩和抵抗の完全な抑制につながることがわかります。この場合、緩和抵抗はMBSSモードに非常に敏感です。一方、位相差が$ \ pi $の整数倍でない場合、線形コンダクタンスは完全に抑制されます。さらに、MBSSがゼロモードにない場合でも、線形緩和抵抗は完全に抑制されたままであり、システムはMBSSモードに対する感度を失います。
"András Czégel, Boglárka G.-Tóth",A Quantum Constraint Generation Framework for Binary Linear Programs,"We propose a new approach to utilize quantum computers for binary linear programming (BLP), which can be extended to general integer linear programs (ILP). Quantum optimization algorithms, hybrid or quantum-only, are currently general purpose, standalone solvers for ILP. However, to consider them practically useful, we expect them to overperform the current state of the art classical solvers. That expectation is unfair to quantum algorithms: in classical ILP solvers, after many decades of evolution, many different algorithms work together as a robust machine to get the best result. This is the approach we would like to follow now with our quantum 'solver' solutions. In this study we wrap any suitable quantum optimization algorithm into a quantum informed classical constraint generation framework. First we relax our problem by dropping all constraints and encode it into an Ising Hamiltonian for the quantum optimization subroutine. Then, by sampling from the solution state of the subroutine, we obtain information about constraint violations in the initial problem, from which we decide which coupling terms we need to introduce to the Hamiltonian. The coupling terms correspond to the constraints of the initial binary linear program. Then we optimize over the new Hamiltonian again, until we reach a feasible solution, or other stopping conditions hold. Since one can decide how many constraints they add to the Hamiltonian in a single step, our algorithm is at least as efficient as the (hybrid) quantum optimization algorithm it wraps. We support our claim with results on small scale minimum cost exact cover problem instances.",バイナリ線形プログラムの量子制約生成フレームワーク,バイナリ線形プログラミング（BLP）に量子コンピューターを利用するための新しいアプローチを提案します。これは、一般的な整数線形プログラム（ILP）に拡張できます。 Quantum Optimization Algorithms（ハイブリッドまたは量子のみ）は、現在、ILPのスタンドアロンソルバーである一般的な目的です。ただし、それらを実質的に有用であると考えるために、現在の最新のクラシックソルバーを過度にパフォーマンスすることが期待されています。その期待は量子アルゴリズムに対する不公平です。古典的なILPソルバーでは、何十年もの進化の後、多くの異なるアルゴリズムが堅牢なマシンとして連携して最良の結果を得ます。これは、Quantum 'Solver' Solutionsで今すぐフォローしたいアプローチです。この研究では、適切な量子最適化アルゴリズムを量子通信の古典的な制約生成フレームワークに包みます。最初に、すべての制約をドロップして問題を緩和し、量子最適化サブラウチンのためにそれをイジングハミルトニアンにエンコードします。次に、サブルーチンの溶液状態からサンプリングすることにより、最初の問題の制約違反に関する情報を取得し、そこからハミルトニアンに導入する必要があるカップリング用語を決定します。結合項は、初期バイナリ線形プログラムの制約に対応しています。次に、実行可能な解決策に到達するか、その他の停止条件が保持されるまで、新しいハミルトニアンの上に再び最適化します。単一のステップでハミルトニアンに追加される制約の数を決定できるため、アルゴリズムは少なくとも（ハイブリッド）量子最適化アルゴリズムと同じくらい効率的です。小規模な最小コストの正確なカバー問題インスタンスに関する結果で、当社の主張をサポートしています。
Yan Peng,Lower bound on the orbital period of Kerr-Newman black holes,"Based on the orbital period of Kerr black holes, Hod proposed a conjecture that a general lower bound on the orbital period may exist. In this work, we examined this bound by exploring the orbital period of Kerr-Newman black holes using analytical and numerical methods. By choosing different charge and spin of Kerr-Newman black holes, we found a lower bound for the orbital period of Kerr-Newman black holes as $T(r)\geqslant 4\pi M$, where $r$ is the orbital radius, $T(r)$ is the orbital period observed from infinity and $M$ is the black hole mass. This bound is just the same as Hod's conjectured lower bound. So our results further demonstrated that Hod's lower bound may be a general property in black hole spacetimes.",Kerr-Newman Black Holesの軌道期間の下限,カーブラックホールの軌道周期に基づいて、HODは軌道の一般的な下限が存在する可能性があるという推測を提案しました。この作業では、分析方法と数値的方法を使用して、Kerr-Newmanブラックホールの軌道周期を探索することにより、この境界を調べました。 Kerr-Newmanのブラックホールの異なる充電とスピンを選択することにより、Kerr-Newmanブラックホールの軌道の軌道の期間の下限を$ T（R）\ Geqslant 4 \ Pi M $として見つけました。ここで、$ r $は軌道半径です。このバウンドは、HODの推測された下限とまったく同じです。したがって、我々の結果はさらに、HODの下限がブラックホールの時空の一般的な特性である可能性があることを実証しました。
"Puspita Parui, Bheema Lingam Chittari",Valley-polarized Quantum Anomalous Hall and Topological Metal Phase in Rashba induced pseudospin-1 lattice,"We study the topological properties of Rashba spin-orbit coupling and exchange coupling induced pseudospin-$1$ system Dice lattice under the influence of a staggered electric potential and magnetization. The band structure and topological phases of the system are investigated and compared with pseudospin-$\frac{1}{2}$ system honeycomb lattice. Under individual influence of the staggered electric field and magnetization, the system undergoes a distinct phase transition: (i) a staggered electric potential drives the system from a quantum anomalous Hall $(C_n = 2)$ to a valley polarized quantum anomalous Hall phase $(C_n = -1)$ associated with edge modes with a flip in the chirality; while (ii) a staggered magnetization changes the system to a topological metal associated with unconventional antichiral edge bands, from a topological insulator. These results are further supported by calculations of the Chern numbers, Hall conductance, zigzag, and armchair edge states. Our findings enhance the understanding of new topological phases in the 2D pseudospin-1 system and open up a new platform to explore the anti-chiral edge states.",ラシュバにおける谷偏光量子異常ホールとトポロジー金属相は、擬似スピン-1格子を誘発しました,Rashba Spin-Orbitカップリングと交換カップリングのトポロジカル特性を研究しました。システムのバンド構造とトポロジーフェーズが調査され、Pseudospin-$ \ frac {1} {2} $システムハニカム格子と比較されます。ずらされた電界と磁気化の個々の影響の下で、システムは明確な位相遷移を受けます。（i）スティュガードされた電位は、Quantum Anomalous Hall $（c_n = 2）$からシステムを偏りのある量子異常ホールフェーズ$（c_n = -1）$まで、キラル性のフリップを持つエッジモードに関連しています。 （ii）ずらされた磁化により、システムは、トポロジーの絶縁体から、型破りな抗菌エッジバンドに関連するトポロジー金属に変化します。これらの結果は、チェーン数、ホールコンダクタンス、ジグザグ、アームチェアエッジ状態の計算によってさらにサポートされています。私たちの調査結果は、2D Pseudospin-1システムの新しいトポロジーフェーズの理解を高め、反キラルのエッジ状態を探索するための新しいプラットフォームを開きます。
