authors,title,abstract,authors_trans,abstract_trans
"Riasat Ali, Xia Tiecheng, Rimsha Babar","Evaluation of physical properties of Kiselev like AdS spacetime in the context of $f(R,~T)$ gravity under the impact of quantum gravity","The developments of the $f(R,~T)$ gravity theory, which is a logical expansion of general relativity according to Einstein, inspire us to examine this theory in greater detail and take up our study to obtain a modification of the Kiselev-like AdS black holes scenario. In this study, we employ the semi-classical Hamilton-Jacobi procedure to investigate the Hawking temperature $(T_{H})$ for 4-dimensional Kiselev-like AdS BHs in the context of $f(R,~T)$ gravity. We derive the temperature using a standard formula for Kiselev-like AdS BHs in the context of $f(R,~T)$ gravity. The relativistic field equation in the context of the generalized uncertainty principle (GUP), the semi-classical Hamilton-Jacobi procedure, and the WKB strategy are used to tunnel boson particles into the horizon under the effect of quantum gravity as well as Hawking temperature and also use this temperature to compute entropy corrections. Further, we study the $f(R,~T)$ gravity ($\zeta$), quantum gravity ($\alpha$), and particle kinetic energy ($\Xi$) effect on both temperature and entropy.",$ f（r、〜t）$ $ $のコンテキストにおけるkiselevのような広告のような物理的特性の評価量量重力の影響下での重力,アインシュタインによると一般的な相対性理論の論理的拡大である$ f（r、〜t）$の重力理論の開発は、この理論をより詳細に調べ、Kiselev-の修正を得るために研究を取り上げるように促します。広告のブラックホールシナリオのように。この研究では、半古典的なハミルトン - ヤコビ手順を採用して、$ f（r、〜t）$ gravityのコンテキストで、4次元Kiselev-like Ads BHSのホーキング温度$（T_ {H}）$を調査します。 。 $ f（r、〜t）$ gravityのコンテキストで、Kiselev-like Ads BHSの標準式を使用して温度を導き出します。一般化された不確実性原理（GUP）、半古典的なハミルトン - ヤコビ手順、およびWKB戦略のコンテキストにおける相対論的フィールド方程式を使用して、量子重力とhawking温度と携帯の効果の下でボソン粒子を水平にトンネルします。また、この温度を使用して、エントロピー補正を計算します。さらに、$ f（r、〜t）$ gravity（$ \ zeta $）、Quantum Gravity（$ \ alpha $）、および粒子速度エネルギー（$ \ xi $）の両方の温度とエントロピーに影響を研究します。
"Alexander E. Ulanov, Bastian Ruhnke, Thibault Wildi, Tobias Herr",Quadrature squeezing in a nanophotonic microresonator,"Squeezed states of light are essential for emerging quantum technology in metrology and information processing. Chip-integrated photonics offers a route to scalable and efficient squeezed light generation, however, parasitic nonlinear processes and optical losses remain significant challenges. Here, we demonstrate single-mode quadrature squeezing in a photonic crystal microresonator via degenerate dual-pump spontaneous four-wave mixing. Implemented in a scalable, low-loss silicon-nitride photonic-chip platform, the microresonator features a tailored nano-corrugation that modifies its resonances to suppress parasitic nonlinear processes. In this way, we achieve an estimated 7.8 dB of on-chip squeezing in the bus waveguide, with potential for further improvement. These results open a promising pathway toward integrated squeezed light sources for quantum-enhanced interferometry, Gaussian boson sampling, coherent Ising machines, and universal quantum computing.",ナノフォトニックマイクロソネーターで絞り込んでいます,絞られた光の状態は、計測と情報処理における新しい量子技術に不可欠です。チップ統合フォトニクスは、スケーラブルで効率的な絞られた光発生へのルートを提供しますが、寄生的な非線形プロセスと光学損失は依然として大きな課題です。ここでは、縮退したデュアルポンプの自発的な4波ミキシングを介して、フォトニッククリスタルマイクロソネーターで絞り込まれたシングルモードの四角化を示します。スケーラブルで低湿性の低いシリコンニトリドフォトニックチッププラットフォームに実装されたマイクロソネーターは、寄生的な非線形プロセスを抑制するために共鳴を変更するカスタマイズされたナノ腐食を特徴としています。このようにして、バス導波路で推定7.8 dBのオンチップ絞りを達成し、さらに改善する可能性があります。これらの結果は、量子強度の干渉測定、ガウスボソンサンプリング、コヒーレントISINGマシン、およびユニバーサル量子コンピューティングのための統合された絞られた光源への有望な経路を開きます。
"Alessandro Luongo, Varun Narasimhachar, Adithya Sireesh",Optimized circuits for windowed modular arithmetic with applications to quantum attacks against RSA,"Windowed arithmetic [Gidney, 2019] is a technique for reducing the cost of quantum arithmetic circuits with space--time tradeoffs using memory queries to precomputed tables. It can reduce the asymptotic cost of modular exponentiation from $O\left(n^3\right)$ to $O\left(n^3/\log^2 n\right)$ operations, resulting in the current state-of-the-art compilations of quantum attacks against modern cryptography. In this work we introduce four optimizations to windowed modular exponentiation. We (1) show how the cost of unlookups can be reduced by $66\%$ asymptotically in the number of bits, (2) illustrate how certain addresses can be bypassed, reducing both circuit depth and the overall lookup cost, (3) demonstrate that multiple lookup--addition operations can be merged into a single, larger lookup at the start of the modular exponentiation circuit, and (4) reduce the depth of the unary conversion for unlookups. On a logical level, this leads to a $3\%$ improvement in Toffoli count and Toffoli depth for modular exponentiation circuits relevant to cryptographic applications. This translates to some improvements on [Gidney and Ekerå, 2021]'s factoring algorithm: for a given number of physical qubits, our improvements show a reduction in the expected runtime from $2\%$ to $6\%$ for factoring $\mathsf{RSA}$-$2048$ integers.",RSAに対する量子攻撃へのアプリケーションを備えたウィンドウモジュラー算術のための最適化された回路,Windowed Arithmetic [Gidney、2019]は、メモリクエリを使用して事前計算されたテーブルを使用して、スペースタイムトレードオフで量子算術回路のコストを削減するための手法です。 $ o \ left（n^3 \ right）$から$ o \ left（n^3/\ log^2 n \ right）$ $ $にモジュラー指数の漸近コストを削減できます。 - 現代の暗号化に対する量子攻撃のアートコンピレーション。この作業では、ウィンドウモジュールの指数に4つの最適化を紹介します。 （1）ビット数で非lookupsのコストが漸近的に66ドル削減される方法を示します。その複数の検索 - 付加操作は、モジュラーエクスポンゲーション回路の開始時に単一の大きなルックアップにマージされ、（4）統一変換の深さを減らすことができます。 unlookups。論理レベルでは、これにより、暗号化アプリケーションに関連するモジュラーエクスポンションサーキットのトッフォリカウントとトッフォリ深度の3ドルの改善につながります。これは、[Gidney andEkerå、2021]のファクタリングアルゴリズムのいくつかの改善につながります。 {rsa} $  -  $ 2048 $ INTEGERS。
"Yanran Shi, Bo Xie, Fengfan Ren, Xinyu Cai, Zhongqing Guo, Qiao Li, Xin Lu, Zhongkai Liu, Jianpeng Liu",Fractional topological states in rhombohedral multilayer graphene modulated by kagome superlattice,"Fractional quantum anomalous Hall effects realized in twisted bilayer MoTe$_2$ and multilayer-graphene-based moiré heterostructures have captured a tremendous growth of interest. In this work, we propose that rhombohedral multilayer graphene coupled with an artificial kagome superlattice potential is a new platform to realize various fractional topological phases. Taking Bernal bilayer graphene as the simplest example, when it is placed on top of a prepatterned SiO$_2$ substrate with periodic arrays of holes arranged into kagome lattice, the system would be subject to a tunable kagome superlattice potential once an electrostatic voltage drop between the top and bottom gates is applied. Then, we theoretically study the electronic band structures, topological properties, and quantum geometric properties of the Bloch states of Bernal bilayer graphene coupled with a realistic kagome superlattice potential, which is benchmarked by transport measurements in the weak superlattice-potential and large filling factor regime. We find that the system may exhibit nearly ideal topological flat bands in a substantial region of the parameter space spanned by superlattice constant and electrostatic potential strength. When these topological flat bands are fractionally filled, exact diagonalization calculations suggest that the system would exhibit rich fractional topological phases at 1/3, 2/3, 2/5, 3/5 and 1/2 fillings including both fractional Chern insulators and anomalous composite Fermi liquids under zero magnetic field.",カゴメの超格子によって調節された菱面体多層グラフェンの分数トポロジー状態,ねじれた二重層のモート$ _2 $と多層 - グラフェンベースのモアレヘテロ構造で実現された分数の量子異常なホール効果は、関心の大きな成長を獲得しました。この作業では、人工カゴメの超格子ポテンシャルと組み合わされた菱面体多層グラフェンは、さまざまな分数トポロジーフェーズを実現するための新しいプラットフォームであることを提案します。 Bernal Bilayer Grapheneを最も簡単な例として採取します。これは、カゴメ格子に配置された定期的な穴の配列を備えた事前散乱SiO $ _2 $基板の上に配置された場合、システムは静電圧電圧が低下すると調整可能なKagome上層ポテンシャルの影響を受けます。上部と下のゲートが適用されます。次に、ベルナル双層グラフェンのブロック状態の電子帯域構造、トポロジカル特性、および量子幾何学的特性と、現実的なカゴメの超格子ポテンシャルと理論的に研究します。 。システムは、超格子定数と静電ポテンシャル強度に及ぶパラメーター空間の実質的な領域で、ほぼ理想的なトポロジーフラットバンドを示すことがわかります。これらのトポロジーフラットバンドが部分的に満たされている場合、正確な対角線化計算は、システムが分数チャーン絶縁体と異常を含む1/3、2/3、2/5、3/5、および1/2の詰め物で豊富な分数トポロジーフェーズを示すことを示唆しています。ゼロ磁場の下の複合フェルミ液。
"Yuan-Fei Wei, Zhi-Ming Tang, Xue-Ren Huang, Ming-Lu Bu, Xin-Ye Xu, Yi-Yu Cai","Relativistic many-body calculations of multipole (E1, M1, E2, M2) transition properties in Al II","We present systematic relativistic many-body calculations of multipole transition properties for singly charged aluminum ion (Al II) using a method that combines the configuration interaction and many-body perturbation theory (CI+MBPT). Our calculations cover the 103 lowest energy levels in Al II. For five key low-lying configurations (3s2 1S0, 3s3p 3P0, 3s3p 3P1, 3s3p 3P2, 3s3p 1P1), we tabulate the transition wavelengths, reduced matrix elements, transition probabilities, and oscillator strengths for about 400 electric dipole (E1), magnetic dipole (M1), electric quadrupole (E2), and magnetic quadrupole (M2) transitions arising from these levels. Our calculated values agree well with available experimental data and other high-precision theoretical calculations, with typical deviations on the order of 1%. Notably, we report over 80% of these transition lines as previously unreported, significantly expanding the existing spectroscopic database for Al II. These results can serve as a valuable reference resource for ongoing precision quantum metrology as well as astrophysical spectroscopy involving Al II ion.",AL IIの多重極（E1、M1、E2、M2）遷移特性の相対論的多体計算,構成相互作用と多体摂動理論（CI+MBPT）を組み合わせた方法を使用して、単一帯電アルミニウムイオン（AL II）の多重極遷移特性の系統的相対論的多体計算を提示します。私たちの計算は、AL IIの103の最低エネルギーレベルをカバーしています。 5つの主要な低地構成（3S2 1S0、3S3p 3P0、3S3p 3p1、3S3p 3p2、3S3p 1p1）については、遷移波長、還元マトリックス要素、遷移確率、約400電気双極子（E1）、磁気濃度の縮小を集計します。双極子（M1）、電気四重極（E2）、および磁気これらのレベルから生じる四重極（M2）遷移。計算された値は、利用可能な実験データおよびその他の高精度の理論計算とよく一致し、1％の典型的な逸脱とともに。特に、これらの遷移線の80％以上が以前に報告されていないと報告し、AL IIの既存の分光データベースを大幅に拡大しています。これらの結果は、AL IIイオンを含む天体物理分光法と同様に、継続的な精密量子計測の貴重な参照リソースとして機能します。
"Aritra Bal, Markus Klute, Benedikt Maier, Melik Oughton, Eric Pezone, Michael Spannowsky",1 Particle - 1 Qubit: Particle Physics Data Encoding for Quantum Machine Learning,"We introduce 1P1Q, a novel quantum data encoding scheme for high-energy physics (HEP), where each particle is assigned to an individual qubit, enabling direct representation of collision events without classical compression. We demonstrate the effectiveness of 1P1Q in quantum machine learning (QML) through two applications: a Quantum Autoencoder (QAE) for unsupervised anomaly detection and a Variational Quantum Circuit (VQC) for supervised classification of top quark jets. Our results show that the QAE successfully distinguishes signal jets from background QCD jets, achieving superior performance compared to a classical autoencoder while utilizing significantly fewer trainable parameters. Similarly, the VQC achieves competitive classification performance, approaching state-of-the-art classical models despite its minimal computational complexity. Furthermore, we validate the QAE on real experimental data from the CMS detector, establishing the robustness of quantum algorithms in practical HEP applications. These results demonstrate that 1P1Q provides an effective and scalable quantum encoding strategy, offering new opportunities for applying quantum computing algorithms in collider data analysis.",1粒子-1 qubit：量子機械学習のための粒子物​​理学データエンコーディング,高エネルギー物理学（HEP）の新しい量子データエンコーディングスキームである1P1Qを導入します。各粒子は個々のQubitに割り当てられ、古典的な圧縮なしで衝突イベントの直接表現を可能にします。 2つのアプリケーションを通じて、量子機械学習（QML）における1P1Qの有効性を実証します。監視されていない異常検出のための量子自動エンコーダー（QAE）と、トップクォークジェットの監視された分類のための変異量子回路（VQC）。我々の結果は、QAEがシグナルジェットをバックグラウンドQCDジェットと正常に区別し、訓練可能なパラメーターを大幅に少なく使用しながら、古典的な自動エンコーダーと比較して優れた性能を達成することを示しています。同様に、VQCは競争力のある分類パフォーマンスを達成し、最小限の計算の複雑さにもかかわらず、最先端のクラシックモデルに近づきます。さらに、CMS検出器からの実際の実験データでQAEを検証し、実際のHEPアプリケーションで量子アルゴリズムの堅牢性を確立します。これらの結果は、1P1Qが効果的でスケーラブルな量子エンコード戦略を提供し、コライダーデータ分析で量子コンピューティングアルゴリズムを適用するための新しい機会を提供することを示しています。
"Bart van der Vecht, Atak Talay Yücel, Hana Jirovská, Stephanie Wehner",Qoala: an Application Execution Environment for Quantum Internet Nodes,"Recently, a first-of-its-kind operating system for programmable quantum network nodes was developed, called QNodeOS. Here, we present an extension of QNodeOS called Qoala, which introduces (1) a unified program format for hybrid interactive classical-quantum programs, providing a well-defined target for compilers, and (2) a runtime representation of a program that allows joint scheduling of the hybrid classical-quantum program, multitasking, and asynchronous program execution. Based on concrete design considerations, we put forward the architecture of Qoala, including the program structure and execution mechanism. We implement Qoala in the form of a modular and extendible simulator that is validated against real-world quantum network hardware (available online). However, Qoala is not meant to be purely a simulator, and implementation is planned on real hardware. We evaluate Qoala's effectiveness and performance sensitivity to latencies and network schedules using an extensive simulation study. Qoala provides a framework that opens the door for future computer science research into quantum network applications, including scheduling algorithms and compilation strategies that can now readily be explored using the framework and tools provided.",Qoala：量子インターネットノードのアプリケーション実行環境,最近、Qnodeosと呼ばれるプログラム可能な量子ネットワークノード用の最初の類似のオペレーティングシステムが開発されました。ここでは、Qoalaと呼ばれるQnodeosの拡張を紹介します。これは、（1）ハイブリッドインタラクティブな古典的四角プログラムの統一プログラム形式を導入し、コンパイラに明確に定義されたターゲットを提供し、（2）ジョイントを許可するプログラムの実行時間表現を提供します。ハイブリッドクラシッククォントゥムプログラムのスケジューリング、マルチタスク、および非同期プログラムの実行。具体的な設計上の考慮事項に基づいて、プログラム構造と実行メカニズムを含むQoalaのアーキテクチャを提案しました。実際の量子ネットワークハードウェア（オンラインで入手可能）に対して検証されたモジュラーで拡張可能なシミュレーターの形でQOALAを実装します。ただし、Qoalaは純粋にシミュレーターであることを意図したものではなく、実装は実際のハードウェアで計画されています。広範なシミュレーション調査を使用して、QOALAの有効性とパフォーマンスの感度をレイテンシーとネットワークスケジュールに対するパフォーマンスの感度を評価します。 QOALAは、提供されたフレームワークとツールを使用して容易に検討できるスケジューリングアルゴリズムやコンパイル戦略など、将来のコンピューターサイエンスの調査のための将来のコンピューターサイエンスの研究のためのドアを開く概要を提供します。
"Søren Fournais, Yannick Guedes Bonthonneau, Léo Morin, Nicolas Raymond",Tunneling between magnetic wells in two dimensions,"The two-dimensional magnetic Laplacian is considered. We calculate the leading term of the splitting between the first two eigenvalues of the operator in the semiclassical limit under the assumption that the magnetic field does not vanish and has two symmetric magnetic wells with respect to the coordinate axes. This is the first result of quantum tunneling between purely magnetic wells under generic assumptions. The proof, which strongly relies on microlocal analysis, reveals a purely magnetic Agmon distance between the wells. Surprisingly, it is discovered that the exponential decay of the eigenfunctions away from the magnetic wells is not crucial to derive the tunneling formula. The key is a microlocal exponential decay inside the characteristic manifold, with respect to the variable quantizing the classical center guide motion.",2次元の磁気井戸間のトンネル,2次元磁気ラプラシアンが考慮されます。磁場が消えず、座標軸に対して2つの対称磁気ウェルを持っているという仮定の下で、半紀元上の制限における演算子の最初の2つの固有値間の分割の主要な用語を計算します。これは、一般的な仮定の下で純粋に磁気ウェル間の量子トンネルの最初の結果です。マイクロロカル分析に強く依存しているこの証明は、井戸間の純粋に磁気農業距離を明らかにしています。驚くべきことに、磁気井戸から離れた固有関数の指数関数的な減衰は、トンネルの式を導き出すために重要ではないことが発見されています。キーは、クラシックセンターガイドの動きを量子化する変数に関して、特性マニホールド内の微小焦点指数減衰です。
"Sabyasachi Chakraborty, Rohit Sarma Sarkar, Sonjoy Majumder",Scalable quantum circuit simulation of a chaotic Ising chain,"The recent advancements in out-of-time-ordered correlator (OTOC) measurements have provided a promising pathway to explore quantum chaos and information scrambling. However, despite recent advancements, their experimental realization remains challenging due to the complexity of implementing backward time evolution. Here, we present a scalable quantum circuit combined with the interferometric protocol, offering a more efficient framework for OTOC measurement. Using this method, we simulate commutator growth in integrable and chaotic regimes of a 9-qubit Ising chain. Our Trotterized circuit achieves errors below $10^{-11}$ with 4th-order Trotterization and performs well even with lower-order Trotterization approximations. We believe, this approach paves the way for studying information dynamics, highly entangled quantum systems, and complex observables efficiently.",混oticとしたISINGチェーンのスケーラブルな量子回路シミュレーション,時間外の相関者（OTOC）測定における最近の進歩は、量子カオスと情報スクランブルを探索するための有望な経路を提供しました。しかし、最近の進歩にもかかわらず、彼らの実験的実現は、逆方向の進化を実装する複雑さのために依然として挑戦的です。ここでは、干渉プロトコルと組み合わせたスケーラブルな量子回路を提示し、OTOC測定のためのより効率的なフレームワークを提供します。この方法を使用して、9 quit Isingチェーンの統合可能な混oticとしたレジームの整流子の成長をシミュレートします。トロッター化された回路は、4次トロッター化を備えた10^{-11} $未満のエラーを達成し、低次のトロッター化近似でもうまく機能します。このアプローチは、情報のダイナミクス、非常に絡み合った量子システム、および複雑な観測可能性を効率的に研究する方法を舗装していると考えています。
