authors,title,abstract,authors_trans,abstract_trans
"Chiranjib Mukhopadhyay, Victor Montenegro, Abolfazl Bayat",Current Trends in Global Quantum Metrology,"Quantum sensors are now universally acknowledged as one of the most promising near-term quantum technologies. The traditional formulation of quantum sensing introduces a concrete bound on ultimate precision through the so-called local sensing framework, in which a significant knowledge of prior information about the unknown parameter value is implicitly assumed. Moreover, the framework provides a systematic approach for optimizing the sensing protocol. In contrast, the paradigm of global sensing aims to find a precision bound for parameter estimation in the absence of such prior information. In recent years, vigorous research has been pursued to describe the contours of global quantum estimation. Here, we review some of these emerging developments. These developments are both in the realm of finding ultimate precision bounds with respect to appropriate figures of merit in the global sensing paradigm, as well as in the search for algorithms that achieve these bounds. We categorize these developments into two largely mutually exclusive camps; one employing Bayesian updating and the other seeking to generalize the frequentist picture of local sensing towards the global paradigm. In the first approach, in order to achieve the best performance, one has to optimize the measurement settings adaptively. In the second approach, the measurement setting is fixed, however the challenge is to identify this fixed measurement optimally.",グローバル量子計量の現在の傾向,量子センサーは現在、最も有望な短期量子技術の1つとして普遍的に認められています。量子センシングの伝統的な定式化は、いわゆるローカルセンシングフレームワークを通じて究極の精度に結合したコンクリートを導入します。そこでは、未知のパラメーター値に関する事前の情報に関する重要な知識が暗黙的に想定されます。さらに、このフレームワークは、センシングプロトコルを最適化するための体系的なアプローチを提供します。対照的に、グローバルセンシングのパラダイムは、そのような事前の情報がない場合にパラメーター推定に結合した精度を見つけることを目的としています。近年、グローバルな量子推定の輪郭を説明するために、活発な研究が追求されています。ここでは、これらの新しい発展のいくつかをレビューします。これらの開発は、グローバルセンシングパラダイムにおける適切なメリットの数字に関して、およびこれらの境界を達成するアルゴリズムの検索において、最終的な精度の境界を見つける領域にあります。これらの開発を、大部分が相互に排他的な2つのキャンプに分類します。 1つはベイジアンの更新を採用し、もう1つはグローバルなパラダイムに対する地元のセンシングの頻繁な写真を一般化しようとしています。最初のアプローチでは、最高のパフォーマンスを達成するためには、測定設定を適応的に最適化する必要があります。 2番目のアプローチでは、測定設定が固定されていますが、課題はこの固定測定を最適に識別することです。
"Aniruddha Ghosh, Ujjal Debnath",New Black Hole Solutions in f(P) Gravity and their Thermodynamic Nature,"Black holes are the fascinating objects in the universe. They represent extreme deformations in spacetime geometry. Here, we construct f(P) gravity and the first example of static-spherically symmetric black hole solution in f(P) gravity and discuss their thermodynamics. Using the numerical approach and series solution, we discover the solution and demonstrate that it is a generalization of Schwarzschild. The solution is characterized by a single function that satisfies a nonlinear fourth order differential equation. Interestingly, we can analytically calculate the solution s specific heat, Wald entropy, and Hawking temperature as a function of horizon radius. After analyzing the specific heat, we discovered that the black hole is thermodynamically stable over a small horizon radius.",F（P）重力とその熱力学的性質の新しいブラックホールソリューション,ブラックホールは、宇宙の魅力的なオブジェクトです。それらは、時空幾何学の極端な変形を表しています。ここでは、F（P）重力とF（P）の重力における静的な対称的なブラックホール溶液の最初の例を構築し、それらの熱力学について説明します。数値的アプローチとシリーズソリューションを使用して、ソリューションを発見し、それがシュワルツチャイルドの一般化であることを実証します。解は、非線形の4次微分方程式を満たす単一関数によって特徴付けられます。興味深いことに、溶液の比熱、WALDエントロピー、およびホーキング温度を地平半径の関数として分析的に計算できます。特定の熱を分析した後、ブラックホールが小さな地平線上半径で熱力学的に安定していることを発見しました。
"Kohei Yoshimura, Yoh Maekawa, Ryuna Nagayama, Sosuke Ito",Force-current structure in Markovian open quantum systems and its applications: geometric housekeeping-excess decomposition and thermodynamic trade-off relations,"Thermodynamic force and irreversible current are the foundational concepts of classical nonequilibrium thermodynamics. Entropy production rate is provided by their product in classical systems, ranging from mesoscopic to macroscopic systems. However, there is no complete quantum extension of such a structure that respects quantum mechanics. In this paper, we propose anti-Hermitian operators that represent currents and forces accompanied by a gradient structure in open quantum systems described by the quantum master equation. We prove that the entropy production rate is given by the product of the force and current operators, which extends the canonical expression of the entropy production rate in the classical systems. The framework constitutes a comprehensive analogy with the nonequilibrium thermodynamics of discrete classical systems. We also show that the structure leads to the extensions of some results in stochastic thermodynamics: the geometric housekeeping-excess decomposition of entropy production and thermodynamic trade-off relations such as the thermodynamic uncertainty relation and the dissipation-time uncertainty relation. In discussing the trade-off relations, we will introduce a measure of fluctuation, which we term the quantum diffusivity.",マルコビアンオープン量子システムとそのアプリケーションの力電流構造：幾何学的なハウスキーピング - エクスケス分解と熱力学的トレードオフ関係,熱力学的力と不可逆電流は、古典的な非平衡熱力学の基礎概念です。エントロピー生産率は、メソスコピックから巨視的なシステムに至るまで、クラシックシステムの製品によって提供されます。ただし、量子力学を尊重するような構造の完全な量子拡張はありません。このホワイトペーパーでは、量子マスター方程式によって記述されたオープン量子システムの勾配構造を伴う電流と力を表す抗ヘルミティアの演算子を提案します。エントロピー生産率は、クラシックシステムのエントロピー生産速度の標準的な発現を拡張する力と電流演算子の積によって与えられることを証明します。フレームワークは、離散古典システムの非平衡熱力学との包括的な類似性を構成します。また、構造が確率的熱力学のいくつかの結果の拡張につながることを示しています：エントロピー生産の幾何学的なハウスキーピング - エクスチェス分解と、熱力学的不確実性の関係や散逸時間の不確実性関係などの熱力学的トレードオフ関係。トレードオフ関係について議論する際には、変動の尺度を導入します。これは量子拡散性と呼ばれます。
"Norbert Mokrzański, Marcin Napiórkowski",The Bogoliubov-Bose-Hubbard model: existence of minimizers and absence of quantum phase transition,"We consider a variational approach to the Bose-Hubbard model based on Bogoliubov theory. We introduce the grand canonical and canonical free energy functionals for which we prove the existence of the minimizers. By analyzing their structure we show the existence of a superfluid phase at sufficiently low temperatures. In particular, we show that this model does not exhibit a quantum phase transition.",Bogoliubov-Bose-Hubbardモデル：最小化剤の存在と量子相遷移の欠如,ボゴリボフ理論に基づいたボーズハバードモデルへの変動アプローチを検討します。ミニマイズの存在を証明する壮大な標準的および標準的な自由エネルギー機能を紹介します。それらの構造を分析することにより、十分に低い温度で超流動相の存在を示します。特に、このモデルが量子相遷移を示さないことを示しています。
"Filippo Troiani, Celestino Angeli, Andrea Secchi, Stefano Pittalis",Genuine multipartite entanglement from many-electron systems,"We demonstrate that, contrary to common wisdom, genuine multipartite entanglement (GME) can be abundantly generated from simple non-correlated many-electron states. We show that the extracted GME can be maximized via spin-independent transformations derived from the quantum Fourier transform. We further demonstrate the possibility of maximizing the GME through localized orbitals in a variety of realistic systems and correlated states. Towards the exploitation of potentially useful entanglement, we rationalize system-specific and universal features of the extracted GME.",多くの電子システムからの本物のマルチパルタイトのエンタングルメント,一般的な知恵とは反対に、真のマルチパルタイトの絡み合い（GME）は、単純な非相関の多電子状態から豊富に生成できることを実証します。抽出されたGMEは、量子フーリエ変換から導出されたスピン非依存性変換を介して最大化できることを示します。さらに、さまざまな現実的なシステムおよび相関した状態における局所的な軌道を介してGMEを最大化する可能性を実証します。潜在的に有用なエンタングルメントの搾取に向けて、抽出されたGMEのシステム固有の普遍的な特徴を合理化します。
Alexej Schelle,Physical aspects of symmetry breaking in an ideal Bose gas at thermal equilibrium,"The theory of ideal gases is supplemented by a numerical quantum field description with a two-dimensional non-local order parameter that allows the modeling of wave-like atomic correlations and interference effects in the limit of low atomic densities. From the present model, it is possible to explain certain new fundamental symmetry aspects of ideal and very weakly interacting Bose gases, like the forward propagation of time and the relation to the breaking and preservation of phase gauge symmetry in solids. In the present formalism, the propagation of one-directional time arises from the pre-defined and equivalent convergence of independent quantum fields towards the Boltzmann equilibrium, and it is shown that Glauber coherent states are related to the definition of the quantized field. Coherently coupling condensate and non-condensate parts as a direct consequence of the increasing quantum coherence time between the different quantum field components in the Bose gas from cooling to below the critical temperature, the present model describes symmetry breaking, which is originally known from the definition of a specific gauge field from Elitzur's theorem for local gauge fields, as a global physical rather than a purely formal mathematical process.",熱平衡における理想的なボーズガスの対称性破壊の物理的側面,理想的なガスの理論は、低原子密度の限界における波のような原子相関のモデリングと干渉効果のモデリングを可能にする2次元の非ローカル順序パラメーターを備えた数値量子場の説明によって補完されます。現在のモデルから、時間の前方伝播や固体の位相ゲージ対称の破壊と保存との関係など、理想的で非常に弱い相互作用するボーズガスの特定の新しい基本的対称性の側面を説明することができます。現在の形式では、1方向の時間の伝播は、ボルツマン平衡に向けて独立した量子フィールドの事前に定義された同等の収束から生じ、輝く状態は量子化されたフィールドの定義に関連していることが示されています。 Boseガスの異なる量子磁場成分間の臨界温度以下までの量子フィールド成分間の量子コヒーレンス時間の増加の直接的な結果として、凝縮液および非凝縮性部分を首尾に結合すると、本モデルは、もともと定義から知られている対称性破壊を説明しています。純粋に正式な数学的プロセスではなく、グローバルな物理的な物理として、ローカルゲージフィールドのElitzurの定理からの特定のゲージフィールド。
"Youngmin Kim, Simone Assali, Junyu Ge, Sebastian Koelling, Manlin Luo, Lu Luo, Hyo-Jun Joo, James Tan, Xuncheng Shi, Zoran Ikonic, Hong Li, Oussama Moutanabbir, Donguk Nam",Mid-infrared group-IV nanowire laser,"Semiconductor nanowires have shown great potential for enabling ultra-compact lasers for integrated photonics platforms. Despite the impressive progress in developing nanowire lasers, their integration into Si photonics platforms remains challenging largely due to the use of III-V and II-VI semiconductors as gain media. These materials not only have high material costs, but also require inherently complex integration with Si-based fabrication processing, increasing overall costs and thereby limiting their large-scale adoption. Furthermore, these material-based nanowire lasers rarely emit above 2 um, which is a technologically important wavelength regime for various applications in imaging and quantum sensing. Recently, group-IV nanowires, particularly direct bandgap GeSn nanowires capable of emitting above 2 um, have emerged as promising cost-effective gain media for Si-compatible nanowire lasers, but there has been no successful demonstration of lasing from this seemingly promising nanowire platform. Herein, we report the experimental observation of lasing above 2 um from a single bottom-up grown GeSn nanowire. By harnessing strain engineering and optimized cavity designs simultaneously, the single GeSn nanowire achieves an amplified material gain that can sufficiently overcome minimized optical losses, resulting in a single-mode lasing with an ultra-low threshold of ~5.3 kW cm-2. Our finding paves the way for all-group IV mid-infrared photonic-integrated circuits with compact Si-compatible lasers for on-chip classical and quantum sensing and free-space communication.",中infraredグループ-IVナノワイヤレーザー,半導体ナノワイヤは、統合されたフォトニクスプラットフォーム用の超コンパクトレーザーを可能にするための大きな可能性を示しています。ナノワイヤレーザーの開発における印象的な進歩にもかかわらず、SIフォトニクスプラットフォームへの統合は、主にII-VおよびII-VI半導体がゲインメディアとして使用されているため、依然として挑戦的です。これらの材料は、材料コストが高いだけでなく、SIベースの製造処理との本質的に複雑な統合を必要とし、全体的なコストを増加させ、それによって大規模な採用を制限します。さらに、これらの材料ベースのナノワイヤレーザーはめったに2 UMを超えることはありません。これは、イメージングと量子センシングにおけるさまざまな用途にとって技術的に重要な波長領域です。最近、グループ-IVナノワイヤ、特に2つ以上のUMを放出できる直接的なバンドギャップGESNナノワイヤは、SI互換のナノワイヤレーザーの有望な費用対効果のゲインメディアとして浮上していますが、この一見有望なナノワイヤプラットフォームからのレーシングのレーシングの成功したデモンストレーションはありませんでした。ここでは、単一のボトムアップ成長したGESNナノワイヤから2 UMを超えてレースするという実験的観察を報告します。ひずみ工学と最適化されたキャビティ設計を同時に活用することにより、単一のGESNナノワイヤは、最小化された光学損失を十分に克服できる増幅された材料のゲインを実現し、超低いしきい値で〜5.3 kW cm-2の単一モードレーシングをもたらします。私たちの発見は、オンチップの古典的および量子センシングおよび自由空間通信のためのコンパクトなSI互換レーザーを備えた、全グループIV中赤外のフォトニック統合回路の道を開きます。
"Adam Burchardt, Jarn de Jong, Lina Vandré",Algorithm to Verify Local Equivalence of Stabilizer States,"We present an algorithm for verifying the local unitary (LU) equivalence of graph and stabilizer states. Our approach reduces the problem to solving a system of linear equations in modular arithmetic. Furthermore, we demonstrate that any LU transformation between two graph states takes a specific form, naturally generalizing the class of local Clifford (LC) transformations. Lastly, using existing libraries, we verify that for up to $n=11$, the number of LU and LC orbits of stabilizer states is identical.",安定剤状態の局所等価性を検証するためのアルゴリズム,グラフと安定剤の状態のローカル単位（LU）の等価性を検証するためのアルゴリズムを提示します。私たちのアプローチは、モジュラー算術の線形方程式のシステムを解くための問題を減らします。さらに、2つのグラフ状態間のLu変換は特定の形式を取っており、地元のクリフォード（LC）変換のクラスを自然に一般化することを実証します。最後に、既存のライブラリを使用して、最大$ n = 11 $の場合、安定剤状態のLuおよびLC軌道の数が同一であることを確認します。
"Juliano C. S. Neves, Fernando G. Gardim",Stars and quark stars in bumblebee gravity,"In this work, the interior spacetime of stars is built in a Lorentz symmetry breaking model called bumblebee gravity. Firstly, we calculated the modified Tolman-Oppenheimer-Volkoff equation in this context of modified gravity. Then we show that the bumblebee field, responsible for the symmetry breaking, increases the star mass-radius relation when it assumes its vacuum expectation value. When compared to the general relativity mass-radius relation, a Lorentz symmetry breaking context, like the bumblebee gravity, could provide more massive stars, surpassing the $2.5 M_{\odot}$ limit as the interior of the star is described by quark matter with the MIT bag model. Also, we investigate the stability of the solution with the MIT bag equation of state in this context of modified gravity.",バンブルビーの重力で星とクォークの星,この作業では、星の内部時空は、バンブルビーの重力と呼ばれるローレンツ対称性壊れモデルで構築されています。まず、修正された重力のコンテキストで、修正されたTolman-Oppenheimer-Volkoff方程式を計算しました。次に、対称性の破壊の原因となるバンブルビーフィールドが、真空期待値を想定すると星の質量 - ラジウス関係を増加させることを示します。一般相対性理論の関係と比較すると、バンブルビーの重力のようなローレンツ対称性壊れたコンテキストは、より大きな星を提供する可能性があり、星の内部がQuark Matterで説明されているため、2.5 m _ {\ odot} $制限を上回ります。 MITバッグモデル。また、この修正重力のこのコンテキストで、MITバッグ状態方程式の溶液の安定性を調査します。
"Kwangil Bae, Junghee Ryu, Ilkwon Sohn, Wonhyuk Lee",Designing generalized elegant Bell inequalities in high dimension from a quantum bound,"Elegant Bell inequality is well known for its distinctive property, being maximally violated by maximal entanglement, mutually unbiased bases, and symmetric informationally complete positive operator-valued measure elements. Despite its significance in quantum information theory demonstrated based on its unique violation feature, it remains the only known one with the characteristic. We present a method to construct Bell inequalities with violation feature analogous to elegant Bell inequality in higher local dimension from a simple analytic quantum bound. A Bell inequality with the generalized violation feature is derived in three dimension for the first time. It exhibits larger violation than existing Bell inequalities of similar classes, including the original elegant Bell inequality, while requiring arguably small number of measurements.",量子境界からの高次元での一般化されたエレガントなベルの不平等を設計する,エレガントなベルの不平等は、その特徴的な特性でよく知られており、最大のエンタングルメント、相互に偏りのない基盤、および対称的な情報が正のオペレーター値の測定要素を完全に完成させることによって最大限に違反されています。量子情報理論におけるその重要性における重要性は、その独自の違反機能に基づいて実証されていますが、特性を持つ唯一の既知の機能である。単純な分析量子結合からのより高い局所寸法でのエレガントなベルの不平等に類似した違反機能でベルの不平等を構築する方法を提示します。一般化された違反機能を備えた鐘の不平等は、初めて3次元に導き出されます。それは、おそらく少数の測定を必要とする一方で、元のエレガントな鐘の不平等を含む、同様のクラスの既存の鐘の不平等よりも大きな違反を示します。
