authors,title,abstract,authors_trans,abstract_trans
"Yukun Wang, ZeYang Li, Linchun Wan",DAPO-QAOA: An algorithm for solving combinatorial optimization problems by dynamically constructing phase operators,"The Quantum Approximate Optimization Algorithm (QAOA) is a well-known hybrid quantum-classical algorithm for combinatorial optimization problems. Improving QAOA involves enhancing its approximation ratio while addressing practical constraints of Noisy Intermediate Scale Quantum (NISQ) devices, such as minimizing the number of two-qubit gates and reducing circuit depth. Although existing research has optimized designs for phase and mixer operators to improve performance, challenges remain, particularly concerning the excessive use of two-qubit gates in the construction of phase operators. To address these issues, we introduce a Dynamic Adaptive Phase Operator (DAPO) algorithm, which dynamically constructs phase operators based on the output of previous layers and neighborhood search approach, optimizing the problem Hamiltonian more efficiently. By using solutions generated by QAOA itself to simplify the problem Hamiltonian at each layer, the algorithm captures the problem's structural properties more effectively, progressively steering the solution closer to the optimal target. Experimental results on MaxCut and NAE3SAT problems show that DAPO achieves higher approximation ratios and significantly reduces two-qubit RZZ gates, especially in dense graphs. Compared to vanilla QAOA, DAPO uses only 66% of RZZ gates at the same depth while delivering better results, demonstrating its potential for efficient combinatorial optimization in the NISQ era.",DAPO-QAOA：位相演算子を動的に構築することにより、組み合わせ最適化問題を解決するためのアルゴリズム,Quantum Amproximate Optimization Algorithm（QAOA）は、組み合わせ最適化問題のためによく知られているハイブリッド量子学的アルゴリズムです。 QAOAを改善するには、2 quitゲートの数を最小限に抑えて回路の深さを減らすなど、ノイズの多い中間スケール量子（NISQ）デバイスの実際的な制約に対処しながら、近似比を強化します。既存の研究では、パフォーマンスを改善するために位相およびミキサーオペレーターの設計を最適化していますが、特に位相演算子の建設における2キットのゲートの過剰な使用に関しては、課題が残っています。これらの問題に対処するために、以前のレイヤーの出力と近隣検索アプローチに基づいて位相演算子を動的に構築し、問題をより効率的に最適化する動的な適応位相演算子（DAPO）アルゴリズムを導入します。 QAOA自体によって生成されたソリューションを使用して各層でのハミルトニアンの問題を簡素化することにより、アルゴリズムは問題の構造特性をより効果的にキャプチャし、ソリューションを最適なターゲットに近づけます。 MaxCutおよびNAE3SATの問題に関する実験結果は、DAPOがより高い近似率を達成し、特に密なグラフでは2キットのRZZゲートを大幅に削減することを示しています。 Vanilla Qaoaと比較して、Dapoは同じ深さでRZZゲートの66％のみを使用しながら、より良い結果をもたらし、NISQ時代の効率的な組み合わせ最適化の可能性を示しています。
"Ashutosh Kumar Singh, Nilesh Sharma, Vaibhav Pratap Singh, Anil Prabhakar",Backflash Attack on Coherent One-Way Quantum Key Distribution Protocol,"In this article, we experimentally demonstrate an eavesdropper's (Eve's) information gain by exploiting the breakdown flash generated by the single photon avalanche detector (SPAD) used in coherent one-way quantum key distribution (COW-QKD) setup. Unlike prior studies focusing on the device-level characterization of backflash photons, this work quantifies Eve's learning with a QKD system that includes a key distillation engine (KDE). Eve's learning is quantified using the backflash photons emitted by SPAD and the information available on the classical channel. Experimentally observed data are in good agreement with theoretical simulations. Some mitigation strategies against the backflash attack are also discussed.",一貫した一方向の量子キー分布プロトコルに対する逆流攻撃,この記事では、コヒーレントの一方向の量子キーディストリビューション（COW-QKD）セットアップで使用される単一の光子雪崩検出器（SPAD）によって生成されたブレークダウンフラッシュを活用することにより、盗聴（イブの）情報ゲインを実験的に実証します。バックフラッシュ光子のデバイスレベルの特性評価に焦点を当てた以前の研究とは異なり、この作業は、キー蒸留エンジン（KDE）を含むQKDシステムでイブの学習を定量化します。イブの学習は、SPADによって放出される逆流光子と古典的なチャネルで利用可能な情報を使用して定量化されます。実験的に観察されたデータは、理論シミュレーションとよく一致しています。逆流攻撃に対するいくつかの緩和戦略についても説明します。
"Swarnim Shirke, Bikram Keshari Pradhan, Debarati Chatterjee, Laura Sagunski, Jürgen Schaffner-Bielich",Fundamental Oscillations of Massive Boson Stars -- II,"Boson Stars (BSs) are macroscopic self-gravitating configurations made of complex scalar fields. These exotic compact objects (ECO) would manifest as dark Boson stars and can contribute to a certain fraction of the dark matter (DM) in the universe. In this work, we study the fundamental non-radial oscillations ($f$-modes) of massive BSs and the associated gravitational wave (GW) emission. We consider massive scalar BSs having the potential of the form $V(\phi) = \frac{1}{2}m^2|\phi|^2 + \frac{1}{4}\lambda |\phi|^4$, restricting to the strong-coupling regime ($\lambda \gg m^2/M_{Pl}^2$) where solutions resembling fermionic stars are known to exist. We first review the available parameter space for scalar DM that can form massive BSs and enlist various constraints. We fit and provide simple analytical relations connecting various macroscopic observables for BSs, which can be directly incorporated into future studies of massive BSs throughout the strong coupling regime without requiring any numerical computation. We then solve for the non-radial $l=2$ fundamental quasinormal modes ($f$-modes) for massive BSs. Scaling relations for $f$-mode equations have been reported in another work. Using these, we perform a complete study of these oscillations spanning the entire available parameter space of massive BSs and provide analytical fits for the $f$-mode characteristics. We further study the universal relations for BSs and reveal the parameter space that is sensitive to the current and future planned GW detectors. We find that different parts of the parameters space can, in principle, be probed by the LISA, LIGO, and NEMO detectors. Finally, we briefly discuss the detectability of $f$-modes from BSs that have not been explored before.",巨大なボソン星の基本的な振動 -  ii,Boson Stars（BSS）は、複雑なスカラーフィールドで作られた巨視的な自己編成構成です。これらのエキゾチックなコンパクトオブジェクト（ECO）は、暗いボソンの星として現れ、宇宙の暗黒物質（DM）の特定の割合に貢献できます。この作業では、大規模なBSSの基本的な非レジアル振動（$ F $ -MODES）と関連する重力波（GW）放射を研究します。フォーム$ v（\ phi）= \ frac {1} {2} m^2 | \ phi |^2 + \ frac {1} {4} \ lambda | \ phi | ^4 $、強力な結合体制（$ \ lambda \ gg m^2/m_ {pl}^2 $）に制限する場合、フェルミオン星に似たソリューションが存在することが知られています。まず、大規模なBSSを形成し、さまざまな制約を採用できるスカラーDMの使用可能なパラメータースペースを確認します。私たちは、BSSのさまざまな巨視的観測可能性を結ぶ簡単な分析関係を提供します。これは、数値計算を必要とせずに、強力な結合体制全体で大規模なBSSの将来の研究に直接組み込むことができます。次に、大規模なBSSに対して、非レジアル$ l = 2 $基本的な準式モード（$ f $ -MODES）を解決します。 $ f $ mode方程式のスケーリング関係は、別の研究で報告されています。これらを使用して、大規模なBSSの利用可能なパラメーター空間全体にまたがるこれらの振動の完全な研究を実行し、$ f $ -Mode特性の分析的適合を提供します。さらに、BSSの普遍的な関係を研究し、現在および将来の計画されているGW検出器に敏感なパラメーター空間を明らかにします。パラメーター空間のさまざまな部分は、原則として、LISA、LIGO、およびNEMO検出器によってプローブできることがわかります。最後に、以前に調査されていないBSSからの$ f $ -Modesの検出可能性について簡単に説明します。
"Swarnim Shirke, Bikram Keshari Pradhan, Debarati Chatterjee, Laura Sagunski, Jürgen Schaffner-Bielich",Fundamental Oscillations of Massive Boson Stars and Distinguishability,"Massive Boson Stars are self-gravitating configurations of self-interacting scalar fields. The equation of state of massive boson stars and their masses, radii, modeled by a self-interacting scalar field with potential of the form $V(\phi) = \frac{1}{2}m^2|\phi|^2 + \frac{1}{4}\lambda |\phi|^4$ are known to follow scaling relations. The non-radial fundamental oscillations of such massive BSs have been studied only for a few select model parameters so far. In this work, we demonstrate for the first time that the $f$-mode characteristics also follow a scaling in the strong interaction limit ($\lambda \gg m^2/M_{Pl}^2$). This opens up the outstanding prospect of studying the $f$-modes of massive BSs throughout the scalar DM parameter space. We study the implications of this finding by carrying out a detailed study of massive BS $f$-modes in a separate work. Here, having introduced this scaling, we use it to compare boson star oscillations with the neutron star and black hole quasinormal modes, thus providing a smoking gun for the distinguishability of BSs using gravitational waves.",巨大な骨星の星の基本的な振動と識別可能性,大規模なボソンスターは、自己取り止めのスカラーフィールドの自己重心の構成です。大規模なボソンの星とその質量の状態の方程式、ラジアイは、フォーム$ v（\ phi）= \ frac {1} {2} m^2 | \ phi |^^のフォームのポテンシャルを持つ自己融合スカラーフィールドによってモデル化されています。 2 + \ frac {1} {4} \ lambda | \ phi |^4 $は、スケーリング関係に従うことが知られています。このような大規模なBSSの非レジアル基本振動は、これまでに少数の選択されたモデルパラメーターについてのみ研究されてきました。この作業では、$ f $ modeの特性が強力な相互作用制限（$ \ lambda \ gg m^2/m_ {pl}^2 $）のスケーリングにも続くことを初めて実証します。これにより、スカラーDMパラメータースペース全体で、大規模なBSSの$ f $ modeを研究するという顕著な見込みが開かれます。私たちは、別の作業で大規模なBS $ f $ -Modeの詳細な研究を実施することにより、この発見の意味を研究します。ここでは、このスケーリングを導入した後、ボソンの星振動を中性子星とブラックホールの準モードと比較するために使用し、重力波を使用したBSSの識別可能性に喫煙銃を提供します。
"M. Selch, M.A.Zubkov, Souvik Pramanik, M.Lewkowicz",Non-renormalization of the fractional quantum Hall conductivity by interactions,"We investigate the theory of the fractional quantum Hall effect (QHE) proposed a long time ago by Lopez and Fradkin \cite{Fradkin1991chern}. The magnetic fluxes of the statistical gauge field attached to electrons remain at rest in the reference frame moving together with the electron liquid. In the laboratory reference frame the electric field of the statistical gauge field forms and screens the external electric field. The fractional QHE conductivity appears as a consequence of this screening already on the mean field theory level. We consider a relativistic extension of the model, and propose an alternative description of the fractional QHE based on macroscopic motion of the electron liquid within the Zubarev statistical operator approach. It is this macroscopic motion of electrons which in this pattern gives rise to the fractional QHE. Within this approach we propose the proof to all orders of perturbation theory that the interaction corrections cannot change the above mentioned mean field theory result for the QHE conductivity.",相互作用による分数量子ホールの導電率の非腎臓化,ロペスとFradkin \ Cite {Fradkin1991Chern}によってずっと前に提案された分数量子ホール効果（QHE）の理論を調査します。電子に取り付けられた統計ゲージフィールドの磁束は、電子液と一緒に移動する基準フレームで安静時に残ります。実験室の参照フレームでは、統計ゲージフィールドの電界が外部電界を形成およびスクリーニングします。分数QHE導電率は、平均フィールド理論レベルですでにこのスクリーニングの結果として表示されます。モデルの相対論的拡張を検討し、Zubarev統計演算子アプローチ内の電子液体の巨視的運動に基づいて、分数QHEの代替説明を提案します。このパターンで分数QHEを生じさせるのは、この電子の巨視的な動きです。このアプローチの中で、摂動理論のすべての順序に対する証拠を提案します。相互作用補正は、QHE導電率の上記の平均フィールド理論結果を変更できないことを提案します。
Marco Calzá,$\tt GrayHawk$: A public code for calculating the Gray Body Factors of massless fields around spherically symmetric Black Holes,"We introduce and describe $\tt GrayHawk$, a publicly available Mathematica-based tool designed for the efficient computation of gray-body factors for spherically symmetric and asymptotically flat black holes. This program provides users with a rapid and reliable means to compute gray-body factors for massless fields with spin \(s = 0, 1/2, 1, 2\) in modes specified by the angular quantum number \(l\), given a black hole metric and the associated parameter values. $\tt GrayHawk$ is preloaded with seven different black hole metrics, offering immediate applicability to a variety of theoretical models. Additionally, its modular structure allows users to extend its functionality easily by incorporating alternative metrics or configurations. This versatility makes $\tt GrayHawk$ a powerful and adaptable resource for researchers studying black hole physics and Hawking radiation. The codes described in this work are publicly available at this https URL.",$ \ tt GrayHawk $：球体対称ブラックホールの周りの質量のないフィールドの灰色の体因子を計算するためのパブリックコード,球体対称および漸近的にフラットなブラックホールのグレー体因子を効率的に計算するために設計された公開されているMathematicaベースのツールである$ \ tt Grayhawk $を紹介して説明します。このプログラムは、角度量子数\（l \）で指定されたモードで、スピン\（s = 0、1/2、1、2 \）で質量のないフィールドの灰色体因子を計算する迅速で信頼できる手段をユーザーに提供します。ブラックホールメトリックと関連するパラメーター値が与えられます。 $ \ tt GrayHawk $は、7つの異なるブラックホールメトリックでプリロードされており、さまざまな理論モデルに即座に適用可能になります。さらに、そのモジュラー構造により、ユーザーは代替メトリックまたは構成を組み込むことで機能を簡単に拡張できます。この汎用性により、$ \ tt Grayhawk $は、ブラックホールの物理学とホーキング放射線を研究する研究者にとって強力で適応性のあるリソースになります。この作業で説明されているコードは、このHTTPS URLで公開されています。
"Jani Kastikainen, Elias Kiritsis, Francesco Nitti",Holographic confining theories on space-times with constant positive curvature,"Varying the curvature, quantum phase transitions are investigated in holographic confining QFTs defined on a fixed constant positive curvature background. We find a competition between two branches of solutions and a phase transition as one varies the space-time curvature. The low-curvature phase has the same kind of IR geometry as the flat-space solution, while the high-curvature phase has a regular interior. We argue that, depending on the leading asymptotic exponent of the scalar potential, the transition may be first-order or higher-order.",一定の正の曲率を持つ宇宙タイムのホログラフィック閉じ込め理論,曲率を変えると、一定の一定の正の曲率の背景で定義されたホログラフィック閉じ込めQFTで量子相遷移が調査されます。時空の曲率が変化するため、2つのソリューションの分岐と位相遷移の間の競合があります。低農薬相は、平らなスペースソリューションと同じ種類のIR形状を持ち、高収量相は通常の内部を持っています。スカラー電位の主要な漸近指数に応じて、遷移は一次または高次である可能性があると主張します。
"Eric P. Glasbrenner, Yannik Gerdes, Sándor Varró, Wolfgang P. Schleich",Hidden facts in Landau-Zener transitions revealed by the Riccati Equation,"We express the dynamics of the two probability amplitudes in the elementary Landau-Zener problem in terms of the solution of the corresponding Riccati differential equation and identify three key features: (i) The solution of the Riccati equation provides the bridge between the two probability amplitudes. (ii) Neglecting the non-linearity in the Riccati equation is equivalent to the Markov approximation which yields the exact asymptotic expression for one of the probability amplitudes, and (iii) the Riccati equation identifies the origin of the failure of the Markov approximation not being able to provide us in general with the correct asymptotic expression of the other probability amplitude. Our approach relies on approximate yet analytical solutions of the Riccati equation in different time regimes, highlighting the impact of its non-linear nature on the time evolution of the system.",riccati方程式によって明らかにされたランダウゼナー遷移における隠された事実,対応するリカティ微分方程式の解の観点から、基本ランダウゼナーの問題における2つの確率振幅のダイナミクスを表現し、次の3つの重要な特徴を識別します。 。 （ii）Riccati方程式の非線形性を無視することは、確率振幅の1つの正確な漸近発現を生成するマルコフ近似と同等であり、（iii）riccati方程式は、マルコフ近似の故障の起源を識別します。一般に、他の確率振幅の正しい漸近発現を提供することができます。私たちのアプローチは、さまざまな時間領域におけるRiccati方程式の近似的でありながら分析的なソリューションに依存しており、システムの時間進化に対する非線形性の影響を強調しています。
"Q. Guan, J. Kruse, M. Kunitski, R. Doerner, D. Blume",Modeling the laser-pulse induced helium trimer dynamics,"Motivated by ongoing pump-probe spectroscopy experiments, this work develops a theoretical framework for describing the rovibrational wave packet dynamics that ensues when a single weakly-bound van der Waals trimer is exposed to a short, sub-picosecond linearly polarized pump laser pulse. The intensity I of the pump laser is chosen such that excitation and ionization of the electronic degrees of freedom are negligible while excitation of the wavepacket in the nuclear degrees of freedom is non-negligible. The numerical treatment, which takes advantage of the fact that the laser pulse is very short compared to typical molecular time scales, is based on a wave packet decomposition that utilizes hyperspherical coordinates. The framework is applied to the extremely floppy bosonic helium trimer. A convergence analysis of the partial wave decomposition is conducted. The kinetic energy release and orientation dynamics are presented. While the dynamics of more strongly-bound van der Waals trimers such as, e.g., the argon trimer display negligible coupling between vibrational and rotational degrees of freedom, rendering a description within a rigid-body picture appropriate, those of weakly-bound trimers display non-negligible coupling between vibrational and rotational degrees of freedom, rendering a description within a rigid-body picture inappropriate. It is shown that a model that constructs the helium trimer dynamics from the dynamics of the helium dimer captures a number of key characteristics of the alignment signal, including the interference between different angular momentum wave packet components.",レーザーパルス誘発ヘリウムトリマーダイナミクスのモデリング,進行中のポンププローブ分光実験に動機付けられたこの作業は、単一の弱く結合したファンデルワールストリマーが短い線形極端な極性ポンプレーザーパルスにさらされると生じるro粘波パケットダイナミクスを記述するための理論的枠組みを開発します。ポンプレーザーの強度Iは、電子自由度の励起とイオン化が無視できるように選択されます。レーザーパルスが典型的な分子時間スケールと比較して非常に短いという事実を利用する数値処理は、過球座標を利用する波パケット分解に基づいています。フレームワークは、非常にフロッピーボソンヘリウムトリマーに適用されます。部分波分解の収束分析が行われます。運動エネルギーの放出と方向のダイナミクスが提示されています。より強く結合したファンデルワールストリマーのダイナミクスは、たとえば、Argon Trimerが振動と回転の自由度の間の無視できる結合を表示しますが、適切な剛体写真内の説明をレンダリングします。 - 振動と回転の自由度との間の交渉が無視され、剛体の画像内の説明を不適切にします。ヘリウム二量体のダイナミクスからヘリウムトリマーダイナミクスを構築するモデルは、異なる角運動量波パケットコンポーネント間の干渉を含む、アライメント信号の多くの重要な特性をキャプチャすることが示されています。
