authors,title,abstract,authors_trans,abstract_trans
"Drilon Zenelaj, Peter Samuelsson, Patrick P. Potts",Wigner-function formalism for the detection of single microwave pulses in a resonator-coupled double quantum dot,"Semiconductor double quantum dots (DQD) coupled to superconducting microwave resonators offer a promising platform for the detection of single microwave photons. In previous works, the photodetection was studied for a monochromatic source of microwave photons. Here, we theoretically analyze the photodetection of single microwave pulses. The photodetection in this case can be seen as a non-linear filtering process of an incoming signal, the pulse, to an outgoing one, the photocurrent. This analogy to signal processing motivated the derivation of a Wigner-function formalism which provides a compelling visualization of the time and frequency properties of the photodetector for low intensities. We find a trade-off between detecting the time and the frequency of the incoming photons in agreement with the time-energy uncertainty relation. As the intensity of the source increases, the photodetection is influenced by coherent Rabi oscillations of the DQD. Our findings give insight into the time-dependent properties of microwave photons interacting with electrons in a DQD-resonator hybrid system and provide guidance for experiments on single microwave pulse detection.",共振器を結合した二重量子ドットでの単一マイクロ波パルスの検出のためのウィグナー機能形式主義,超伝導マイクロ波共振器に結合された半導体二重量子ドット（DQD）は、単一のマイクロ波光子を検出するための有望なプラットフォームを提供します。以前の作品では、電子レンジの単色源の光検出が研究されました。ここでは、単一のマイクロ波パルスの光検出を理論的に分析します。この場合の光検出は、着信信号であるパルスの非線形フィルタリングプロセス、外向きの光電流と見なすことができます。信号処理との類似性は、低強度の光検出器の時間と周波数特性の魅力的な視覚化を提供するウィグナー機能形式の導出を動機付けました。時間とエネルギーの不確実性の関係と一致して、入ってくる光子の時間と頻度を検出することとのトレードオフが見つかります。発生源の強度が増加すると、光検出はDQDのコヒーレントラビ振動の影響を受けます。私たちの調査結果は、DQD共振ハイブリッドシステムの電子と相互作用するマイクロ波光子の時間依存性特性に関する洞察を与え、単一のマイクロ波パルス検出に関する実験のガイダンスを提供します。
"Miłosz Panfil, Zoran Ristivojevic",Local Properties of the Rapidity Distribution in the Lieb-Liniger Model,"We study the rapidity distribution in the Lieb-Liniger model and derive exact relations for its derivatives at the Fermi level. The latter enables us to treat analytically the free energy of the system at low temperatures and arbitrary interactions. We calculated the leading-order correction to the well-known result obtained using conformal field theory. In contrast to the leading-order term controlled by the sound velocity or the Luttinger liquid parameter, the new term is controlled by an additional dimensionless parameter. We calculated its series expansions in the limiting cases of weak and strong interactions. Our results are generalized to other Galilean-invariant integrable systems.",Lieb-Linigerモデルの速さの分布のローカル特性,Lieb-Linigerモデルの速度分布を研究し、フェルミレベルでの導関数の正確な関係を導き出します。後者により、低温と任意の相互作用でシステムの自由エネルギーを分析的に扱うことができます。コンフォーマルフィールド理論を使用して得られたよく知られた結果に対する先行順序補正を計算しました。音速またはluttinger液体パラメーターによって制御される先行順序項とは対照的に、新しい用語は追加の無次元パラメーターによって制御されます。弱くて強い相互作用の制限的なケースで、そのシリーズの拡張を計算しました。私たちの結果は、他のガリラエンに不変の統合可能なシステムに一般化されています。
"Cliò Efthimia Agrapidis, Stefan-Ludwig Drechsler, Satoshi Nishimoto",Self-organised magnon condensation in quasi-1D edge-shared cuprates without external fields,"Multimagnon bound states were predicted nearly a century ago and have since been a key topic in condensed matter physics due to their intriguing quantum properties. However, their realization in natural materials remains elusive, especially in low-dimensional quantum magnets, where stabilizing them is particularly challenging due to the traditionally required extreme external magnetic fields. Therefore, we introduce a novel mechanism that enables the stabilization of multimagnon bound states in quasi-one-dimensional edge-shared cuprates. Our theoretical framework, supported by numerical simulations and experimental data, demonstrates that small antiferromagnetic interchain couplings act as effective internal magnetic fields, promoting a collinear antiferromagnetic order and enabling magnon condensation even at zero external field. This intrinsic stabilisation mechanism eliminates the need for high external fields, offering a platform that is more accessible for experimental realization. We validate this concept by applying it to representative materials such as Li$_2$CuO$_2$, Ca$_2$Y$_2$Cu$5$O$_{10}$, LiCuSbO$_4$, and PbCuSO$_4$(OH)$_2$. Beyond its experimental feasibility, this mechanism could drive advancements in magnon-based quantum computing, low-power spintronic devices, and high-speed magnonic circuits. Moreover, our findings reveal that small interchain and/or interlayer couplings can generally unlock previously overlooked magnetic phenomena, redefining the nature of magnetically ordered states and expanding the frontiers of quantum magnetism.",クエシ-1Dエッジ共有銅の自己組織化されたマグノン凝縮は、外部フィールドなしで,Multimagnon結合状態は、ほぼ1世紀前に予測されており、その後、興味深い量子特性のために凝縮物質の物理学の重要なトピックとなっています。しかし、特に低次元の量子磁石では、天然物質への彼らの実現はとらえどころのないままであり、伝統的に必要な極端な外部磁場により、それらを安定化することは特に困難です。したがって、Quasi-one-dimensional Edge-Shared Cupratesにおけるマルチマグニョン結合状態の安定化を可能にする新しいメカニズムを導入します。数値シミュレーションと実験データによってサポートされている理論的枠組みは、小さな反強磁気交換カップリングが効果的な内部磁場として作用し、Zero外部フィールドでさえマグノン凝縮を可能にするために、共線反強磁気順序を促進し、この固有の安定化メカニズムは、高い外部フィールドの必要性を排除し、実験的実現にアクセスしやすいプラットフォームを提供します。 Li $ _2 $ cuo $ _2 $、Ca $ _2 $ y $ _2 $ cu $ 5 $ o $ _ {10} $、licusbo $ _4 $、およびpbcuso $ _4 $などの代表的な資料に適用することにより、この概念を検証します。 （ああ）$ _ 2 $。実験的な実現可能性を超えて、このメカニズムは、マグノンベースの量子コンピューティング、低電力スピントロニックデバイス、および高速マグネック回路の進歩を促進する可能性があります。さらに、我々の発見は、小さな鎖および/または中間層のカップリングが一般に以前に見落とされていた磁気現象のロックを解除し、磁気的に秩序化された状態の性質を再定義し、量子磁気のフロンティアを拡大できることを明らかにしています。
"Yifan Zhang, Yuxuan Zhang",Classical Simulability of Quantum Circuits with Shallow Magic Depth,"Quantum magic is a necessary resource for quantum computers to be not efficiently simulable by classical computers. Previous results have linked the amount of quantum magic, characterized by the number of $T$ gates or stabilizer rank, to classical simulability. However, the effect of the distribution of quantum magic on the hardness of simulating a quantum circuit remains open. In this work, we investigate the classical simulability of quantum circuits with alternating Clifford and $T$ layers across three tasks: amplitude estimation, sampling, and evaluating Pauli observables. In the case where all $T$ gates are distributed in a single layer, performing amplitude estimation and sampling to multiplicative error are already classically intractable under reasonable assumptions, but Pauli observables are easy to evaluate. Surprisingly, with the addition of just one $T$ gate layer or merely replacing all $T$ gates with $T^{\frac{1}{2}}$, the Pauli evaluation task reveals a sharp complexity transition from P to GapP-complete. Nevertheless, when the precision requirement is relaxed to 1/poly($n$) additive error, we are able to give a polynomial time classical algorithm to compute amplitudes, Pauli observable, and sampling from $\log(n)$ sized marginal distribution for any magic-depth-one circuit that is decomposable into a product of diagonal gates. Our research provides new techniques to simulate highly magical circuits while shedding light on their complexity and their significant dependence on the magic depth.",浅い魔法の深さを持つ量子回路の古典的な模倣性,Quantum Magicは、Quantum Computersがクラシックコンピューターで効率的にシミュレーションできないために必要なリソースです。以前の結果は、$ t $ gatesまたは安定剤のランクの数を特徴とする量子魔法の量を、古典的な模倣可能性にリンクしています。ただし、量子回路のシミュレーションの硬度に対する量子魔法の分布の効果は開いたままです。この作業では、振幅推定、サンプリング、およびパウリ観測可能性の評価の3つのタスクにわたる交互のクリフォードと$ t $層を備えた量子回路の古典的な模倣性を調査します。すべての$ t $ゲートが単一層に分布する場合、振幅推定を実行すると乗算誤差へのサンプリングは、合理的な仮定の下ですでに古典的に扱いにくいものですが、パウリの観測可能性は簡単に評価できます。驚くべきことに、1つの$ t $ GATEレイヤーを追加するか、すべての$ t $ Gatesを$ T^{\ frac {1} {2}} $に置き換えるだけで、Pauli評価タスクはPからGAPPへの鋭い複雑さの遷移を明らかにします-完了。それにもかかわらず、精密要件が1/poly（$ n $）添加剤エラーに緩和されると、振幅、パウリが観測可能、および$ \ log（n）$ sizedの限界分布からのサンプリングを計算するために多項式時間の古典的アルゴリズムを与えることができます斜めの門の積に分解可能な魔法の深さの回路の場合。私たちの研究は、非常に魔法の回路をシミュレートする新しいテクニックを提供し、その複雑さと魔法の深さへの大きな依存に光を当てています。
"Anant Vijay Varma, Amichay Vardi, Doron Cohen","Many-body adiabatic passage: Instability, chaos, and quantum classical correspondence","Adiabatic passage in systems of interacting bosons is substantially affected by interactions and inter-particle entanglement. We consider STIRAP-like schemes in Bose-Hubbard chains that exhibit low-dimensional chaos (a 3 site chain), and high-dimensional chaos (more than 3 sites). The dynamics that is generated by a transfer protocol exhibits striking classical and quantum chaos fingerprints that are manifest in the mean-field classical treatment, in the truncated-Wigner semiclassical treatment, and in the full many-body quantum simulations.",多体の断熱通過：不安定性、カオス、および量子古典的な対応,相互作用するボソンのシステムにおける断熱の通過は、相互作用と粒子間の絡み合いによって実質的に影響を受けます。低次元のカオス（3サイトチェーン）と高次元のカオス（3つ以上のサイト）を示すボーズハバードチェーンのStarapのようなスキームを検討します。トランスファープロトコルによって生成されるダイナミクスは、平均フィールドの古典的治療、切り捨てられたウィグナーの半文治療、および完全な多体量子シミュレーションで現れる、古典的および量子カオスの指紋を顕著に示します。
Eric R. Anschuetz,A Unified Theory of Quantum Neural Network Loss Landscapes,"Classical neural networks with random initialization famously behave as Gaussian processes in the limit of many neurons, which allows one to completely characterize their training and generalization behavior. No such general understanding exists for quantum neural networks (QNNs), which -- outside of certain special cases -- are known to not behave as Gaussian processes when randomly initialized. We here prove that QNNs and their first two derivatives instead generally form what we call ""Wishart processes,"" where certain algebraic properties of the network determine the hyperparameters of the process. This Wishart process description allows us to, for the first time: give necessary and sufficient conditions for a QNN architecture to have a Gaussian process limit; calculate the full gradient distribution, generalizing previously known barren plateau results; and calculate the local minima distribution of algebraically constrained QNNs. Our unified framework suggests a certain simple operational definition for the ""trainability"" of a given QNN model using a newly introduced, experimentally accessible quantity we call the ""degrees of freedom"" of the network architecture.",量子ニューラルネットワーク損失の風景の統一理論,ランダムな初期化を伴う古典的なニューラルネットワークは、多くのニューロンの限界でガウスプロセスとして有名に振る舞うことで有名です。これにより、トレーニングと一般化行動を完全に特徴付けることができます。量子ニューラルネットワーク（QNNS）については、そのような一般的な理解は存在しません。これは、特定の特別なケース以外では、ランダムに初期化されたときにガウスプロセスとして動作しないことが知られています。ここでは、QNNとその最初の2つの導関数が代わりに「Wishartプロセス」と呼ばれるものを形成することを証明します。ここでは、ネットワークの特定の代数特性がプロセスのハイパーパラメーターを決定します。このWishARTプロセスの説明により、初めて：QNNアーキテクチャがガウスプロセス制限を持つために必要かつ十分な条件を与えることができます。完全な勾配分布を計算し、以前に知られていた不毛のプラトーの結果を一般化します。代数的に制約されたQNNの局所最小分布を計算します。統一されたフレームワークは、ネットワークアーキテクチャの「自由度」と呼ばれる新しく導入された実験的にアクセス可能な数量を使用して、特定のQNNモデルの「トレーニング可能性」の特定の単純な運用定義を示唆しています。
"Ze-Xun Lin, Bowen Ma, Wesley Roberts, Martin Rodriguez-Vega, Gregory A. Fiete",Interlayer Dzyaloshinskii-Moriya interactions induced via non-linear phononics in bilayer van der Waals materials,"We theoretically study the impact of light-driven structural changes via nonlinear phononics on the magnetic order of untwisted bilayer van der Waals materials. We consider an illustrative example of the AA-stacked bilayer honeycomb lattice and show that high-intensity light in resonance with selected phonons induces large amplitude phonon displacements that modify the magnetic Hamiltonian of the system. We performed a group theory analysis to identify the vibrational modes of the honeycomb bilayer and the nonlinear couplings among them in the strongly driven regime. We find that the structural changes in the strongly driven regime lower the symmetry relative to the equilibrium lattice and produce changes in the magnetic interactions between the local moments. In particular, the lattice symmetry changes permit a non-zero interlayer Dzyaloshinskii-Moriya interaction that induces a magnetic state with canted local moments. Using a spin-wave analysis about the new magnetic configuration we study the corresponding changes in the magnon spectrum and identify a protocol for engineering topological band transitions using a combination of nonlinear phononics and an external magnetic field. Our work suggests a strategy to induce and control interlayer Dyzaloshinskii-Moriya interactions in a class of layered van der Waals materials, the effect of which is to modify the magnetic ground state, magnon dispersions, and related band geometric properties, including topological invariants.",二重層のファンデルワールス材料の非線形フォノニクスを介して誘導される層間のdzyaloshinskii-moriya相互作用,私たちは、非線形の二重層ファンデルワールス材料の磁気順序に対する非線形フォノニクスを介した光駆動型構造変化の影響を理論的に研究します。 AAスタックの二重層のハニカム格子の説明的な例を検討し、選択されたフォノンと共鳴する高強度の光が、システムの磁気ハミルトニアンを変更する大きな振幅フォノン変位を誘導することを示します。グループ理論分析を実施して、ハニカム二重層の振動モードと、強く駆動された体制における非線形カップリングを特定しました。強く駆動されるレジームの構造変化は、平衡格子と比較して対称性を低下させ、局所的なモーメント間の磁気相互作用に変化をもたらすことがわかります。特に、格子対称性の変化により、わずかな局所モーメントを持つ磁気状態を誘導する非ゼロ層間層のDzyaloshinskii-Moriya相互作用が可能になります。新しい磁気構成に関するスピン波分析を使用して、マグノンスペクトルの対応する変化を調査し、非線形フォノニクスと外部磁場の組み合わせを使用して、エンジニアリングトポロジバンド遷移のプロトコルを特定します。私たちの研究は、層状のファンデルワールス材料のクラスにおける中間層のジザロシンスキーモリヤ相互作用を誘導および制御する戦略を示唆しています。
"Davide Rolino, Marco Erba, Alessandro Tosini, Paolo Perinotti",Minimal operational theories: classical theories with quantum features,"We introduce a class of probabilistic theories, termed Minimal Strongly Causal Operational Probabilistic Theories, where system dynamics are constrained to the minimal set of operations consistent with the set of states and permitting conditional tests. Specifically, the allowed instruments are limited to those derived from compositions of preparations, measurements, swap transformations, and conditional operations. We demonstrate that minimal theories with conditioning and a spanning set of non-separable states satisfy two quantum no-go theorems: no-information without disturbance and no-broadcasting. As a key example, we construct Minimal Strongly Causal Bilocal Classical Theory, a classical toy-theory that lacks incompatible measurements, preparation uncertainty relations, and is noncontextual (both Kochen-Specker and generalised), yet exhibits irreversibility of measurement disturbance, no-information without disturbance, and no-broadcasting. Therefore, the latter three properties cannot be understood $per se$ as signatures of non-classicality. We further explore distinctions between a theory and its minimal strongly causal counterpart, showing that while the minimal strongly causal version of quantum theory diverges from full quantum theory, the same does not hold for classical theory. Additionally, we establish the pairwise independence of the properties of simpliciality, strong causality, and local discriminability.",最小限の運用理論：量子機能を備えた古典理論,最小限の強力な因果的な確率的理論と呼ばれる確率的理論のクラスを紹介します。ここでは、システムのダイナミクスが、状態のセットと一致し、条件付きテストを許可する最小限の操作に制約されます。具体的には、許可された機器は、製剤、測定、スワップ変換、および条件付き操作の組成に由来するものに限定されます。私たちは、条件付けと分離不可能な状態のスパニングセットを備えた最小限の理論を、2つの量子ノーゴーの定理を満たすことを実証します。重要な例として、私たちは、互換性のない測定値、準備の不確実性の関係を欠く古典的な玩具理論である最小限の強く因果的なbilolicの古典理論を構築し、非触義（コチェン・スペッカーと一般化の両方）ですが、測定妨害の不可逆性を示します。妨害なし、およびブロードキャストなし。したがって、後者の3つのプロパティは、非古典性の署名として$ se $を理解することはできません。さらに、理論とその最小限の強く因果関係のある対応物との区別を探り、量子理論の最小限の因果版は完全な量子理論とは異なるが、古典理論についても同じではないことを示しています。さらに、単純化、強い因果関係、および地域の識別性の特性のペアワイズ独立性を確立します。
