authors,title,abstract,authors_trans,abstract_trans
"Hyunsoo Ha, David A. Huse, Rhine Samajdar",Absorbing state transitions with discrete symmetries,"Recent progress in interactive quantum dynamics has inspired the study of fundamentally out-of-equilibrium dynamical phase transitions of quantum and classical many-body systems. Motivated by these developments, we study nonequilibrium phase transitions to absorbing states in one-dimensional systems that can model certain quantum circuits. Specifically, we consider dynamics for which the absorbing states are not unique due to a discrete symmetry: Z2 for two-state models and S3 or Z3 for three-state models. Under time evolution, domain walls in these models perform random walks and coarsen under local feedback, which, if perfect, reduces their number over time, driving the system to an absorbing state in polynomial time. Imperfect feedback, however, introduces domain wall multiplication (branching), potentially leading to an active phase. For Z2-symmetric two-state models, starting from a single domain wall, we find distinct absorbing and active phases as in previous studies. Extending this analysis to local three-state models shows that any nonzero branching rate drives the system into the active phase. However, we demonstrate that incorporating nonlocal classical information into the feedback can stabilize the absorbing phase against branching. By tuning the level of nonlocality, we observe a transition from the active to the absorbing phase, which belongs to a new universality class.",個別の対称性を備えた状態遷移を吸収します,インタラクティブな量子ダイナミクスの最近の進歩は、量子および古典的な多体系の根本的に平等な動的位相遷移の研究に影響を与えました。これらの開発に動機付けられ、特定の量子回路をモデル化できる1次元システムの吸収状態への非平衡位相遷移を研究します。具体的には、離散対称性のために吸収状態が一意ではないダイナミクスを検討します：2状態モデルのZ2、3状態モデルではS3またはZ3。時間の経過とともに、これらのモデルのドメイン壁は、局所的なフィードバックの下でランダムウォークと炭水化物を実行します。これは、完璧な場合、時間の経過とともに数を減らし、多項式時間にシステムを吸収状態に駆り立てます。ただし、不完全なフィードバックは、ドメイン壁の乗算（分岐）を導入し、潜在的にアクティブフェーズにつながる可能性があります。単一のドメイン壁から始まるZ2対称の2つの状態モデルの場合、以前の研究のように明確な吸収と活性相を見つけます。この分析をローカル3状態モデルに拡張すると、ゼロ以外の分岐レートがシステムをアクティブフェーズに駆り立てることが示されています。ただし、非ローカルな古典情報をフィードバックに組み込むと、分岐に対する吸収相が安定する可能性があることを実証します。非希少性のレベルを調整することにより、新しい普遍性クラスに属するアクティブフェーズから吸収相への移行を観察します。
"Yury Berdnikov, Paweł Holewa, Aurimas Sakanas, Jan Mikołaj Śmigiel, Paweł Mrowiński, Emilia Zięba-Ostój, Kresten Yvind, Alexander Huck, Marcin Syperek, Elizaveta Semenova",Efficient passivation of III-As(P) photonic interfaces,"Surface effects can significantly impact the performance of nanophotonic and quantum photonic devices, especially as the device dimensions are reduced. In this work, we propose and investigate a novel approach to surface passivation to mitigate these challenges in photonic nanostructures with III-As(P) quantum wells defined by a dry etching process. The nanostructures are annealed under the phosphine (PH$_3$) ambient inside a metal-organic vapor phase epitaxy chamber to eliminate surface and subsurface defects induced during the dry etching and subsequent oxidation of the etched sidewalls. Moreover, encapsulation of the active material with a wider bandgap material allows for maintaining the band structure of the device, mitigating band bending effects. Our findings reveal an almost order of magnitude reduction in the surface recombination velocity from $2 \times 10^3 \, \mathrm{cm/s}$ for the PH$_3$ annealing compared to $1.5 \times 10^4 \, \mathrm{cm/s}$ for the non-passivated structures and $5 \times 10^3 \, \mathrm{cm/s}$ for the standard method based on (NH$_4$)$_2$S wet treatment followed by Al$_2$O$_3$ encapsulation. A further reduction to $5 \times 10^2 \, \mathrm{cm/s}$ is achieved for the InP-regrown samples. Additionally, we develop a model accounting for the impact of surface charges in the analysis of time-resolved photoluminescence curves and demonstrate that the proposed passivation method effectively reduces the surface charge density on the sidewalls of the studied quantum well-based photonic nanostructures.",III-AS（P）フォトニックインターフェイスの効率的な不動態化,表面効果は、特にデバイスの寸法が減少するにつれて、ナノフォトニックおよび量子フォトニックデバイスの性能に大きな影響を与える可能性があります。この作業では、乾燥エッチングプロセスによって定義されたIII-AS（P）量子ウェルを使用して、フォトニックナノ構造におけるこれらの課題を緩和するための表面不動態化への新しいアプローチを提案および調査します。ナノ構造は、フスフィン（pH $ _3 $）の下でアニールされ、金属有機蒸気相エピタキシーチャンバー内で周囲の周囲でアニールされ、乾燥エッチングおよびその後のエッチングされた側壁の酸化中に誘導される表面および地下の欠陥を排除します。さらに、より広いバンドギャップ材料を使用したアクティブ材料のカプセル化により、デバイスのバンド構造を維持し、バンドの曲げ効果を軽減できます。私たちの調査結果は、PH $ _3 $アニーリングの2 \ Mathrm {cm/s} $から$ 1.5 \ times 10^4 \、\ mathrmの表面再結合速度のほぼ1桁の減少を明らかにしています。 {cm/s}非通過構造の場合、$ 5 \ times 10^3 \、\ mathrm {cm/s} $（nh $ _4 $）$ _ 2 $ sウェットトリートメントに基づく標準メソッドの場合$ _2 $ o $ _3 $カプセル化。インプリロウンサンプルでは、​​$ 5 \ times 10^2 \、\ mathrm {cm/s} $にさらに削減されます。さらに、時間分解フォトルミネセンス曲線の分析における表面電荷の影響を考慮したモデルを開発し、提案された不動態化方法が研究された量子ベースのフォトニックナノ構造の側壁の表面電荷密度を効果的に減少させることを示しています。
"Sean A. Adamson, Petros Wallden",Adiabatic quantum unstructured search in parallel,"We present an optimized adiabatic quantum schedule for unstructured search building on the original approach of Roland and Cerf [Phys. Rev. A 65, 042308 (2002)]. Our schedule adiabatically varies the Hamiltonian even more rapidly at the endpoints of its evolution, preserving Grover's well-known quadratic quantum speedup. In the errorless adiabatic limit, the probability of successfully obtaining the marked state from a measurement increases directly proportional to time, suggesting efficient parallelization. Numerical simulations of an appropriate reduced two-dimensional Schrödinger system confirm adiabaticity while demonstrating superior performance in terms of probability compared to existing adiabatic algorithms and Grover's algorithm, benefiting applications with possible premature termination. We introduce a protocol that ensures a marked-state probability at least $p$ in time of order $\sqrt{N}(1+p/\varepsilon)$, and analyze its implications for realistic bounded-resource scenarios. Our findings suggest that quantum advantage may still be achievable under constrained coherence times (where other algorithms fail), provided the hardware allows for them to be sufficiently long.",類似の断熱量子非構造化検索,RolandとCerf [Phys。 Rev. A 65、042308（2002）]。私たちのスケジュールは、その進化のエンドポイントでハミルトニアンをさらに迅速に変化させ、グローバーの有名な二次速度を維持します。エラーのない断熱制限では、測定からマークされた状態を正常に取得する確率が時間に直接比例して増加し、効率的な並列化を示唆します。適切な縮小された2次元シュレーディンガーシステムの数値シミュレーションは、既存の断熱アルゴリズムやグローバーのアルゴリズムと比較して確率の観点から優れた性能を示しながら、断熱性を確認し、早期終了の可能性を伴うアプリケーションに利益をもたらします。注文$ \ sqrt {n}（1+p/\ varepsilon）$の時間で少なくとも$ p $を保証するプロトコルを導入し、現実的な境界リソースシナリオへの影響を分析します。私たちの調査結果は、ハードウェアが十分に長くすることができれば、制約されたコヒーレンス時間（他のアルゴリズムが失敗する場合）の下でQuantum Advantageが依然として達成可能である可能性があることを示唆しています。
"Yu-Ping Huang, Yongxiang Hu",Noise Reversal by Entropy Quantum Computing,"Signal to noise ratio is key to any measurement. Recent progress in semi/super-conductor technology have pushed the signal detection sensitivity to the ultimate quantum level, but the noise issue remains largely untouched and, in many cases, becomes even more severe because of the high sensitivity. In this paper, we explore a hardware-based approach to noise removal using entropy quantum computing. Distinct to any existing de-noising approach, it observes and reproduces the quantum statistical properties of noise in an optical system to emulate and thereby reverse the noise from data. We show how it can recover 1D and 2D image data mixed with much stronger noise.",エントロピー量子コンピューティングによるノイズ逆転,シグナルとノイズ比は、測定の鍵です。セミ/スーパーコンダクタテクノロジーの最近の進歩により、信号検出の感度が最終的な量子レベルになりましたが、ノイズの問題はほとんど手付かずのままであり、多くの場合、高感度のためにさらに深刻になります。この論文では、エントロピー量子コンピューティングを使用して、ノイズ除去へのハードウェアベースのアプローチを探ります。既存の除去アプローチとは異なり、光学システムのノイズの量子統計的特性を観察および再現して、データからのノイズをエミュレートし、それによって逆転させます。 1Dおよび2D画像データを回復する方法と、より強いノイズと混合された方法を示します。
"Andras Di Giovanni, Adrian Skasberg Aasen, Jürgen Lisenfeld, Martin Gärttner, Hannes Rotzinger, Alexey V. Ustinov",Multiplexed qubit readout quality metric beyond assignment fidelity,"The accurate measurement of quantum two-level objects (qubits) is crucial for developing quantum computing hardware. Over the last decade, the measure of choice for benchmarking readout routines for superconducting qubits has been assignment fidelity. However, this method only focuses on the preparation of computational basis states and therefore does not provide a complete characterization of the readout. Here, we expand the focus to the use of detector tomography to fully characterize multi-qubit readout of superconducting transmon qubits. The impact of different readout parameters on the rate of information extraction is studied using quantum state reconstruction infidelity as a proxy. The results are then compared with assignment fidelities, showing good agreement for separable two-qubit states. We therefore propose the rate of infidelity convergence as an alternative and more comprehensive benchmark for single- and multi-qubit readout optimization. We find the most effective allocation of a fixed shot budget between detector tomography and state reconstruction in single- and two-qubit experiments. To address the growing interest in three-qubit gates, we perform three-qubit quantum state tomography that goes beyond conventional readout error mitigation methods and find a factor of 30 reduction in quantum infidelity. Our results demonstrate that neither quantum nor classical qubit readout correlations are induced even by very high levels of readout noise. Consequently, correlation coefficients can serve as a valuable tool in qubit readout optimization.",割り当ての忠実度を超えた多重化されたqubit読み出し品質メトリック,量子コンピューティングハードウェアの開発には、量子2レベルオブジェクト（QUBITS）の正確な測定が重要です。過去10年間で、超伝導キュービットのベンチマーク読み取りルーチンの選択の尺度は、割り当ての忠実度でした。ただし、この方法は計算基準状態の準備にのみ焦点を当てているため、読み出しの完全な特性評価は提供されません。ここでは、検出器断層撮影の使用に焦点を拡大し、超伝導トランスモンキービットのマルチキビット読み出しを完全に特徴づけます。情報抽出の速度に対する異なる読み取りパラメーターの影響は、Quantum State Reconstruction Infidelityとしてプロキシとして使用して研究されています。その後、結果は割り当ての忠実度と比較され、分離可能な2キット状態の良好な一致が示されます。したがって、単一および多量の読み出し最適化のための代替のより包括的なベンチマークとして、不倫の収束率を提案します。検出器断層撮影と単一および2回のクット実験での状態再構築の間の固定ショット予算の最も効果的な割り当てが見つかります。 3 quitゲートへの関心の高まりに対処するために、従来の読み出しエラー緩和方法を超えて、量子不倫の30倍の減少の係数を見つける3 quit量子状態断層撮影を実行します。我々の結果は、非常に高いレベルの読み出しノイズによっても量子および古典的なキクビット読み出し相関が誘導されないことを示しています。したがって、相関係数は、Qubit Readout最適化の貴重なツールとして機能します。
"Vrinda Mehta, Hans De Raedt, Kristel Michielsen, Fengping Jin",Unraveling Reverse Annealing: A Study of D-Wave Quantum Annealers,"D-Wave quantum annealers offer reverse annealing as a feature allowing them to refine solutions to optimization problems. This paper investigates the influence of key parameters, such as annealing times and reversal distance, on the behavior of reverse annealing by studying models containing up to 1000 qubits. Through the analysis of theoretical models and experimental data, we explore the interplay between quantum and classical processes. Our findings provide a deeper understanding that can better equip users to fully harness the potential of the D-Wave annealers",逆アニーリングの解明：D波量子アニールの研究,D-Wave Quantum Annealersは、最適化の問題へのソリューションを改良できる機能として逆アニーリングを提供します。このペーパーでは、最大1000キュビットを含むモデルを研究することにより、アニーリング時間や反転距離などの主要なパラメーターの影響を調査します。理論モデルと実験データの分析を通じて、量子プロセスと古典的なプロセスの相互作用を調査します。私たちの調査結果は、D-Wave Annealersの可能性を完全に活用できるように、ユーザーをよりよく装備できるより深い理解を提供します
"Matteo Tuveri, Andrea Pierfrancesco Sanna, Mariano Cadoni",The Role of Conceptual Problem Solving in Learning Physics: A Study in a General Relativity University Course,"Effective physics learning, especially in complex topics, requires balancing mathematical formalism with conceptual understanding. Conceptual problem-solving involves connecting math to physical reality, and using an epistemological framework like problem framing helps students justify their mathematical decisions. This approach deepens students' understanding by linking theory to practice and enhancing their reasoning skills. This study explores the effectiveness of conceptual problem-solving in learning complex topics like general relativity (GR) through a pedagogical framework that emphasizes the integration of qualitative and quantitative reasoning. Our investigation, conducted at the University of Cagliari, assessed how students structure their problem framing and its impact on their conceptual learning of GR. Results indicate that students who blend conceptual understanding with mathematical formalism show a deeper grasp of physical principles and improved problem-solving skills. The research highlights the importance of symbol sense and the cyclical nature of problem framing, suggesting that a more integrated approach, incorporating visual, symbolic, and natural language elements, could enhance students' conceptual understanding. Additionally, the methodology provides instructors with insights into students' thought processes, enabling more effective, targeted feedback.",学習物理学における概念的な問題解決の役割：一般相対性理論のコースでの研究,特に複雑なトピックにおける効果的な物理学習には、数学的形式と概念的な理解のバランスをとる必要があります。概念的な問題解決には、数学を物理的現実に結びつけることが含まれ、問題のフレーミングなどの認識論的フレームワークを使用すると、生徒が数学的な決定を正当化するのに役立ちます。このアプローチは、理論を実践し、推論スキルを向上させることにより、生徒の理解を深めます。この研究では、定性的および定量的推論の統合を強調する教育的枠組みを通じて、一般相対性理論（GR）などの複雑なトピックを学習する概念的な問題解決の有効性を探ります。カリアリ大学で実施された調査では、学生が問題のフレーミングとGRの概念学習への影響をどのように構築するかを評価しました。結果は、概念的な理解と数学的形式主義を融合させる学生が、物理的原則をより深く把握し、問題解決スキルを向上させることを示していることを示しています。この研究は、シンボル感覚の重要性と問題のフレーミングの周期的な性質を強調しており、視覚、象徴的、自然言語要素を組み込んだより統合されたアプローチが生徒の概念理解を高めることができることを示唆しています。さらに、この方法論は、インストラクターに学生の思考プロセスに関する洞察を提供し、より効果的でターゲットを絞ったフィードバックを可能にします。
"Antonio Pontin, Quentin Deplano, Andrea Ranfagni, Francesco Marino, Francesco Marin",Strong coupling and dark modes in the motion of a pair of levitated nanoparticles,"We experimentally investigate a system composed of two levitating nanospheres whose motions are indirectly coupled via coherent scattering in a single optical cavity mode. The nanospheres are loaded into a double longitudinal tweezer created with two lasers at different wavelengths, where chromatic aberration leads to the formation of two separate trapping sites. We achieve strong coupling between each pair of modes in the transverse plane of the tweezer, as demonstrated by the avoided crossings observed when tuning the eigenfrequencies of the motion of one nanosphere by varying its optical potential depth. Remarkably, we show the emergence of dark modes in the overall coupled motion. The dynamics can be described in terms of spin-1/2 matrices, and the observed features are ubiquitous in a variety of classical and quantum systems. As such, our experiment will allow us to explore the classical analog of typically quantum dynamics, and in further developments to investigate the transition to the quantum domain by lowering the decoherence rate and creating stationary entanglement, as well as implementing non-stationary protocols.",露骨なナノ粒子のペアの動きにおける強力な結合と暗いモード,単一の光学キャビティモードでのコヒーレント散乱を介して間接的に結合される動きが間接的に結合される2つの浮上ナノスフェアで構成されるシステムを実験的に調査します。ナノスフェアは、異なる波長で2つのレーザーで作成された二重の縦方向ピンセットにロードされ、クロマティック異常は2つの別々のトラッピングサイトの形成につながります。光学電位の深さを変化させることにより、1つのナノスフェアの動きの固有振動を調整するときに観察された回避された交差によって示されるように、ピンセットの横面での各モードの各ペア間の強い結合を実現します。驚くべきことに、全体的な結合運動に暗いモードの出現を示します。ダイナミクスは、Spin-1/2マトリックスの観点から説明でき、観測された特徴は、さまざまな古典および量子システムで遍在しています。このように、私たちの実験により、一般的に量子ダイナミクスの古典的な類似物を探索し、さらに開発して、デコヒーレンス速度を下げ、静止した絡み合いを作成し、非定常プロトコルを実装することにより、量子ドメインへの移行を調査することができます。
Arnold Neumaier,The Born rule -- 100 years ago and today,"Details of the contents, and formulations of the Born rule changed considerably from its inception by Born in 1926 to the present day. Based to a large extent on little known results from the recent books 'Coherent Quantum Physics' by Neumaier and 'Algebraic Quantum Physics', Vol. 1 by Neumaier and Westra, this paper traces the early history 100 years ago, its generalization (essential for today's quantum optics and quantum information theory) to POVMs 50 year ago, and a modern derivation from an intuitive definition of the notion of a quantum detector. Also discussed is the extent to which the various forms of the Born rule have, like any other statement in physics, a restricted domain of validity, which leads to problems when applied outside this domain.",生まれたルール -  100年前と今日,内容の詳細、および生まれたルールの定式化は、1926年に生まれて現在までの開始からかなり変わりました。ノイマイエによる最近の本「コヒーレント量子物理学」と「代数Quantum Physics」によるほとんど知られていない結果に大部分に基づいています。 1 NeumaierとWestraによると、このペーパーでは、100年前の初期の歴史、50年前のPOVMSにその一般化（今日の量子光学と量子情報理論に不可欠）、および量子検出器の概念の直感的な定義からの現代的な派生をたどります。 。また、物理学の他の声明と同様に、生まれたルールのさまざまな形式が、有効性の制限された領域を持っている程度についても説明します。
