authors,title,abstract,authors_trans,abstract_trans
"Yuanchen Deng, Dalton Anderson, Xingyu Du, Will Roberts, Michael Miller, Brandon Smith, Lisa Hackett, Troy Olsson, Matt Eichenfield",Strongly Electromechanical Coupled Phononic Waveguides in Aluminum Scandium Nitride on Silicon Carbide,"Guided phonons have become an increasingly important platform for classical and quantum information processing. While conventional surface acoustic wave systems are typically only guided in the vertical direction, two-dimensionally confined waveguide systems offer significant advantages in terms of density of phononic circuit components and much higher intensities of strain and piezoelectric fields, which make them promising candidates for advancing acoustoelectric and quantum phononic applications. One such material system for generating and guiding phonons at gigahertz frequencies is AlScN on SiC, which can be synthesized by sputter depositing AlScN directly onto SiC wafers. The AlScN on SiC platform allows for tightly vertically confined acoustic modes with high electromechanical coupling, high speed of sound, and simple fabrication of strip and rib waveguides. Until now, this system has only been studied as a slab waveguide platform, i.e., without any lateral waveguiding. Here, we present a 2D-confined phononic waveguide architecture in AlScN on SiC with strongly electromechanically coupled modes that could serve as a platform for phononic routing, power-efficient active and nonlinear phononic devices such as amplifiers, mixers, and oscillators, as well as for interacting with quantum systems such as vacancy centers, charge carriers, photons, and spins. We study two distinct gigahertz frequency waveguide mode families using impedance matched interdigital transducers and characterize their electromechanical coupling and propagation losses. Additionally, we analyze how these waveguides could interact with various important quantum and classical systems that can be either embedded in SiC or heterogeneously integrated on the surface.",炭化シリコン上の窒化アルミニウムスカンジミウムの強力な電気機械結合フォノニック導波路,ガイド付きフォノンは、古典的および量子情報処理のためにますます重要なプラットフォームになっています。通常、従来の表面音波システムは垂直方向にのみ誘導されますが、2次元に限定された導波路システムは、フォノニック回路成分の密度とひずみおよび圧電場のはるかに高い強度の点で大きな利点を提供し、音響上位置および量子フォノニックアプリケーションを進めるための有望な候補になります。 Gigahertz周波数でフォノンを生成およびガイドするためのこのような材料システムの1つは、SICのALSCNであり、SIC WAFERSにALSCNを直接堆積させることで合成できます。 SICプラットフォーム上のALSCNは、高電気機械カップリング、高速の音速、ストリップおよびリブ波動ガイドのシンプルな製造を備えた、しっかりと垂直に限定された音響モードを可能にします。これまで、このシステムは、スラブ導波路プラットフォームとしてのみ研究されてきました。つまり、横方向の導管はありませんでした。ここでは、フォノニックルーティング、アンプ効率の高いアクティブおよび非線形の音韻デバイスとして機能することができる強力な電気機械的結合モードを備えたSICのALSCNの2Dで構成されたフォノニック導波路アーキテクチャを提示します。インピーダンスの一致したインターディジタルトランスデューサーを使用して、2つの異なるGigahertz周波数導波路モードファミリーを研究し、電気メカニカルな結合と伝播損失を特徴付けます。さらに、これらの導波路が、SICに埋め込まれたり、表面に不均一に統合されたりできるさまざまな重要な量子および古典システムと相互作用する方法を分析します。
"Yang Qinag, Hu Yayun, Hou Zhe, Tong Peiqing",Fermi-Energy-Sensitive Universal Conductance Fluctuations in Anisotropic Materials,"Universal conductance fluctuation (UCF) is a hallmark of quantum interference in mesoscopic devices. According to the Altshuler-Lee-Stone theory, the amplitude of UCF remains independent of system parameters such as Fermi energy and disorder strength. However, recent experiments have demonstrated a significant variation in UCF with respect to Fermi energy in the anisotropic Dirac semimetal $\mathrm{Cd_3As_2}$, suggesting a dependence on band anisotropy. In this work, we reconcile the discrepancy between theoretical predictions and experimental observations through a detailed study of UCF versus Fermi energy using a tight-binding model with tunable anisotropy parameters. Near the band edge, the Hamiltonian is simplified to an anisotropic free electron gas model, recovering the generalized Altshuler-Lee-Stone theory. However, as the Fermi energy shifts toward the band center, where rotational symmetry breaks into $C_4$ (four-fold rotational) symmetry, the UCF amplitude deviates from the standard theory. Our findings reveal that UCF becomes increasingly sensitive to Fermi energy as the anisotropy grows stronger. Furthermore, using realistic parameters for $\mathrm{Cd_3As_2}$, our calculations demonstrate an increase in UCF away from the Dirac point, in qualitative agreement with experimental results. The enhancement of UCF occurs in two perpendicular transport directions that we have calculated, albeit with quantitative differences in magnitude, which can be tested in future experiments. Given the prevalence of anisotropic materials and technical advances in engineering anisotropy through strain or twist, our results offer a valuable reference for characterizing intrinsic electronic properties via UCF.",異方性材料のフェルミエネルギーに敏感な普遍的なコンダクタンスの変動,ユニバーサルコンダクタンス変動（UCF）は、メソスコピックデバイスにおける量子干渉の特徴です。 Altshuler-Lee-Stone理論によれば、UCFの振幅は、フェルミエネルギーや障害強度などのシステムパラメーターとは無関係です。しかし、最近の実験では、異方性ディラック半分の$ \ mathrm {cd_3as_2} $のフェルミエネルギーに関するUCFの有意な変動が示されており、バンド異方性への依存を示唆しています。この作業では、調整可能な異方性パラメーターを使用した密着モデルを使用して、UCFとフェルミエネルギーの詳細な研究を通じて、理論的予測と実験的観察の間の矛盾を調整します。バンドエッジの近くでは、ハミルトニアンは異方性のない電子ガスモデルに簡素化され、一般化されたaltshuler-lee-stone理論を回復します。ただし、フェルミエネルギーがバンドセンターに向かってシフトすると、回転対称性が$ C_4 $（4倍回転）対称に分割されると、UCF振幅は標準理論から逸脱します。私たちの発見は、異方性がより強くなるにつれて、UCFがフェルミエネルギーにますます敏感になることを明らかにしています。さらに、$ \ mathrm {cd_3as_2} $の現実的なパラメーターを使用して、私たちの計算は、実験結果と定性的な一致で、DIRACポイントから離れたUCFの増加を示しています。 UCFの強化は、将来の実験でテストできる大きさの定量的な違いがあるにもかかわらず、計算した2つの垂直輸送方向で発生します。異方性材料の有病率と、ひずみまたはひねりによる工学的異方性の技術的進歩を考えると、我々の結果は、UCFを介して固有の電子特性を特徴付けるための貴重な参照を提供します。
Noah M. MacKay,The Stochastic Mechanics of Hawking Radiation,"In Ref. arXiv:2502.08816, Hawking radiation was analyzed through a statistical mechanics framework, revealing a structured microstate description of black hole horizons and information transfer into the radiation background. This study extends that approach by formulating Hawking radiation and black hole evaporation in the language of stochastic mechanics, employing an analytical Langevin framework and a numerical Euler iteration scheme. Both methods confirm that small black holes behave as thermal systems with Gaussian noise, while larger black holes develop a structured noise spectrum that aligns with the gradual contraction of the horizon. This suggests an alternative interpretation of Hawking radiation as an effective surface fuzziness, encoding horizon-scale fluctuations. The appendix provides a Wolfram Mathematica blueprint for numerical simulations, open to heuristic modifications for further exploration of black hole noise spectra.",ホーキング放射線の確率的メカニズム,参考文献。 Arxiv：2502.08816、ホーキング放射は統計的メカニックフレームワークを通じて分析され、ブラックホールの範囲の構造化されたマイクロスタートの説明と放射の背景への情報転送が明らかになりました。この研究は、分析的なランジュビンフレームワークと数値オイラー反復スキームを使用して、確率的メカニックの言語にホーキング放射とブラックホールの蒸発を策定することにより、そのアプローチを拡張します。どちらの方法でも、小さなブラックホールがガウスノイズを持つ熱システムとして動作することを確認し、より大きなブラックホールは、地平線の段階的収縮と整列する構造化ノイズスペクトルを発達させます。これは、ホーキング放射線を効果的な表面の曖昧さとしての別の解釈を示唆しており、地平線上の変動をコードしています。付録は、数値シミュレーションのためのWolfram Mathematica Blueprintを提供し、ブラックホールノイズスペクトルをさらに調査するためのヒューリスティックな変更に開かれています。
Z. Haba,"Chern-Simons ""ground state"" from the path integral",We consider a path integral representation of the time evolution $\exp(-\frac{i}{\hbar}tH)$ for Lagrangians of the variable $A$ which can be represented in the form (quadratic in $Q$) ${\cal L}(A)=Q(A){\cal M}Q(A)+\partial_{\mu}L^{\mu}$. We show that $\exp(-\frac{i}{\hbar}tH)\exp(\frac{i}{\hbar}\int d{\bf x}L^{0}) =\exp(\frac{i}{\hbar}\int d{\bf x}L^{0})$ up to an $A$-independent factor. We discuss examples of the states $\exp(\frac{i}{\hbar}\int d{\bf x}L^{0})$ in quantum mechanics and in quantum field theory (analogs of the Kodama states in quantum gravity). We show the relevance of these states for a determination of the dynamics in terms of stochastic differential equations. We discuss applications to gauge theory on a Lorentzian manifold and gauge theories of gravity.,パス積分からのチェルンシモンズ「基底状態」,時間進化のパスの積分表現は、変数$ a $のラグランジアンの時間進化$ \ exp（ -  \ frac {i} {\ hbar} th）$を考慮します。 m} q（a）+\ partial _ {\ mu} l^{\ mu} $。 $ \ exp（ -  \ frac {i} {\ hbar} th）\ exp（\ frac {i} {\ hbar} \ int d {\ bf x} l^{0}）= \ exp（\ frac {i} {\ hbar} \ int d \ bf x} $ a $非依存係数に。状態$ \ exp（\ frac {i} {\ hbar} \ int d {\ bf x} l^{0}）$の例について説明します。確率的微分方程式の観点からのダイナミクスの決定のために、これらの状態の関連性を示します。ローレンツの多様体と重力の理論に関する理論を測定するためのアプリケーションについて説明します。
"Vardaan Mongia, Abhishek Kumar, Shashi Prabhakar, R.P. Singh",Strengthening the No-Go Theorem for QRNGs,"Quantum random numbers are essential for security against quantum algorithms. Randomness as a beacon is a service being provided for companies and governments to upgrade their security standards from RSA to PQC - QKD or PQC-RSA protocols. Both security mechanisms assume trust in the service provider unless one aims for device-independent protocols. How does an entity ensure that the beacon service has a quantum signature other than relying on faith? Specifically, given a bit-stream, can a user verify a quantum signature in it? Researchers claim this is indecipherable and have stated a no-go theorem for post-processed bit-streams. In this article, we corroborate the results of the no-go theorem while discussing its nuances using two different random number generators and four test methods. These include the NIST statistical test suite and machine learning algorithms that strengthen the theorem. This work is relevant for companies and governments using QRNG OpenAPI to enhance security against quantum threats.",QRNGSのノーゴー定理を強化します,量子乱数は、量子アルゴリズムに対するセキュリティに不可欠です。ビーコンとしてのランダム性とは、企業や政府がRSAからPQC -QKDまたはPQC -RSAプロトコルにセキュリティ基準をアップグレードするサービスを提供されているサービスです。両方のセキュリティメカニズムは、デバイスに依存しないプロトコルを目指しない限り、サービスプロバイダーに対する信頼を想定しています。エンティティは、ビーコンサービスが信仰に依存する以外に量子署名を持っていることをどのように保証しますか？具体的には、ビットストリームを考慮して、ユーザーはその中の量子署名を確認できますか？研究者は、これは判読できないと主張し、後処理されたビットストリームのノーゴー定理を述べています。この記事では、2つの異なる乱数ジェネレーターと4つのテスト方法を使用してそのニュアンスについて議論しながら、ノーゴー定理の結果を裏付けています。これらには、定理を強化するNIST統計テストスイートと機械学習アルゴリズムが含まれます。この作業は、QRNG Openapiを使用して、量子脅威に対するセキュリティを強化する企業や政府に関連しています。
"Chengxin Wu, Teng Wang, Bing-Nan Lu, Ning Li",Charge-dependent nucleon-nucleon interaction at N$^3$LO in nuclear lattice effective field theory,"The nuclear lattice effective field theory (NLEFT) is an efficient tool for solving nuclear many-body problems, which takes high-fidelity lattice chiral interactions as input and computes nuclear low-energy observables via quantum Monte Carlo techniques. In this work, we present the first next-to-next-to-next-to-leading order (N$^3$LO) chiral forces on the lattice with the isospin-breaking effects fully taken into account. We focus on both the charge-independence breaking (CIB) and charge-symmetry breaking (CSB) effects. Specifically, we include the isospin-breaking effect from the mass difference between the charged and neutral pions in the one-pion-exchange potential (OPEP), the Coulomb force for the $pp$ interaction and the contribution of two additional charge-dependent contact operators. We also explicitly incorporate the two-pion-exchange potentials which was mostly neglected in previous NLEFT calculations. With these improvements, we are able to accurately reproduce the $np$ and $pp$ scattering phase shifts up to relative momentum $p \sim 200$ MeV as well as the deuteron properties. The construction of these charge-dependent lattice nuclear forces establishes a solid foundation for future high-precision nuclear ab initio calculations within the NLEFT framework.",核格子におけるn $^3 $ loでの電荷依存性ヌクレオンヌクレオン相互作用効果的なフィールド理論,核格子効果のあるフィールド理論（NLEFT）は、核多体の問題を解決するための効率的なツールであり、高忠実度の格子キラル相互作用を入力として取り、量子モンテカルロ技術を介して核低エネルギーの観測可能性を計算します。この作業では、イソスピンを破る効果を完全に考慮して、格子上に最初のネクストからネストから鉛から鉛の順序（n $^3 $ lo）のキラル力を紹介します。電荷非依存性破壊（CIB）と電荷 - 対称性破壊（CSB）効果の両方に焦点を当てます。具体的には、1ピオン交換ポテンシャル（OPEP）の充電されたパイオンとニュートラルなパイオンの質量差、$ PP $相互作用のクーロン力、および2つの追加料金依存接触演算子の寄与からのイソピンを破る効果を含めます。また、以前のNLEFT計算ではほとんど無視されていた2パイオン交換ポテンシャルを明示的に組み込んでいます。これらの改善により、$ np $ $と$ pp $散乱フェーズを相対的な運動量$ p \ sim 200 $ mevにシフトすることと、重deuteronプロパティを正確に再現することができます。これらの電荷依存性格子核の構築は、NLEFTフレームワーク内で将来の高精度の核AB Initio計算の強固な基盤を確立します。
"Yao Cui, Yuheng Wu, Xinmei Zhu, Hongxia Huang, Jialin Ping",Search for doubly charmed dibaryons in baryon-baryon scattering,"We perform a systematical investigation of the doubly charmed dibaryon system with quantum numbers $IJ=01$, and strangeness numbers $S=0$, $-2$ and $-4$ in the framework of the chiral quark model. Two resonance states with strangeness numbers $S=-2$ is obtained in the $\Lambda\Omega_{cc}$ scattering channel, which are $\Xi_{cc}^{\ast}\Xi$ with resonance mass 5081 MeV and decay width 0.3 MeV, and the $\Xi_{c}\Xi_{c}^{\ast}$ state with the mass 5213 MeV and decay width 19.8 MeV, respectively. These two predicted charmed dibaryon candidates are worth searching for experimentally. Besides, we would like to emphasize that the multi-channel coupling calculation is important to confirm the existence of multiquark states. The coupling can shift the energy of the resonance, give the width to the resonance and even destroy the resonance. Therefore, to provide the necessary information for experiments to search for exotic hadron states, the coupling calculation between the bound channels and open channels is indispensable.",バリオンバリオン散乱で二重に魅力的なディバリオンを検索します,キラルクォークモデルのフレームワークで、量子数$ ij = 01 $、および異常な数字$ s = 0 $、$ -2 $および$ -4 $を使用して、二重に魅力的なディバリオンシステムの系統的調査を実行します。異なる数字の2つの共鳴状態$ s = -2 $は、$ \ xi_ {cc}^{\ ast}である$ \ lambda \ omega_ {cc} $散乱チャネルで取得されます。 $ \ xi_ {c} \ xi_ {c}^{\ ast} $状態、質量5213 MEVと減衰幅19.8 MEVをそれぞれ状態にします。これらの2人の予測された魅力的なディバリオン候補は、実験的に検索する価値があります。また、マルチクアーク状態の存在を確認するには、マルチチャネルカップリングの計算が重要であることを強調したいと思います。結合は、共鳴のエネルギーをシフトし、幅を共鳴に与え、共鳴を破壊することさえあります。したがって、エキゾチックなハドロン状態を検索するために実験に必要な情報を提供するために、バインドチャネルとオープンチャネル間の結合計算は不可欠です。
"Matthew Cloutman, Matthew Chilcott, Alexander Elliott, J. Susanne Otto, Amita B. Deb, Niels Kjærgaard",Quantum-enabled Rydberg atomic polarimetry of radio-frequency fields,"Rydberg atoms efficiently link photons between the radio-frequency (RF) and optical domains. They furnish a medium in which the presence of an RF field imprints on the transmission of a probe laser beam by altering the coherent coupling between atomic quantum states. The immutable atomic energy structure underpins quantum-metrological RF field measurements and has driven intensive efforts to realize inherently self-calibrated sensing devices. Here we investigate spectroscopic signatures owing to the angular momentum quantization of the atomic states utilized in an electromagnetically-induced transparency (EIT) sensing scheme for linearly-polarized RF fields. Specific combinations of atomic terms are shown to give rise to universal, distinctive fingerprints in the detected optical fields upon rotating the RF field polarization. Using a dressed state picture, we identify two types of angular momentum ladders that display strikingly disparate spectroscopic signatures, including the absence or presence of a central spectral EIT peak. We verify our predicted complementary response in rubidium vapour cell experiments and through density matrix calculations. Our study adds important insights into the prospects of Rydberg atomic polarimetry for quantum metrological electric field characterization.",無線周波数フィールドの量子対応Rydberg原子偏光測定,Rydberg Atomsは、電波周波数（RF）と光学ドメインの間に光子を効率的にリンクします。彼らは、原子量子状態間のコヒーレントな結合を変更することにより、RFフィールドの存在がプローブレーザービームの伝達に刻印される媒体を提供します。不変の原子エネルギー構造は、量子計量RFフィールド測定を支えており、本質的に自己調整されたセンシングデバイスを実現するための集中的な努力を促進しています。ここでは、線形偏光RFフィールドの電磁誘導透明性（EIT）センシングスキームで利用される原子状態の角運動量量子化により、分光署名を調査します。原子項の特定の組み合わせは、RFフィールド偏光を回転させると、検出された光学フィールドの普遍的な特徴的な指紋を生じさせることが示されています。服を着た状態の写真を使用して、中央スペクトルEITピークの欠如または存在を含む、顕著に異なる分光署名を示す2種類の角運動量はしごを特定します。ルビジウム蒸気細胞実験および密度マトリックス計算を通じて、予測される補完反応を検証します。私たちの研究は、量子計量電界の特性評価のためのRydberg原子偏光測定の見通しに重要な洞察を追加します。
"Tim F. Weiss, Alberto Peruzzo",Nonlinear Domain Engineering for Quantum Technologies,"The continuously growing effort towards developing real-world quantum technological applications has come to demand an increasing amount of flexibility from its respective platforms. This review presents a highly adaptable engineering technique for photonic quantum technologies based on the artificial structuring of the material nonlinearity. This technique, while, in a simple form, already featured across the full breadth of photonic quantum technologies, has undergone significant development over the last decade, now featuring advanced, aperiodic designs. This review gives an introduction to the three-wave-mixing processes lying at the core of this approach, and illustrates, on basis of the underlying quantum-mechanical description, how they can artificially be manipulated to engineer the corresponding photon characteristics. It then describes how this technique can be employed to realize a number of very different objectives which are expected to find application across the full range of photonic quantum technologies, and presents a summary of the research done towards these ends to date.",量子技術の非線形ドメインエンジニアリング,現実世界の量子技術アプリケーションの開発に向けた継続的に増え続ける努力は、それぞれのプラットフォームからますます柔軟性を要求するようになりました。このレビューでは、材料の非線形性の人工構造に基づいたフォトニック量子技術の高度に適応性のあるエンジニアリング技術を提示します。この手法は、シンプルな形で、すでに幅広いフォトニック量子技術に囲まれているが、過去10年間で重要な発展を遂げており、現在は高度で無周辺のデザインを特徴としています。このレビューは、このアプローチの中核にある3波混合プロセスの紹介を提供し、基礎となる量子メカニカルな説明に基づいて、対応する光子特性を設計するために人為的に操作する方法を示しています。次に、この手法を使用して、フォトニック量子技術の全範囲にわたってアプリケーションを見つけることが期待される非常に異なる多くの目的を実現する方法を説明し、これらの目的に向けて行われた研究の要約を提示します。
