authors,title,abstract,authors_trans,abstract_trans
"Hao Jiao, Robert Brandenberger, Vahid Kamali",Direct Collapse Supermassive Black Holes from Ultralight Dark Matter,We study the possibility that parametric resonant excitation of photons in an ultralight dark matter halo could generate the required flux of Lyman-Werner photons to allow the direct collapse formation of supermassive black hole seeds.,超軽量の暗黒物質からの直接崩壊超崩壊ブラックホール,私たちは、超軽量の暗黒物質ハローにおける光子のパラメトリックな共鳴励起が、ライマン・ワーナー光子の必要なフラックスを生成して、超壁のブラックホールの種の直接崩壊形成を可能にする可能性を研究しています。
"Takuma Kuno, Takeru Utsugi, Andrew J. Ramsay, Normann Mertig, Noriyuki Lee, Itaru Yanagi, Toshiyuki Mine, Nobuhiro Kusuno, Raisei Mizokuchi, Takashi Nakajima, Shinichi Saito, Digh Hisamoto, Ryuta Tsuchiya, Jun Yoneda, Tetsuo Kodera, Hiroyuki Mizuno",Robust spin-qubit control in a natural Si-MOS quantum dot using phase modulation,"Silicon quantum dots are one of the most promising candidates for practical quantum computers because of their scalability and compatibility with the well-established complementary metal-oxide-semiconductor technology. However, the coherence time is limited in industry-standard natural silicon because of the $^{29}$Si isotopes, which have non-zero nuclear spin. Here, we protect an isotopically natural silicon metal-oxide-semiconductor (Si-MOS) quantum dot spin qubit from environmental noise via electron spin resonance with a phase-modulated microwave (MW) drive. This concatenated continuous drive (CCD) method extends the decay time of Rabi oscillations from 1.2 $\mathrm{\mu s}$ to over 200 $\mathrm{\mu s}$. Furthermore, we define a protected qubit basis and propose robust gate operations. We find the coherence time measured by Ramsey sequence is improved from 143 ns to 40.7 $\mu$s compared to that of the bare spin qubit. The single qubit gate fidelity measured with randomized benchmarking is improved from 95% to 99%, underscoring the effectiveness of the CCD method. The method shows promise for improving control fidelity of noisy qubits, overcoming the qubit variability for global control, and maintaining qubit coherence while idling.",位相変調を使用して、天然Si-Mos量子ドットの堅牢なスピン - キット制御,シリコン量子ドットは、確立された補完的な金属 - 酸化物 - 陰導体技術とのスケーラビリティと互換性のため、実用的な量子コンピューターの最も有望な候補の1つです。ただし、非ゼロ核スピンを備えた$^{29} $ si同位体のため、業界標準のナチュラルシリコンではコヒーレンス時間が制限されています。ここでは、位相調節マイクロ波（MW）ドライブを備えた電子スピン共鳴を介して、環境ノイズからの同位体の天然シリコン金属酸化物 - 酸化系導体（SI-MOS）量子ドットスピンを保護します。この連結された連続駆動（CCD）メソッドは、Rabi振動の減衰時間を1.2 $ \ mathrm {\ mu s} $から200 $ \ mathrm {\ mu s} $を超えるまで延長します。さらに、保護されたQubitベースを定義し、堅牢なゲート操作を提案します。 Ramseyシーケンスで測定されたコヒーレンス時間は、裸のスピンQubitのそれと比較して143 nsから40.7 $ \ MU $に改善されていることがわかります。ランダム化されたベンチマークで測定された単一のqubitゲートの忠実度は、95％から99％に改善され、CCDメソッドの有効性を強調しています。この方法は、ノイズの多いQubitsの制御忠実度を改善し、グローバル制御のためのキュービットの変動を克服し、アイドリング中のキュービットコヒーレンスを維持するための可能性を示しています。
"Sang-Hyun Chin, Daseul Lee, Donggyu Lee, Kwanghyun Chung, Eunjong Yoo, Tong-Il Kim, Su Hwan Lee, Sang Woo Bae, Young-Hoon Kim, Yeonjin Yi",Rapid Vapor-Assisted Solution Process of Metal-Organic Chalcogenides for High-Performance Light-Emitting Diodes,"Metal-organic chalcogenides (MOCs), robust crystalline assemblies composed of coinage metals, chalcogens and organic ligands, are typically synthesized via prolonged, high temperature tarnishing of vacuum-deposited metal films with organochalcogen precursors. The prolonged exposure to high temperatures and the necessity for direct vacuum deposition of silver can induce damage to the underlying films, posing significant challenges to the fabrication of optoelectronic devices, despite their cost-effectiveness and chemical robustness. This study introduces vapor-assisted solution processing, a novel chemical vapor deposition method, enabling remarkably rapid fabrication of luminescent MOC films. Furthermore, the first MOC-based light-emitting diodes (MOCLEDs) are realized, achieving an external quantum efficiency (EQE) approaching 0.1% and electroluminescence peaking at 633 nm. These results highlight the potential of MOCs as next-generation emitters for displays and solid-state lighting. This work offers a promising fabrication strategy and insights for advancing MOCLEDs and expanding their optoelectronic potential.",高性能光発光ダイオードのための金属有機カルコゲン化物の急速な蒸気補助溶液プロセス,硬貨金属、カルコゲン、有機リガンドで構成される金属有機カルコゲン化物（MOC）、堅牢な結晶アセンブリは、通常、有機型金属前駆体の真空堆積金属フィルムの長時間の高温の腫瘍を介して合成されます。高温への長時間の曝露と銀の直接真空堆積の必要性は、基礎となるフィルムの損傷を引き起こし、費用対効果と化学的堅牢性にもかかわらず、光電子デバイスの製造に大きな課題をもたらします。この研究では、発光MOCフィルムの著しく迅速な製造を可能にする、新しい化学蒸気堆積方法である蒸気補助ソリューション処理を紹介します。さらに、最初のMOCベースの光発光ダイオード（モクルス）が実現し、0.1％に近づく外部量子効率（EQE）を達成し、633 nmでピークに達します。これらの結果は、ディスプレイとソリッドステート照明の次世代エミッターとしてのMOCの可能性を強調しています。この作業は、モクルスを前進させ、光電子の可能性を拡大するための有望な製造戦略と洞察を提供します。
"Sujan Kumar Roy, Gargi Chaudhuri",I-C-Q relations for rapidly rotating stable hybrid stars,"A number of hadronic equations of state for neutron stars have been investigated for the purpose of the present paper, considering the fact that at sufficiently high density, heavy baryons and quark phases may appear. The observational limits from NICER, GW170817, etc., are obeyed by our choice of equations of state. The universal relations are investigated for both slowly and rapidly rotating neutron stars with heavy baryons present inside the core. For slowly rotating stars, the universality of the I-Love-Q relations is verified, and the I-C-Q relations are inferred to be universal for rapidly rotating stars. Further, we extend the investigation to obtain the universal relations for compact stars containing the quark core, where the connected stable branch of such hybrid stars is considered. The parameters of the I-Love-Q and I-C-Q universal relations are obtained for slowly rotating and rapidly rotating hybrid stars, respectively. These relations would enable extracting information, within the context of general relativity, from astrophysical systems involving rapidly rotating neutron stars.",安定したハイブリッド星を迅速に回転させるためのI-C-Q関係,十分に高い密度で、重いバリオンとクォークフェーズが現れる可能性があるという事実を考慮して、中性子星のハドロニクス方程式の多くが本論文の目的のために調査されています。より良い、GW170817などからの観測限界は、状態の方程式の選択に従っています。普遍的な関係は、コア内に重いバリオンが存在するゆっくりと急速に回転中性子星の両方について調査されます。ゆっくりと回転する星の場合、I-love-Qの関係の普遍性が検証され、I-c-Q関係は急速に回転する星の普遍的であると推測されます。さらに、調査を拡張して、そのようなハイブリッド星の接続された安定した枝が考慮されるクォークコアを含むコンパクトな星の普遍的な関係を取得します。 I-Love-QおよびI-C-Qユニバーサル関係のパラメーターは、それぞれゆっくりと回転し、急速に回転するハイブリッド星のために得られます。これらの関係により、迅速に回転中性子星を含む天体物理システムから、一般相対性理論の中で情報を抽出できるようになります。
"André L. P. Considera, Simon Thalabard",Transport in multifractal Kraichnan flows: from turbulence to Liouville quantum gravity,"We investigate the behaviors of fluid parcel trajectories in a multifractal extension of the Kraichnan model of turbulent advection, obtained by coupling one-dimensional monofractal white-in-time Gaussian flows to a frozen-in-time Gaussian multiplicative chaos (GMC). The resulting random flows are characterized by the interplay between a smoothness exponent $\xi\in(0,2)$ controlling the correlation decay of the Gaussian component and the intermittency parameter $\gamma \in (0,\sqrt 2)$ prescribing the deviations from self-similarity. In recent numerical work, this coupling was observed to induce a smoothing effect, whereby two-particle separations exhibit behavior similar to those in (monofractal) Gaussian flows only with increased smoothness exponent. The purpose of this work is to develop a rigorous theory of this phenomenon, contrasting the quenched setting where the GMC has prescribed realization to an annealed setting where the GMC is averaged over. Using the theory of 1D Markov processes we characterize the Lagrangian flow through boundary behaviors at the origin for the two-particle separation process upon varying $\xi$ and $\gamma$. This extends to a multifractal setting the stochastic/deterministic transition and the coalescing/non-coalescing transition well known in the monofractal Kraichnan setting. We show that the separation process present some analogies with multiplicative 1D versions of the Liouville Brownian Motion, a canonical diffusion evolving within a random landscape induced by the GMC and previously introduced in the context of Liouville quantum gravity. In particular, both quenched and annealed phase diagrams are retrieved upon considering a multiplicative Liouville Brownian motion characterized by a smoothness parameter $\xi+\gamma^2$ and an intermittency exponent $\gamma$.",多競合性クライヒナン流量での輸送：乱流からリウビル量子重力へ,"1次元のモノフラクタルホワイトインタイムガウスフローを凍結中のガウス乗算チャオ（GMC）に結合することによって得られる、乱流移流のクライヒーナンモデルの多競合拡張における流体小包軌道の挙動を調査します。結果として得られるランダムフローは、ガウス成分の相関減衰を制御する滑らかさ指数$ \ xi \ in（0,2）$の間の相互作用と、（0、\ sqrt 2）$ \ sqrt 2）$の相互関係の間の相互作用によって特徴付けられます。最近の数値作業では、この結合が平滑化効果を誘発することが観察されました。それにより、2粒子分離は、（モノフラクタル）ガウスの流れのみが滑らかな指数のみで流れている挙動と同様の挙動を示します。この作業の目的は、この現象の厳密な理論を開発することであり、GMCがGMCが平均化されているアニール設定に実現を規定しているクエンチ付き設定とは対照的です。 1Dマルコフプロセスの理論を使用して、$ \ xi $と$ \ gamma $を変化させると、2粒子分離プロセスの原点の境界挙動を通るラグランジアンの流れを特徴付けます。これは、多競合/決定論的遷移と、モノフラクタルなクライヒナン設定でよく知られている合体/非コーチング遷移にまで及びます。分離プロセスは、GMCによって誘発され、Liouville量子重力のコンテキストで以前に導入されたランダムな景観内で進化する標準的な拡散であるLiouville Brownian Motionの乗算1Dバージョンとのいくつかの類似性を示していることを示します。特に、クエンチとアニールの両方の位相図は、滑らかさパラメーター$ \ xi+\ gamma^2 $と断続的な指数$ \ gamma $を特徴とする乗法的リウィルブラウンモーションを考慮すると、取得されます。"
"Henri Lyyra, Cliona Shakespeare, Simeoni Ahopelto, Teemu Loippo, Alberto Hijano, Reetu Inkilä, Pyry Runko, Tero T. Heikkilä, Juha T. Muhonen",Optomechanical quantum bus for donor spins in silicon,"Silicon is the foundation of current information technology, and also a very promising platform for the future quantum information technology. This is because the silicon-based qubits exhibit some of the longest coherence times and silicon is the underlying material for advanced photonics. In addition, photonics structures in silicon can be used to define optomechanical cavities where the vibrations of nanoscale mechanical resonators can be probed down to the quantum level with laser light. Here, we propose to bring all these developments together by coupling silicon donor spins into optomechanical structures. We show theoretically and numerically that this allows telecom wavelength optical readout of the spin-qubits and implementing high-fidelity entangling two-qubit gates between donor spins that are spatially separated by tens of micrometers. We present an optimized geometry of the proposed device and discuss with the help of numerical simulations the predicted performance of the proposed quantum bus. We analyze the optomechanical spin readout fidelity find the optimal donor species for the strain and magnetic field gradient coupling. We also study the gate fidelity of a two-qubit gate for a universal gate set and discuss future developments.",シリコンにドナーのための光メカニカル量子バス,シリコンは現在の情報技術の基盤であり、将来の量子情報技術のための非常に有望なプラットフォームでもあります。これは、シリコンベースのキュービットが最も長いコヒーレンス時間の一部を示し、シリコンが高度なフォトニクスの基礎となる材料であるためです。さらに、シリコン内のフォトニクス構造を使用して、ナノスケールの機械的共振器の振動をレーザー光で量子レベルまでプローブすることができる光メカニカル空洞を定義できます。ここでは、シリコンドナースピンを結合することにより、これらすべての開発を光メカニカル構造にまとめることを提案します。理論的および数値的に、これにより、スピンクビットのテレコム波長の光学的読み取り値が可能になり、数十のマイクロメートルで空間的に分離されたドナースピン間で2キットのゲートを絡ませる高忠実度を実装することが示されます。提案されたデバイスの最適化されたジオメトリを提示し、数値シミュレーションの助けを借りて、提案された量子バスの予測パフォーマンスについて話し合います。オプトメカニカルスピンリードアウトフィデリ性を分析し、ひずみおよび磁場勾配結合に最適なドナー種を見つけます。また、ユニバーサルゲートセットの2キットゲートのゲートの忠実度を研究し、将来の開発について議論します。
"Lu Zhou, Zheng-Chun Li, Keye Zhang, Zhihao Lan, Alessio Celi, Weiping Zhang",Moiré Superradiance in Cavity Quantum Electrodynamics with Quantum Atom Gas,"As a novel platform for exploring exotic quantum phenomena, the moiré lattice has garnered significant interest in solid-state physics, photonics, and cold atom physics. While moiré lattices in two- and three-dimensional systems have been proposed for neutral cold atoms, the simpler one-dimensional moiré effect remains largely unexplored. We present a scheme demonstrating moiré effects in a one-dimensional cold atom-cavity coupling system, which resembles a generalized open Dicke model exhibiting superradiant phase transitions. We reveal a strong link between the phase transition critical point and the one-dimensional moiré parameter. Additionally, we derive the cavity field spectrum, connected to the dynamical structure factor, and showcase controlled atomic diffusion. This work provides a new route for testing one-dimensional moiré effects with cold atoms and open new possibility of moiré metrology.",Quantum Atom Gasを使用した空洞量子電気力学におけるMoiréSuperradiance,エキゾチックな量子現象を探索するための新しいプラットフォームとして、モアレ格子は固体物理学、フォトニクス、およびコールドアトム物理学に大きな関心を集めています。 2次元および3次元システムのモアレ格子は、中性寒冷原子のために提案されていますが、より単純な1次元モアレ効果はほとんど未開拓のままです。 1次元のコールドアトムキャビティカップリングシステムでモアレ効果を示すスキームを提示します。これは、超放射線遷移を示す一般化されたオープンディックモデルに似ています。位相遷移クリティカルポイントと1次元Moiréパラメーターとの間に強いリンクが明らかになります。さらに、動的構造係数に接続されたキャビティフィールドスペクトルを導き出し、制御された原子拡散を紹介します。この作業は、冷たい原子を備えた1次元モアレ効果をテストし、モアレトロロジーの新しい可能性を開くための新しいルートを提供します。
"Nil İnce, Hasan Mermer, Ali Mostafazadeh",Are Pseudo-Hermiticity and Generalized PT-Symmetry Equivalent at Exceptional Points?,"For a diagonalizable linear operator $H:\mathscr{H}\to\mathscr{H}$ acting in a separable Hilbert space $\mathscr{H}$, i.e., an operator with a purely point spectrum, eigenvalues with finite algebraic multiplicities, and a set of eigenvectors that form a Reisz basis of $\mathscr{H}$, the pseudo-Hermiticity of $H$ is equivalent to its generalized PT-symmetry, where the latter means the existence of an antilinear operator $X:\mathscr{H}\to\mathscr{H}$ satisfying $[X,H]=0$ and $X^2=1$. We show that this equivalence is generally valid for block-diagonalizable operators, i.e., those which have a purely point spectrum, eigenvalues with finite algebraic multiplicities, and a set of generalized eigenvectors that form a Jordan Reisz basis of $\mathscr{H}$. In particular, we establish the equivalence of pseudo-Hermiticity and generalized $PT$-symmetry for arbitrary linear operators acting in a finite-dimensional Hilbert space.",例外的なポイントでは、疑似ヘルマイト性と一般化されたPT対称性が同等ですか？,対角化可能な線形演算子の場合$ h：\ mathscr {h} \ to \ mathscr {h} $分離可能なヒルベルトスペース$ \ mathscr {h} $、すなわち、純粋にポイントスペクトルのあるオペレーター、有限の代数を持つ固有値を持つ固有値を持つオペレーター、およびそれはfyの存在に基づいています。 $ \ mathscr {h} $、$ h $の擬似ヘルマイト性は、その一般化されたpt音楽と同等であり、後者は抗シニア演算子$ x：\ mathscr {h}の存在を意味します。この等価性は、一般にブロック糖尿病性演算子、すなわち純粋に点スペクトルを持つオペレーター、有限代数の多様性を持つ固有値、および$ \ mathscr {h} $のヨルダンreisz基底を形成する一般化された固有ベクトルのセットに有効であることを示します。特に、有限のヒルベルト空間に作用する任意の線形演算子の擬似ヘルマイト性と一般化された$ pt $ -Symmetryの等価性を確立します。
"Jan Apolín, David P. Nadlinger",Recoil-induced errors and their correction in photon-mediated entanglement between atom qubits,"Photonically-interconnected matter qubit systems have wide-ranging applications across quantum science and technology, with entanglement between distant qubits serving as a universal resource. While state-of-the-art heralded entanglement generation performance thus far has been achieved in trapped atomic systems modelled as stationary emitters, the improvements to fidelities and generation rates demanded by large-scale applications require taking into account their motional degrees of freedom. Here, we derive the effects of atomic motion on spontaneous emission coupled into arbitrary optical modes, and study the implications for commonly-used atom-atom entanglement protocols. We arrive at a coherent physical picture in the form of ""kick operators"" associated with each instant in the photonic wavepackets, which also suggests a method to mitigate motional errors by disentangling qubit and motion post-herald. This proposed correction technique removes overheads associated with the thermal motion of atoms, and may greatly increase entanglement rates in long-distance quantum network links by allowing single-photon-based protocols to be used in the high-fidelity regime.",反動誘発エラーと原子間の光子を介した絡み合いにおけるそれらの修正,Photonically-Interconnected Matter Qubit Systemsには、量子科学と技術全体に広範なアプリケーションがあり、遠いキュービットの間の絡み合いが普遍的な資源として機能します。これまでに最先端の告知されたエンタングルメント生成のパフォーマンスは、固定エミッターとしてモデル化された閉じ込められた原子システムで達成されてきましたが、大規模なアプリケーションによって要求される忠実さと生成率の改善は、自由の動きを考慮に入れる必要があります。ここでは、任意の光学モードに結合された自然発光に対する原子運動の効果を導き出し、一般的に使用される原子原子エンタングルメントプロトコルへの影響を研究します。フォトニックウェーブパケットの各瞬間に関連付けられた「キックオペレーター」の形で首尾一貫した物理的絵に到達します。これは、キュービットとモーションポストヘラルドを解き放つことで運動誤差を緩和する方法を示唆しています。この提案された修正技術は、原子の熱運動に関連するオーバーヘッドを除去し、単一光子ベースのプロトコルを高忠実度制度で使用できるようにすることにより、長距離量子ネットワークリンクのエンタングルメントレートを大幅に増加させる可能性があります。
