authors,title,abstract,authors_trans,abstract_trans
Mohsen Fathi,Shadow analysis of an approximate rotating black hole solution with weakly coupled global monopole charge,"We investigate the shadow properties of a rotating black hole with a weakly coupled global monopole charge, using a modified Newman-Janis algorithm. This study explores how this charge and rotational effects shape the black hole's shadow, causal structure, and ergoregions, with implications for distinguishing it from Kerr-like solutions. Analysis of null geodesics reveals observable features that may constrain the global monopole charge and weak coupling parameters within nonminimal gravity frameworks. Observational data from M87* and Sgr A* constrain the global monopole charge and coupling constant to $0 \leq \gamma \lesssim 0.036$ and $-0.2 \lesssim \alpha \leq 0$, respectively.",弱く結合したグローバルモノポール電荷を備えたおおよその回転ブラックホールソリューションの影分析,修正されたNewman-Janisアルゴリズムを使用して、回転ブラックホールのシャドウプロパティを弱く結合したグローバルモノポール電荷を調査します。この研究では、この電荷と回転効果は、ブラックホールの影、因果構造、およびエルゴレギオンをどのように形成し、それをカーのようなソリューションと区別することに影響する方法を探ります。ヌル測地線の分析により、非最小重力フレームワーク内のグローバルなモノポール電荷と弱い結合パラメーターを制約する可能性のある観察可能な特徴が明らかになります。 M87*およびSGR A*からの観測データは、グローバルモノポール電荷と$ 0 \ leq \ gamma \ lesssim 0.036 $および$ -0.2 \ lesssim \ alpha \ leq 0 $にそれぞれ$ 0 \ leq \ gamma \ lesssim 0.036 $に結合します。
"Enrique Álvarez, Jesús Anero",Some aspects of QFT in non-inertial frames,"Some aspects of quantum field theory in a general (i.e. non inertial) frame of Minkowski spacetime are studied. Conditions for the presence of horizons as well as for the modification of the definition of positive energy solutions are examined. The standard wisdom is confirmed that none of these phenomena is generic. This corroborates that in the general case there is no natural way to define positive frequencies, which is the standard road to define particles. In that sense, (as well as in others) non inertial frames are similar to curved spacetimes.",非介入フレームのQFTのいくつかの側面,Minkowski時空の一般的な（すなわち非慣性）フレームにおける量子磁場理論のいくつかの側面が研究されています。視野の存在と、正のエネルギー溶液の定義の修正の条件を調べます。標準的な知恵は、これらの現象はどれも一般的ではないことが確認されています。これは、一般的なケースでは、粒子を定義するための標準的な道である正の周波数を定義する自然な方法がないことを裏付けています。その意味では、（および他の人と同様に）非慣性フレームは、湾曲した時空に似ています。
"Xuyang Huang, Han-Ze Li, Yu-Jun Zhao, Shuo Liu, Jian-Xin Zhong",Quantum feedback induced entanglement relaxation and dynamical phase transition in monitored free fermion chains with Wannier-Stark ladder,"In recent years, measurement-induced entanglement transitions (MIET) have attracted significant attention. However, the dynamical transition associated with the feedback-induced skin effect, which exhibits a wealth of intriguing phenomena, has not been fully understood. In this work, we investigate a dynamical phase transition in a tilted free-fermion chain under measurement-feedback protocols, emphasizing particle density and entanglement entropy dynamics. We reveal a feedback-induced skin effect, enhanced by the Wannier-Stark ladder potential, which creates localization at one boundary and generates an effective pseudo-edge under periodic conditions. The observables show a two-stage evolution: a rapid initial logarithmic growth followed by decay into an area-law steady state. Using finite-size scaling analysis, we pinpoint the critical transition and provide an intuitive physical picture linking it to feedback-driven suppression of quantum jump fluctuations. While the Wannier-Stark ladder delays relaxation without changing universality, strong gradients can directly induce area-law entanglement, bypassing the dynamical transition. This work provides a effective supplement to the dynamical transition proposed in Phys. Rev. Lett. 133, 090401 (2024). It provides valuable references for linking the dynamical understanding of the role feedback plays in MIET.",量子フィードバック誘発性エンタングル化緩和と、監視された遊離フェルミオンチェーンの動的位相遷移は、ワニエスタークラダーを備えています,近年、測定によるエンタングルメント遷移（MIET）は大きな注目を集めています。しかし、フィードバック誘発性の皮膚効果に関連する動的遷移は、豊富な興味をそそる現象を示すことは完全には理解されていません。この作業では、測定フィードバックプロトコルの下で傾斜したフリーミオンチェーンの動的位相遷移を調査し、粒子密度と絡み合いエントロピーダイナミクスを強調します。ワニエスタークはしごの可能性によって強化されたフィードバック誘発性の皮膚効果を明らかにし、1つの境界でローカリゼーションを作成し、定期的な条件下で効果的な擬似エッジを生成します。観察結果は、2段階の進化を示しています。それに続く急速な初期対数成長と、それに続く地域の法律定常状態に崩壊します。有限サイズのスケーリング分析を使用して、重要な遷移を特定し、それをフィードバック駆動型の量子ジャンプ変動の抑制にリンクする直感的な物理的画像を提供します。ワニエスタークのはしごは普遍性を変えることなくリラクゼーションを遅らせますが、強力な勾配は、動的遷移をバイパスして、地域の法律の絡み合いを直接誘発する可能性があります。この作業は、Physで提案されている動的遷移の効果的なサプリメントを提供します。牧師レット133、090401（2024）。これは、ミエトでフィードバックが果たす役割の動的理解をリンクするための貴重な参照を提供します。
"Allan Grønlund, Kasper Green Larsen",An Exponential Separation Between Quantum and Quantum-Inspired Classical Algorithms for Linear Systems,"Achieving a provable exponential quantum speedup for an important machine learning task has been a central research goal since the seminal HHL quantum algorithm for solving linear systems and the subsequent quantum recommender systems algorithm by Kerenidis and Prakash. These algorithms were initially believed to be strong candidates for exponential speedups, but a lower bound ruling out similar classical improvements remained absent. In breakthrough work by Tang, it was demonstrated that this lack of progress in classical lower bounds was for good reasons. Concretely, she gave a classical counterpart of the quantum recommender systems algorithm, reducing the quantum advantage to a mere polynomial. Her approach is quite general and was named quantum-inspired classical algorithms. Since then, almost all the initially exponential quantum machine learning speedups have been reduced to polynomial via new quantum-inspired classical algorithms. From the current state-of-affairs, it is unclear whether we can hope for exponential quantum speedups for any natural machine learning task.
In this work, we present the first such provable exponential separation between quantum and quantum-inspired classical algorithms for the basic problem of solving a linear system when the input matrix is well-conditioned and has sparse rows and columns.",線形システムの量子と量子に触発された古典的アルゴリズムの指数分離,"重要な機械学習タスクの証明可能な指数速度速度を達成することは、線形システムを解くための独創的なHHL量子アルゴリズムと、ケレニディスとプラカシュによるその後の量子推奨システムアルゴリズム以来、中心的な研究目標でした。これらのアルゴリズムは当初、指数関数的なスピードアップの強力な候補者であると考えられていましたが、同様の古典的な改善を除外した下限は存在しませんでした。 Tangによる画期的な作業では、古典的な下限におけるこの進歩の欠如が正当な理由であることが実証されました。具体的には、彼女は量子推奨システムアルゴリズムの古典的なカウンターパートを与え、量子の利点を単なる多項式に減らしました。彼女のアプローチは非常に一般的であり、Quantumにインスパイアされた古典的なアルゴリズムと名付けられました。それ以来、ほとんどすべての指数関数的な量子機械学習のスピードアップは、新しい量子にインスパイアされた古典的なアルゴリズムを介して多項式に減少しました。現在の最新情報から、自然な機械学習タスクの指数関数的な量子速度を期待できるかどうかは不明です。
この作業では、入力マトリックスがよく調整され、まばらな行と列がある場合に線形システムを解くという基本的な問題について、量子と量子に触発された古典的アルゴリズムの間の最初のそのような証明可能な指数分離を提示します。"
"Jia-Chen Tang, Xu-Yang Hou, Hao Guo",Geometry effect of the dynamical quantum phase transitions at finite temperatures,"Dynamical quantum phase transitions (DQPTs) probe the nonequilibrium evolution of quantum systems, unveiling their geometric and topological characteristics. In this study, we introduce the concepts of parallel quench and dynamic geometrical order parameter (DGOP) for non-band models, where these quantities capture the geometric shifts associated with DQPTs. At zero temperature, the DGOP corresponds to the Pancharatnam geometric phase, while at finite temperatures, it extends to the interferometric geometric phase. We further generalize the dynamic topological order parameter (DTOP) to finite-temperature band models, examining its behavior in the Su-Schrieffer-Heeger (SSH) model. Our analysis shows that thermal fluctuations and boundary effects at finite temperatures disrupt the quantization of the DTOP, yet it retains signatures of topological transitions. These findings deepen the understanding of geometric and topological properties in quantum dynamics, illuminating DQPTs across both non-band and band frameworks.",有限温度での動的量子相遷移のジオメトリ効果,動的量子相遷移（DQPTS）は、量子システムの非平衡進化をプローブし、幾何学的およびトポロジー的特性を発表します。この研究では、非バンドモデルの並列クエンチと動的幾何学的順序パラメーター（DGOP）の概念を紹介します。これらの量は、DQPTに関連する幾何学的シフトをキャプチャします。ゼロ温度では、DGOPはパンチャラトナムの幾何学相に対応し、有限温度では干渉幾何相に及びます。さらに、Su-Schrieffer-Heeger（SSH）モデルでの動作を調べるために、ダイナミックトポロジーオーダーパラメーター（DTOP）を有限温度バンドモデルに一般化します。私たちの分析は、有限温度での熱変動と境界効果がDTOPの量子化を破壊することを示していますが、それはトポロジー遷移の署名を保持しています。これらの発見は、量子ダイナミクスにおける幾何学的およびトポロジカル特性の理解を深め、非帯域とバンドの両方のフレームワークにわたってDQPTを照らします。
"Jureeporn Yuennan (Nakhon Si Thammarat Rajabhat U.), Piyachat Panyasiripan (Naresuan U.), Phongpichit Channuie (Walailak U.)",Kiselev-inspired Wormholes,"In this study, we investigate traversable wormholes inspired by the Kiselev framework, which extends classical black hole solutions by incorporating anisotropic fluids. These exotic fluids play a crucial role in cosmology, particularly in explaining phenomena such as the accelerated expansion of the universe. We generalize the Kiselev framework to static, spherically symmetric traversable wormholes and analyze their properties under two distinct models of the redshift function: a constant redshift function and one that varies inversely with the radial coordinate. We examine the energy conditions-specifically the Null Energy Condition (NEC), Weak Energy Condition (WEC), and Strong Energy Condition (SEC)-for these models, demonstrating that only certain exotic fluids can sustain the wormhole structure. Furthermore, we quantify the amount of exotic matter required to maintain these wormholes using the volume integral quantifier and compare our results with other wormhole models. Additionally, we compute the effective potential for photons in Kiselev-inspired wormholes under both redshift function models and analyze their implications for weak gravitational lensing. Our findings suggest that Kiselev-inspired wormholes could serve as viable candidates for exotic geometries, potentially paving the way for future observational verification.",Kiselevにインスパイアされたワームホール,この研究では、異方性液を組み込むことで古典的なブラックホールソリューションを拡張するKiselev Frameworkに触発された横断可能なワームホールを調査します。これらのエキゾチックな液体は、特に宇宙の加速された拡大などの現象を説明する上で、宇宙論において重要な役割を果たします。 Kiselevフレームワークを静的な球体対称通過可能なワームホールに一般化し、赤方偏移関数の2つの異なるモデルの下でそれらの特性を分析します。これは、一定の赤方偏移関数と放射状座標と反比例するものです。これらのモデルでは、特定のエキゾチックな液体のみがワームホール構造を維持できることを実証する、特にヌルエネルギー条件（NEC）、弱いエネルギー条件（WEC）、および強いエネルギー条件（SEC）を調べます。さらに、体積積分量子を使用してこれらのワームホールを維持するために必要なエキゾチックな物質の量を定量化し、結果を他のワームホールモデルと比較します。さらに、KiselevにインスパイアされたWormholesの光子の効果的なポテンシャルをRedshift機能モデルの両方で計算し、弱い重力レンズへの影響を分析します。私たちの調査結果は、キセレフにインスパイアされたワームホールがエキゾチックな幾何学の実行可能な候補として役立つ可能性があり、将来の観察検証への道を開く可能性があることを示唆しています。
"Daniel Louzon, Genko T. Genov, Nicolas Staudenmaier, Florian Frank, Johannes Lang, Matthew L. Markham, Alex Retzker, Fedor Jelezko",Robust Noise Suppression and Quantum Sensing by Continuous Phased Dynamical Decoupling,"We propose and demonstrate experimentally continuous phased dynamical decoupling (CPDD), where we apply a continuous field with discrete phase changes for quantum sensing and robust compensation of environmental and amplitude noise. CPDD does not use short pulses, making it particularly suitable for experiments with limited driving power or nuclear magnetic resonance at high magnetic fields. It requires control of the timing of the phase changes, offering much greater precision than the Rabi frequency control needed in standard continuous sensing schemes. We successfully apply our method to nanoscale nuclear magnetic resonance and combine it with quantum heterodyne detection, achieving microhertz uncertainty in the estimated signal frequency for a 120 s measurement. Our Letter expands significantly the applicability of dynamical decoupling and opens the door for a wide range of experiments, e.g., in nitrogen-vacancy centers, trapped ions, or trapped atoms.",連続したフェーズド動的デカップリングによる堅牢なノイズ抑制と量子センシング,実験的に連続的にフェーズド動的デカップリング（CPDD）を提案および実証し、環境および振幅ノイズの量子センシングと堅牢な補償のために離散相変化を伴う連続フィールドを適用します。 CPDDは短いパルスを使用せず、高磁場での駆動力や核磁気共鳴が限られている実験に特に適しています。位相変化のタイミングを制御する必要があり、標準の連続センシングスキームで必要なRabi周波数制御よりもはるかに高い精度を提供します。ナノスケールの核磁気共鳴に方法を適用し、それを量子ヘテロダイン検出と組み合わせて、120秒の測定の推定信号周波数にマイクロハーツの不確実性を達成します。私たちの手紙は、動的分離の適用性を大幅に拡大し、例えば窒素の蒸気センター、トラップイオン、または閉じ込められた原子で、幅広い実験のドアを開きます。
"Bilel Hamil, Bekir Can Lütfüoğlu",Schwarzschild black hole surrounded by a cloud of strings in the background of perfect fluid dark matter,"This manuscript investigates a Schwarzschild black hole surrounded by perfect fluid dark matter embedded in a cloud of strings. The effects of its surroundings on thermodynamics, timelike and null geodesics, shadows, and quasinormal modes are analyzed. It is demonstrated that changes in spacetime, induced by the surrounding environment, significantly influence the stability, thermal phases, energy dynamics, particle trajectories, and observable features of the black hole's shadow, as well as the oscillation frequency and decay rate.",完璧な流動的な暗黒物質の背景に弦の雲に囲まれたシュワルツチャイルドのブラックホール,この原稿は、弦の雲に埋め込まれた完全な流動的な暗黒物質に囲まれたシュワルツチャイルドのブラックホールを調査しています。周囲の熱力学、タイムラインおよびヌル測地線、影、および準周合モードに対する影響を分析します。周囲の環境によって誘発される時空の変化は、ブラックホールの影の安定性、熱相、エネルギーダイナミクス、粒子軌道、および発振頻度と減衰率の観察可能な特徴に大きく影響することが実証されています。
"Sourav Biswas, E. Rico, Tobias Grass",Ring-exchange physics in a chain of three-level ions,"In the presence of ring exchange interactions, bosons in a ladder-like lattice may form the bosonic analogon of a correlated metal, known as the d-wave Bose liquid (DBL). In this paper, we show that a chain of trapped ions with three internal levels can mimic a ladder-like system constrained to a maximum occupation of one boson per rung. The setup enables tunable ring exchange interactions, transitioning between a polarized regime with all bosons confined to one leg and the DBL regime. The latter state is characterized by a splitting of the peak in the momentum distribution and an oscillating pair correlation function.",3レベルイオンのチェーン内のリング交換物理学,リング交換の相互作用が存在する場合、はしごのような格子内のボソンは、D波ボーズ液（DBL）として知られる相関金属のボソン類似体を形成する可能性があります。この論文では、3つの内部レベルを持つ閉じ込められたイオンのチェーンが、ラングごとに1つのボソンの最大職業に制約されたはしごのようなシステムを模倣できることを示します。セットアップにより、調整可能なリング交換の相互作用が可能になり、偏光レジーム間の移行があり、すべての骨が片足に閉じ込められ、DBLレジームがあります。後者の状態は、運動量分布のピークの分割と振動ペア相関関数によって特徴付けられます。
"Riya Baruah, Pedro Portugal, Joachim Wabnig, Christian Flindt","Fast, Accurate, and Local Temperature Control Using Qubits","Many quantum technologies, including quantum computers, quantum heat engines, and quantum sensors, rely on operating conditions in the subkelvin regime. It is therefore desirable to develop practical tools and methods for the precise control of the temperature in nanoscale quantum systems. Here, we present a proposal for fast, accurate, and local temperature control using qubits, which regulate the flow of heat between a quantum system and its thermal environment. The qubits are kept in a thermal state with a temperature that is controlled in an interplay between work done on the qubits by changing their energy splittings and the flow of heat between the qubits and the environment. Using only a few qubits, it is possible to control the thermal environment of another quantum system, which can be heated or cooled by the qubits. As an example, we show how a quantum system at subkelvin temperatures can be significantly and accurately cooled on a nanosecond timescale. Our proposal can potentially be realized with superconducting flux qubits, charge qubits, or spin qubits, which can now be fabricated and manipulated with exquisite control.",Qubitsを使用した高速で正確で、局所的な温度制御,量子コンピューター、量子熱エンジン、量子センサーを含む多くの量子技術は、サブケルビン政権の動作条件に依存しています。したがって、ナノスケール量子システムの温度を正確に制御するための実用的なツールと方法を開発することが望ましいです。ここでは、量子システムとその熱環境の間の熱の流れを調節するQubitsを使用して、高速で正確な、局所的な温度制御の提案を提示します。キュービットは、エネルギーの分裂とQubitsと環境間の熱の流れを変更することにより、Qubitsで行われた作業間の相互作用で制御される温度で熱状態に保たれます。わずかなキッツのみを使用して、別の量子システムの熱環境を制御することが可能です。例として、ナノ秒タイムスケールでサブケルビン温度での量子システムがどのように大幅かつ正確に冷却されるかを示します。私たちの提案は、超伝導フラックスキュービット、充電Qubits、またはスピンキビットで潜在的に実現することができます。
"Minjae Cho, Barak Gabai, Joshua Sandor, Xi Yin",Thermal Bootstrap of Matrix Quantum Mechanics,"We implement a bootstrap method that combines stationary state conditions, thermal inequalities, and semidefinite relaxations of matrix logarithm in the ungauged one-matrix quantum mechanics, at finite rank N as well as in the large N limit, and determine finite temperature observables that interpolate between available analytic results in the low and high temperature limits respectively. We also obtain bootstrap bounds on thermal phase transition as well as preliminary results in the ungauged two-matrix quantum mechanics.",マトリックス量子力学のサーマルブートストラップ,固定状態の条件、熱不等式、および非ゲージされた1つのマトリックス量子力学、有限のランクnおよび大きなN制限でのマトリックス対数の半柔らかい緩和を組み合わせたブートストラップ法を実装し、それぞれ高温と高温の結果を高くしている間の高温の対象となる有限の温度観測可能物を測定します。また、熱相遷移のブートストラップ境界と、非ゲージされた2マトリックス量子力学の予備的な結果も得られます。
