authors,title,abstract,authors_trans,abstract_trans
"Vivin Vinod, Peter Zaspel",Investigating Data Hierarchies in Multifidelity Machine Learning for Excitation Energies,"Recent progress in machine learning (ML) has made high-accuracy quantum chemistry (QC) calculations more accessible. Of particular interest are multifidelity machine learning (MFML) methods where training data from differing accuracies or fidelities are used. These methods usually employ a fixed scaling factor, $\gamma$, to relate the number of training samples across different fidelities, which reflects the cost and assumed sparsity of the data. This study investigates the impact of modifying $\gamma$ on model efficiency and accuracy for the prediction of vertical excitation energies using the QeMFi benchmark dataset. Further, this work introduces QC compute time informed scaling factors, denoted as $\theta$, that vary based on QC compute times at different fidelities. A novel error metric, error contours of MFML, is proposed to provide a comprehensive view of model error contributions from each fidelity. The results indicate that high model accuracy can be achieved with just 2 training samples at the target fidelity when a larger number of samples from lower fidelities are used. This is further illustrated through a novel concept, the $\Gamma$-curve, which compares model error against the time-cost of generating training samples, demonstrating that multifidelity models can achieve high accuracy while minimizing training data costs.",励起エネルギーのためのマルチディデリティ機械学習におけるデータ階層の調査,機械学習（ML）の最近の進歩により、高精度の量子化学（QC）計算がよりアクセスしやすくなりました。特に興味深いのは、異なる精度や忠実度からのトレーニングデータが使用されるマルチディデリティ機械学習（MFML）方法です。これらの方法は通常、固定されたスケーリング係数$ \ gamma $を採用して、さまざまな忠実度にわたるトレーニングサンプルの数を関連付けます。これは、コストを反映し、データのスパースを想定しています。この研究では、QEMFIベンチマークデータセットを使用した垂直励起エネルギーの予測のモデル効率と精度に対する$ \ gamma $を変更する影響を調査します。さらに、この作業では、異なる忠実度でQC計算時間に基づいて異なる$ \ theta $として示されるQC計算時間に通知されたスケーリング係数を導入します。 MFMLの新しいエラーメトリック、MFMLの誤差輪郭は、各忠実度からのモデルエラーの寄与の包括的なビューを提供するために提案されています。結果は、より低い忠実度からの多くのサンプルが使用されている場合、ターゲットの忠実度でわずか2つのトレーニングサンプルで高モデルの精度を達成できることを示しています。これは、新しい概念である$ \ gamma $ curveを通じてさらに説明されています。これは、モデルエラーをトレーニングサンプルの生成のタイムコストと比較し、マルチディデリティモデルがトレーニングデータコストを最小限に抑えながら高い精度を達成できることを示しています。
"Vivin Vinod, Peter Zaspel",Benchmarking Data Efficiency in $Δ$-ML and Multifidelity Models for Quantum Chemistry,"The development of machine learning (ML) methods has made quantum chemistry (QC) calculations more accessible by reducing the compute cost incurred in conventional QC methods. This has since been translated into the overhead cost of generating training data. Increased work in reducing the cost of generating training data resulted in the development of $\Delta$-ML and multifidelity machine learning methods which use data at more than one QC level of accuracy, or fidelity.
This work compares the data costs associated with $\Delta$-ML, multifidelity machine learning (MFML), and optimized MFML (o-MFML) in contrast with a newly introduced Multifidelity$\Delta$-Machine Learning (MF$\Delta$ML) method for the prediction of ground state energies, vertical excitation energies, and the magnitude of electronic contribution of molecular dipole moments from the multifidelity benchmark dataset QeMFi. This assessment is made on the basis of training data generation cost associated with each model and is compared with the single fidelity kernel ridge regression (KRR) case. The results indicate that the use of multifidelity methods surpasses the standard $\Delta$-ML approaches in cases of a large number of predictions. For applications which require only a few evaluations to be made using ML models, while the $\Delta$-ML method might be favored, the MF$\Delta$ML method is shown to be more efficient.",量子化学のための$Δ$ -MLおよびマルチディデリティモデルのベンチマークデータ効率,"機械学習（ML）方法の開発により、従来のQCメソッドで発生する計算コストを削減することにより、量子化学（QC）計算がよりアクセスしやすくなりました。これは、トレーニングデータを生成するためのオーバーヘッドコストに変換されています。トレーニングデータを生成するコストを削減するための作業の増加により、$ \ delta $ -MLおよびマルチディデリティの機械学習方法が開発され、複数のQCレベルの精度または忠実度でデータを使用しました。
この作業では、新たに導入されたマルチディデリティ$ \ delta $ -machine Learning（MF $ $ \ $ \ ergta $ ml）の標準的な貢献者の貢献者の栄養補助具合の普及のためのマルチディデリティ$ \ delta $ -machine Learning（MF $ \ segta $ ml）のメソッドとは対照的に、$ \ delta $ -ml、multifidelity機械学習（MFML）、および最適化されたMFML（O-MFML）に関連するデータコストを比較します。 Multifidelity Benchmark Dataset QEMFIからのダイポールモーメント。この評価は、各モデルに関連付けられたトレーニングデータ生成コストに基づいて行われ、単一の忠実度カーネルリッジ回帰（KRR）ケースと比較されます。結果は、多数の予測の場合にマルチディデリティメソッドの使用が標準$ \ delta $ -MLアプローチを上回ることを示しています。 MLモデルを使用していくつかの評価を必要とするアプリケーションの場合、$ \ delta $ -MLメソッドが好まれる場合がありますが、MF $ \ delta $ mlメソッドがより効率的であることが示されています。"
"Konstantinos Sfairopoulos, Juan P. Garrahan",The quantum Newman-Moore model in a longitudinal field,"We study the quantum Newman-Moore model, or quantum triangular plaquette model (qTPM), in the presence of a longitudinal field (qTPMz). We present evidence that indicates that the ground state phase diagram of the qTPMz includes various frustrated phases breaking translational symmetries, dependent on the specific sequence of system sizes used to take the large-size limit. This phase diagram includes the known first-order phase transition of the qTPM, but also additional first-order transitions due to the frustrated phases. Using the average longitudinal magnetization as an order parameter, we analyze the magnetization plateaus that characterize the ground state phases, describe their degeneracies, and obtain the qTPMz phase diagram using classical transfer matrix and quantum matrix product state techniques. We identify a region of parameter space which can be effectively described by a Rydberg blockade model on the triangular lattice and also find indications of $\mathbb{Z}_2$ topological order connecting the quantum paramagnetic and classical frustrated phases.",縦断分野の量子ニューマンムーアモデル,縦界（QTPMZ）の存在下で、量子ニューマンムーアモデル、または量子三角プラケットモデル（QTPM）を研究します。 QTPMZの基底状態相図には、大規模な制限をとるために使用されるシステムサイズの特定のシーケンスに依存するさまざまな欲求不満のフェーズが翻訳対称性を破壊するさまざまなイライラフェーズが含まれていることを示す証拠を提示します。この相図には、QTPMの既知の1次位相遷移が含まれていますが、欲求不満のフェーズによる追加の1次遷移も含まれます。順序パラメーターとして平均縦方向の磁化を使用して、基底状態の相を特徴付ける磁化プラトーを分析し、それらの変性を説明し、古典的な転送マトリックスと量子マトリックスの製品状態技術を使用してQTPMZ相図を取得します。三角形格子上のRydberg遮断モデルによって効果的に記述できるパラメーター空間の領域を特定し、量子の常磁性および古典的なフラストレートフェーズを結ぶ$ \ mathbb {z} _2 $トポロジー順序の兆候を見つけます。
"John M. Martyn, Patrick Rall",Halving the Cost of Quantum Algorithms with Randomization,"Quantum signal processing (QSP) provides a systematic framework for implementing a polynomial transformation of a linear operator, and unifies nearly all known quantum algorithms. In parallel, recent works have developed randomized compiling, a technique that promotes a unitary gate to a quantum channel and enables a quadratic suppression of error (i.e., $\epsilon \rightarrow O(\epsilon^2)$) at little to no overhead. Here we integrate randomized compiling into QSP through Stochastic Quantum Signal Processing. Our algorithm implements a probabilistic mixture of polynomials, strategically chosen so that the average evolution converges to that of a target function, with an error quadratically smaller than that of an equivalent individual polynomial. Because nearly all QSP-based algorithms exhibit query complexities scaling as $O(\log(1/\epsilon))$ -- stemming from a result in functional analysis -- this error suppression reduces their query complexity by a factor that asymptotically approaches $1/2$. By the unifying capabilities of QSP, this reduction extends broadly to quantum algorithms, which we demonstrate on algorithms for real and imaginary time evolution, phase estimation, ground state preparation, and matrix inversion.",ランダム化による量子アルゴリズムのコストを半分にする,量子信号処理（QSP）は、線形演算子の多項式変換を実装するための体系的なフレームワークを提供し、ほぼすべての既知の量子アルゴリズムを統合します。並行して、最近の作品はランダム化されたコンパイルを開発しました。これは、量子チャネルへの単一門を促進し、誤差の二次抑制を可能にする技術（すなわち、$ \ epsilon \ rightArrow o（\ epsilon^2）$）をほとんど無制限にしません。ここでは、確率的量子信号処理を介してランダム化コンパイルをQSPに統合します。私たちのアルゴリズムは、平均的な進化がターゲット関数のそれに収束するように戦略的に選択された多項式の確率論的混合物を実装し、同等の個々の多項式のエラーよりも2次誤差的に小さい。ほぼすべてのQSPベースのアルゴリズムは、$ o（\ log（1/\ epsilon））$としてクエリの複雑さを示すため、機能分析の結果に起因する - このエラー抑制は、クエリの複雑さを漸近的に$ 1/2 $に近づく因子によって減少します。 QSPの統合機能により、この削減は量子アルゴリズムに広く拡張されます。これは、実数および想像上の時間の進化、位相推定、基底状態の準備、およびマトリックス反転のためのアルゴリズムで示されます。
"Víctor Herráiz-López, Sebastián Roca-Jerat, Manuel Gallego, Ramón Ferrández, Jesús Carrete, David Zueco, Juan Román-Roche",First- and second-order quantum phase transitions in the long-range unfrustrated antiferromagnetic Ising chain,"We study the ground-state phase diagram of an unfrustrated antiferromagnetic Ising chain with longitudinal and transverse fields in the full range of interactions: from all-to-all to nearest-neighbors. First, we solve the model analytically in the strong long-range regime, confirming in the process that a mean-field treatment is exact for this model. We compute the order parameter and the correlations and show that the model exhibits a tricritical point where the phase transition changes from first to second order. This is in contrast with the nearest-neighbor limit where the phase transition is known to be second order. To understand how the order of the phase transition changes from one limit to the other, we tackle the analytically-intractable interaction ranges numerically, using a variational quantum Monte Carlo method with a neural-network-based ansatz, the visual transformer. We show how the first-order phase transition shrinks with decreasing interaction range and establish approximate boundaries in the interaction range for which the first-order phase transition is present. Finally, we establish that the key ingredient to stabilize a first-order phase transition and a tricritical point is the presence of ferromagnetic interactions between spins of the same sublattice on top of antiferromagnetic interactions between spins of different sublattices. Tunable-range unfrustrated antiferromagnetic interactions are just one way to implement such staggered interactions.",長距離の非強力な反強磁気イジングチェーンにおける1次および2次の量子相遷移,私たちは、すべての相互作用において、縦方向および横方向のフィールドを備えた、縦方向および横方向のフィールドを備えたフラストレーションのない反強磁性イジングチェーンの基本位相図を研究します。まず、強力な長距離レジームでモデルを分析的に解決し、このモデルの平均フィールド処理が正確であることを確認します。順序パラメーターと相関を計算し、モデルが位相遷移が1次から2次まで変化する三角的な点を示すことを示します。これは、位相遷移が2次であることが知られている最近傍制限とは対照的です。位相遷移の順序が一方の制限から他の制限にどのように変化するかを理解するために、分析的に受け入れられる相互作用の範囲に取り組み、視覚変圧器であるニューラルネットワークベースのAnsatzを使用した変動量子モンテカルロ法を使用します。一次位相遷移が相互作用範囲の減少でどのように収縮するかを示し、1次位相遷移が存在する相互作用範囲の近似境界を確立します。最後に、一次位相遷移と三分間点を安定させる重要な成分は、異なるサブラットのスピン間の反強磁性相互作用の上に同じ副甲状腺のスピン間の強磁性相互作用の存在であることを確立します。 Tuanable-Rangeの不快な反強磁性相互作用は、このようなずらした相互作用を実装する1つの方法にすぎません。
Ted Jacobson,Feynman 1947 letter on path integral for the Dirac equation,"In 1947, four months before the famous Shelter Island conference, Richard Feynman wrote a lengthy letter to his former MIT classmate Theodore Welton, reporting on his efforts to develop a path integral describing the propagation of a Dirac particle. While these efforts never came to fruition, and were shortly abandoned in favor of a very different method of dealing with the electron propagator appearing in in QED, the letter is interesting both from the historical viewpoint of revealing what Feynman was thinking about during that period just before the development of QED, and for its scientific ideas. It also contains at the end some philosophical remarks, which Feynman wraps up with the comment, ``Well enough for the baloney.'' In this article I present a transcription of the letter along with editorial notes, and a facsimile of the original handwritten document. I also briefly comment on Feynman's efforts and discuss their relation to some later work.",Feynman 1947 DIRAC方程式のパス積分に関する手紙,有名なシェルターアイランド会議の4か月前の1947年、リチャードファインマンは、元MITの同級生セオドアウェルトンに長い手紙を書き、ディラック粒子の伝播を説明するパス積分を開発する努力について報告しました。これらの努力は決し​​て実現することはなく、QEDに登場する電子プロパゲーターに対処する非常に異なる方法を支持してまもなく放棄されましたが、この手紙は、ファインマンがQEDの発展の直前に考えていたことを明らかにした歴史的観点から、またその科学的アイデアのために興味深いものです。また、最後にいくつかの哲学的な発言が含まれています。ファインマンはコメントで締めくくります。「Baloneyに十分です。」この記事では、編集ノートとともに文字の転写と元の手書き文書のファクシミリを提示します。また、ファインマンの努力について簡単にコメントし、後の仕事との関係について議論します。
"Mathew W. Bub, Temple He, Prahar Mitra, Yiwen Zhang, Kathryn M. Zurek",Quantum Mechanics of a Spherically Symmetric Causal Diamond in Minkowski Spacetime,"We construct the phase space of a spherically symmetric causal diamond in $(d+2)$-dimensional Minkowski spacetime. Utilizing the covariant phase space formalism, we identify the relevant degrees of freedom that localize to the $d$-dimensional bifurcate horizon and, upon canonical quantization, determine their commutators. On this phase space, we find two Iyer-Wald charges. The first of these charges, proportional to the area of the causal diamond, is responsible for shifting the null time along the horizon and has been well-documented in the literature. The second charge is much less understood, being integrable for $d \geq 2$ only if we allow for field-dependent diffeomorphisms and is responsible for changing the size of the causal diamond.",ミンコフスキー時代の球体対称因果ダイヤモンドの量子力学,$（d+2）$  - 次元Minkowski時の時空に球体対称因果ダイヤモンドの位相空間を構築します。共変動位相空間形式を利用して、$ d $ dimensional分岐地平線にローカライズする関連する自由度を特定し、標準的な量子化により、整流子を決定します。このフェーズスペースには、2つのIyer-Wald料金があります。因果ダイヤモンドの領域に比例したこれらの充電の最初は、地平線に沿ってヌル時間をシフトする責任があり、文献では十分に文書化されています。 2番目の充電はあまり理解されておらず、$ d \ geq 2 $の統合可能であり、フィールドに依存する違いを許可し、因果ダイヤモンドのサイズを変更する責任があります。
"Patrick Ettenhuber, Mads Bøttger Hansen, Irfansha Shaik, Stig Elkjær Rasmussen, Pier Paolo Poier, Niels Kristian Madsen, Marco Majland, Frank Jensen, Lars Olsen, Nikolaj Thomas Zinner",Calculating the energy profile of an enzymatic reaction on a quantum computer,"Quantum computing (QC) provides a promising avenue toward enabling quantum chemistry calculations, which are classically impossible due to a computational complexity that increases exponentially with system size. As fully fault-tolerant algorithms and hardware, for which an exponential speedup is predicted, are currently out of reach, recent research efforts are dedicated to developing and scaling algorithms for Noisy Intermediate-Scale Quantum (NISQ) devices to showcase the practical utility of such machines. To demonstrate the utility of NISQ devices in the field of chemistry, we apply our recently developed FAST-VQE algorithm and a novel quantum gate reduction strategy based on propositional satisfiability together with standard optimization tools for the simulation of the rate-determining proton transfer step for CO2 hydration catalysed by carbonic anhydrase resulting in the first application of a quantum computing device for the simulation of an enzymatic reaction. To this end, we have combined classical force field simulations with quantum mechanical methods on classical and quantum computers in a hybrid calculation approach. The presented technique significantly enhances the accuracy and capabilities of QC-based molecular modeling and finally pushes it into compelling and realistic applications. The framework is general and can be applied beyond the case of computational enzymology.",量子コンピューターでの酵素反応のエネルギープロファイルを計算する,Quantum Computing（QC）は、システムサイズとともに指数関数的に増加する計算の複雑さのために古典的に不可能な量子化学計算を可能にするための有望な手段を提供します。指数関数的なスピードアップが予測されている完全に耐性のあるアルゴリズムとハードウェアが現在手の届かないところにあるため、最近の研究努力は、そのような機械の実用的な特徴を紹介するための騒々しい中級スケールQuantum（NISQ）デバイスのアルゴリズムの開発とスケーリングに専念しています。化学分野でのNISQデバイスのユーティリティを実証するために、最近開発された高速VQEアルゴリズムと、標準的な最適化に基づいて最近開発された高速VQEアルゴリズムと、標準的な最適化ツールに基づいて、標準的な最適化ツールを適用して、炭酸ファンドラーゼが発生したcarbonicアンヒドラゼによって触媒されたCO2水分補給のためのレート決定プロトン転送ステップのシミュレーションのシミュレーションを適用します。この目的のために、ハイブリッド計算アプローチでは、古典的な力フィールドシミュレーションと古典的および量子コンピューターの量子機械的手法を組み合わせました。提示された手法は、QCベースの分子モデリングの精度と機能を大幅に向上させ、最終的にそれを説得力のある現実的なアプリケーションに押し上げます。フレームワークは一般的であり、計算酵素学の場合を超えて適用できます。
"Yunxiao Ye, Bin He, Jiayin Gu",Positivity Bounds in Scalar Effective Field Theories at One-loop Level,"Parameters in an effective field theory can be subject to certain positivity bounds if one requires a UV completion that obeys the fundamental principles of quantum field theory. These bounds are relatively straightforward at the tree level, but would become more obscure when loop effects are important. Using scalar theories as examples, we carefully exam the positivity bounds in a case where the leading contribution to a forward elastic amplitude arises at the one-loop level, and point out certain subtleties in terms of the implications of positivity bounds on the theory parameter space. In particular, the one-loop generated dimension-8 operator coefficients (that would be positive if generated at the tree level), as well as their $\beta$-functions are generally not subject to positivity bounds as they might correspond to interference terms of the cross sections under the optical theorem, which could have either sign. A strict positivity bound can only be implied when all contributions at the same loop order are considered, including the ones from dim-4 and dim-6 operator coefficients, which have important effects at the one-loop level. Our results may have important implications on the robustness of experimental tests of positivity bounds.",1ループレベルでのスカラーの効果的なフィールド理論の陽性境界,効果的なフィールド理論のパラメーターは、量子フィールド理論の基本原理に従うUV完了を必要とする場合、特定の陽性境界を課すことができます。これらの境界は、ツリーレベルでは比較的簡単ですが、ループ効果が重要な場合、より曖昧になります。例としてスカラー理論を使用して、前方弾性振幅への主要な寄与が1ループレベルで発生する場合の陽性境界を慎重に調べ、理論パラメーター空間に対する陽性境界の意味の観点から特定の微妙さを指摘します。特に、1ループ生成されたDimension-8演算子係数（ツリーレベルで生成された場合は正です）とその$ \ beta $ -Functionは、一般に、光学定理の下の断面の干渉条件に対応する可能性があるため、陽性境界の対象ではありません。厳密な陽性境界は、同じループ順序でのすべての寄与が考慮されている場合にのみ暗示できます。我々の結果は、陽性境界の実験テストの堅牢性に重要な意味を持つ可能性があります。
