authors,title,abstract,authors_trans,abstract_trans
"Lucas A. Ostrowski, Travis J. Baker, Dominic W. Berry, Howard M. Wiseman",Analytical results for laser models producing a beam with sub-Poissonian photon statistics and coherence scaling as the Heisenberg limit,"Recent advances in laser theory have demonstrated that a quantum enhancement is possible for the production of coherence $\mathfrak{C}$ by a continuous-wave laser device. Curiously, natural families of laser models that achieve Heisenberg-limited scaling for coherence produce the most coherence when the beam exhibits sub-Poissonian photon statistics. In this work, we provide an analytical treatment of those novel families of laser models by specializing to a parameter regime that permits a linearization. We characterize the dynamics of each laser system, and find that some of the intuitions from standard laser theory may be applied here. Specifically, the intracavity number dynamics are well-described as an Ornstein-Uhlenbeck process, while the intracavity phase dynamics are well-described in terms of a physically realizable ensemble of pure states, which evolve according to pure phase diffusion. Unlike a standard laser, however, we find that the pure states comprising the ensemble in the Heisenberg-limited lasers are substantially phase squeezed. From our dynamical analysis, we deduce various quantities of the beam for each laser family, including the first- and second-order Glauber coherence functions, intensity noise spectrum, Mandel-Q parameter and coherence $\mathfrak{C}$. In addition, inspired from these phase diffusion dynamics, we derive an upper bound on laser coherence $\mathfrak{C} \lesssim 1.1156 \mu^4$ -- which is tighter by a factor of $3/8$ when compared to that derived in [Baker et al., Nat. Phys. 17 179 (2021)] -- by making one of the assumptions of that paper slightly stronger.",レーザーモデルの分析結果サブポアソン光子統計を備えたビームを生成し、ハイゼンベルクの制限としてコヒーレンススケーリング,レーザー理論の最近の進歩により、連続波レーザーデバイスによるコヒーレンス$ \ mathfrak {c} $の生成に量子向上が可能であることが実証されています。不思議なことに、ハイゼンベルク制限されたコヒーレンスのスケーリングを達成するレーザーモデルの自然ファミリーは、ビームがサブポアソン光子統計を示す場合に最もコヒーレンスを生成します。この作業では、線形化を許可するパラメーター体制に特化することにより、レーザーモデルの新しいファミリーの分析的処理を提供します。各レーザーシステムのダイナミクスを特徴付け、標準レーザー理論からの直感の一部がここに適用される可能性があることがわかります。具体的には、能力内のダイナミクスはOrnstein-Uhlenbeckプロセスとしてよく説明されていますが、純粋な位相拡散に応じて進化する純粋な状態の物理的に実現可能なアンサンブルの観点から、能力内の位相ダイナミクスはよく説明されています。ただし、標準レーザーとは異なり、ハイゼンベルグ制限レーザーのアンサンブルを含む純粋な状態は、相当に位相絞り込まれていることがわかります。動的分析から、1次および2次グラウバーコヒーレンス関数、強度ノイズスペクトル、マンデル-Qパラメーター、コヒーレンス$ \ mathfrak {c} $など、各レーザーファミリーのさまざまな量のビームを推定します。さらに、これらの位相拡散ダイナミクスからインスピレーションを得て、レーザーコヒーレンス$ \ mathfrak {c} \ lesssim 1.1156 \ mu^4 $の上限を導き出します。 [Baker et al。、nat。 Phys。 17 179（2021）]  - その論文の仮定の1つをわずかに強くすることによって。
"J. Sedaghat, G. H. Bordbar, M. Haghighat, S. M. Zebarjad",Influence of dark matter on the structure of strange quark stars in one-fluid model,"This work studies the influence of scalar dark matter on the structural properties of strange quark stars (SQS) within a one-fluid framework, considering Yukawa interactions between dark matter and quark matter. Contributions from perturbative QCD, Yukawa interaction between scalar dark matter and quarks, and Bose-Einstein condensation of dark matter are included in the model. We first determine the allowable range of Yukawa interaction coupling by imposing the stability condition for strange quark matter (SQM). Using this range, we derive the equation of state (EOS) for different fractions of dark matter within the total pressure of SQS. These fractions are constrained by the tidal deformability limit from GW170817. The presence of dark matter alters the EOS, leading to changes in the mass-radius relationship, tidal deformability, and stability of SQS. We demonstrate that increasing the mass of dark matter softens the EOS, whereas higher fractions of dark matter lead to stiffer EOSs. We also explore the reasons behind this behavior. Our EOSs not only describe massive objects, such as PSR J0952-0607 and PSR J2215+5135, but also satisfy the tidal deformability constraint from GW170817. These results reveal that incorporating dark matter modifies the EOS, enabling the support of higher stellar masses while maintaining consistency with observational data.",ワンフルイドモデルにおける奇妙なクォーク星の構造に対する暗黒物質の影響,この作業は、暗黒物質とQuark物質の間のユカワの相互作用を考慮して、1流体フレームワーク内の奇妙なクォーク星（SQS）の構造的特性に対するスカラー暗黒物質の影響を研究しています。摂動QCD、スカラーダークマターとクォークの間のユカワの相互作用、および暗黒物質のボーズエインシュタイン凝縮からの貢献がモデルに含まれています。最初に、奇妙なQuark物質（SQM）の安定性条件を課すことにより、Youkawa相互作用の結合の許容範囲を決定します。この範囲を使用して、SQSの総圧力内で暗黒物質のさまざまな画分の状態方程式（EOS）を導き出します。これらの画分は、GW170817からの潮の変形性制限によって制約されています。暗黒物質の存在はEOSを変化させ、大量radius関係の変化、潮の変形性、およびSQSの安定性をもたらします。暗黒物質の質量を増やすとEOSが柔らかくなるのに対し、暗黒物質の高い画分は硬いEOSSにつながることを実証します。また、この行動の背後にある理由も探ります。私たちのEOSSは、PSR J0952-0607やPSR J2215+5135などの巨大なオブジェクトを記述するだけでなく、GW170817からの潮の変形性の制約も満たしています。これらの結果は、暗黒物質を組み込むことでEOSを変更し、観測データとの一貫性を維持しながら、より高い恒星の質量のサポートを可能にすることが明らかになりました。
"Bo Zhao, Zhihang Li, Xiaohan Yu, Benzheng Yuan, Chaojie Zhang, Yimin Gao, Weilong Wang, Qing Mu, Shuya Wang, Huihui Sun, Tian Yang, Mengfan Zhang, Chuanbing Han, Peng Xu, Wenqing Wang, Zheng Shan",EDA-Q: Electronic Design Automation for Superconducting Quantum Chip,"Electronic Design Automation (EDA) plays a crucial role in classical chip design and significantly influences the development of quantum chip design. However, traditional EDA tools cannot be directly applied to quantum chip design due to vast differences compared to the classical realm. Several EDA products tailored for quantum chip design currently exist, yet they only cover partial stages of the quantum chip design process instead of offering a fully comprehensive solution. Additionally, they often encounter issues such as limited automation, steep learning curves, challenges in integrating with actual fabrication processes, and difficulties in expanding functionality. To address these issues, we developed a full-stack EDA tool specifically for quantum chip design, called EDA-Q. The design workflow incorporates functionalities present in existing quantum EDA tools while supplementing critical design stages such as device mapping and fabrication process mapping, which users expect. EDA-Q utilizes a unique architecture to achieve exceptional scalability and flexibility. The integrated design mode guarantees algorithm compatibility with different chip components, while employing a specialized interactive processing mode to offer users a straightforward and adaptable command interface. Application examples demonstrate that EDA-Q significantly reduces chip design cycles, enhances automation levels, and decreases the time required for manual intervention. Multiple rounds of testing on the designed chip have validated the effectiveness of EDA-Q in practical applications.",EDA-Q：超伝導量子チップのための電子設計自動化,Electronic Design Automation（EDA）は、古典的なチップ設計において重要な役割を果たし、量子チップ設計の開発に大きな影響を与えます。ただし、従来のEDAツールは、古典的な領域と比較して大きな違いがあるため、量子チップ設計に直接適用することはできません。現在、量子チップ設計に合わせて調整されたいくつかのEDA製品は現在存在しますが、完全に包括的なソリューションを提供する代わりに、量子チップ設計プロセスの部分段階のみをカバーしています。さらに、彼らはしばしば、限られた自動化、急な学習曲線、実際の製造プロセスとの統合における課題、機能性の拡大の困難などの問題に遭遇します。これらの問題に対処するために、EDA-Qと呼ばれる量子チップ設計専用のフルスタックEDAツールを開発しました。設計ワークフローには、既存の量子EDAツールに存在する機能が組み込まれ、ユーザーが期待するデバイスマッピングや製造プロセスマッピングなどの重要な設計段階を補完します。 EDA-Qは、ユニークなアーキテクチャを利用して、並外れたスケーラビリティと柔軟性を実現しています。統合された設計モードは、さまざまなチップコンポーネントとのアルゴリズムの互換性を保証し、特殊なインタラクティブ処理モードを使用してユーザーに簡単で適応可能なコマンドインターフェイスを提供します。アプリケーションの例は、EDA-Qがチップ設計サイクルを大幅に削減し、自動化レベルを高め、手動介入に必要な時間を短縮することを示しています。設計されたチップでの複数回のテストにより、実際のアプリケーションでのEDA-Qの有効性が検証されました。
"Sathwik Narkedimilli, Venkata Sriram Amballa, N V Saran Kumar, R Arun Kumar, R Praneeth Reddy, Satvik Raghav, Manish M, Aswath Babu H",Comparative Analysis of Black Hole Mass Estimation in Type-2 AGNs: Classical vs. Quantum Machine Learning and Deep Learning Approaches,"In the case of Type-2 AGNs, estimating the mass of the black hole is challenging. Understanding how galaxies form and evolve requires considerable insight into the mass of black holes. This work compared different classical and quantum machine learning (QML) algorithms for black hole mass estimation, wherein the classical algorithms are Linear Regression, XGBoost Regression, Random Forest Regressor, Support Vector Regressor (SVR), Lasso Regression, Ridge Regression, Elastic Net Regression, Bayesian Regression, Decision Tree Regressor, Gradient Booster Regressor, Classical Neural Networks, Gated Recurrent Unit (GRU), LSTM, Deep Residual Networks (ResNets) and Transformer-Based Regression. On the other hand, quantum algorithms including Hybrid Quantum Neural Networks (QNN), Quantum Long Short-Term Memory (Q-LSTM), Sampler-QNN, Estimator-QNN, Variational Quantum Regressor (VQR), Quantum Linear Regression(Q-LR), QML with JAX optimization were also tested. The results revealed that classical algorithms gave better R^2, MAE, MSE, and RMSE results than the quantum models. Among the classical models, LSTM has the best result with an accuracy of 99.77%. Estimator-QNN has the highest accuracy for quantum algorithms with an MSE of 0.0124 and an accuracy of 99.75%. This study ascertains both the strengths and weaknesses of the classical and the quantum approaches. As far as our knowledge goes, this work could pave the way for the future application of quantum algorithms in astrophysical data analysis.",タイプ-2 AGNSのブラックホール質量推定の比較分析：古典的vs量子機械学習とディープラーニングアプローチ,タイプ2 AGNSの場合、ブラックホールの質量を推定することは困難です。銀河がどのように形成され進化するかを理解するには、ブラックホールの質量に関するかなりの洞察が必要です。この作業は、ブラックホール質量推定のためのさまざまな古典および量子機械学習（QML）アルゴリズムを比較しました。これは、古典的なアルゴリズムが線形回帰、xgboost回帰、ランダム森林回帰、サポートベクター回帰（SVR）、ラッソ回帰、尾根回帰、弾性正味回帰です。 、ベイジアン回帰、決定ツリー回帰、グラデーションブースターレグレッサー、古典的なニューラルネットワーク、ゲート再発ユニット（GRU）、LSTM、深部残留ネットワーク（RESNET）、トランスベースの回帰。一方、ハイブリッド量子ニューラルネットワーク（QNN）、量子長期記憶（Q-LSTM）、サンプラー-QNN、推定器QNN、変分量子回帰（VQR）、量子線形回帰（Q-LR ）、JAX最適化を備えたQMLもテストされました。結果は、古典的なアルゴリズムが量子モデルよりも優れたr^2、MAE、MSE、およびRMSEの結果を与えたことを明らかにしました。古典モデルの中で、LSTMは99.77％の精度で最良の結果をもたらします。推定器-QNNは、MSEの0.0124と99.75％の精度を持つ量子アルゴリズムの精度が最も高くなっています。この研究では、古典的アプローチと量子アプローチの長所と短所の両方を確認します。私たちの知識に関する限り、この作業は、天体物理学的データ分析における量子アルゴリズムの将来のアプリケーションへの道を開く可能性があります。
"Hashir Kuniyil, Saif Al-Kuwari, Asad Ali, Artur Czerwinski, Syed M. Arslan",Optimizing Continuous-Wave Pumped Entanglement-based QKD in Noisy Environment,"Quantum key distribution (QKD) has emerged as a promising solution to protect current cryptographic systems against the threat of quantum computers. As QKD transitions from laboratories to real-world applications, its implementation under various environmental conditions has become a pressing challenge. Major obstacles to practical QKD implementation are the loss of photons in the transmission media and the presence of extreme noise, which can severely limit long-range transmission. In this paper, we investigate the impact of extreme noise on QKD system parameters, including detector timing uncertainty (jitter), measurement timing shifts, variations in detector deadtime, and rate-dependent detector efficiency. Contrary to manufacturers' specifications, which assume these parameters to be constant, we demonstrate that these parameters exhibit significant variations in extreme noise conditions. We show that changes in these parameters play a key role in determining system performance in noisy environments. To address these non-idealities, we develop a robust model that can address and adapt to various detector characteristics. In particular, our model is independent of source parameters and can be implemented using data from the detection unit. Our results show that our model is well suited for characterizing and optimizing the performance of the QKD system under noisy conditions.",騒々しい環境で連続波ポンプのエンタングルメントベースのQKDを最適化します,量子キー分布（QKD）は、量子コンピューターの脅威から現在の暗号システムを保護する有望なソリューションとして浮上しています。 QKDは研究所から現実世界のアプリケーションに移行するにつれて、さまざまな環境条件下での実装が差し迫った課題となっています。実用的なQKD実装に対する主な障害は、伝送媒体での光子の損失と、長距離伝播を厳しく制限する可能性のある極端なノイズの存在です。このホワイトペーパーでは、検出器のタイミングの不確実性（ジッター）、測定タイミングのシフト、検出器の死者の変動、レート依存の検出器効率など、QKDシステムパラメーターに対する極端なノイズの影響を調査します。これらのパラメーターが一定であると仮定するメーカーの仕様とは反対に、これらのパラメーターが極端な騒音条件に大きな変動を示すことを示します。これらのパラメーターの変化は、騒々しい環境でのシステムパフォーマンスを決定する上で重要な役割を果たすことを示しています。これらの非理想性に対処するために、さまざまな検出器特性に対処して適応できる堅牢なモデルを開発します。特に、私たちのモデルはソースパラメーターに依存しないものであり、検出ユニットのデータを使用して実装できます。私たちの結果は、私たちのモデルが騒々しい条件下でQKDシステムのパフォーマンスを特徴付けて最適化するのに適していることを示しています。
"Zhen-Hua Zhao, Yi-Ning Gu, Shu-Cong Liu, Long-Xing Huang, Yong-Qiang Wang",Non-Topological Soliton Bardeen Boson Stars and Their Frozen States,"We investigate a Bardeen model coupling Einstein gravity with nonlinear electromagnetic fields and non-topological soliton complex scalar fields, governed by the magnetic charge $\tilde{q}$, the complex scalar field frequency $\tilde{\omega}$, and the self-interaction parameter $\tilde{\eta}$. Our results reveal that the magnetic charge $\tilde{q}$ exhibits $\tilde{\eta}$-dependent critical values $\tilde{q}_c$, beyond which ($\tilde{q} > \tilde{q}_c$) Bardeen boson stars (BBSs) may transition into frozen states ($\tilde{\omega} \to 0$). These frozen states are characterized by a critical horizon whose radius $\tilde r^\mathrm{H}_{c}$ satisfies $\tilde r_{\text{inner}}^{\text{H,RN}} < \tilde r_{c} < \tilde r_{\text{outer}}^{\text{H,RN}}$, where $\tilde r_{\text{inner}}^{\text{H,RN}}$ and $\tilde r_{\text{outer}}^{\text{RN}}$ denote the inner and outer horizons of magnetic Reissner-Nordström (RN) black holes with equivalent mass and magnetic charge. Notably, the ADM mass of frozen BBSs is independent of $\tilde{\eta}$. Furthermore, light ring (LR) solutions exist universally across all tested combinations of $\tilde{q}$ and $\tilde{\eta}$, with all frozen BBSs exhibiting LRs whose outer radius $\tilde r_{\text{outer}}^{\text{LR}}$ is independent of $\tilde{\eta}$. Compared to magnetic RN black holes, frozen BBSs possess a smaller outer LR radius ($\tilde r_{\text{outer}}^{\text{LR}} < \tilde r_{\text{outer}}^{\text{LR, RN}}$).",非トポロジーソリトンバーディーンボソンスターとその凍結状態,アインシュタインの重力を非線形電磁界と非地位性のソリトン複合体スカラーフィールドと結合するバーディーンモデルを調査します。自己相互作用パラメーター$ \ Tilde {\ eta} $。我々の結果は、磁気電荷$ \ tilde {q} $が$ \ tilde {\ eta} $を展示していることを明らかにしています - 依存の臨界値$ \ tilde {q} _c $ } _c $）Bardeen Boson Stars（BBSS）は凍結状態に移行する場合があります（$ \ tilde {\ omega} \ to 0 $）。これらの凍結状態は、半径$ \ tilde r^\ mathrm {h} _ {c} $を満たす$ \ tilde r _ {\ text {inner}}^{\ text {h、rn}} <\を満たす重要な地平線によって特徴付けられます。 Tilde R_ {c} <\ tilde r _ {\ text {outer}}^{\ text {h、rn}} $、ここで$ \ tilde r _ {\ text {inenter}}^{\ text {h、rn}} $および$ \ tilde r _ {\ {\ text {outer}}^{\ text {rn}} $は、内側と外側の視野を示します磁気Reissner-Nordström（RN）ブラックホールの同等の質量と磁気電荷。特に、凍結BBSSのADM質量は$ \ Tilde {\ eta} $に依存しません。さらに、ライトリング（LR）ソリューションは、$ \ tilde {q} $および$ \ tilde {\ eta} $のすべてのテストされた組み合わせに普遍的に存在し、すべての冷凍BBSSが外側の$ \ tilde r _ {\ {\ text {outer }}^{\ text {lr}} $は独立しています$ \ tilde {\ eta} $。磁気RNブラックホールと比較して、冷凍BBSSにはより小さな外側のLR半径があります（$ \ Tilde r _ {\ text {outer}}^{\ text {lr}} <\ tilde r _ {\ text {outer}}^{\ text {lr、rn}} $）。
"Ciro De Simone, Vittorio De Falco, Salvatore Capozziello",Can wormholes mirror the quasi-normal mode spectrum of Schwarzschild black holes?,"Wormholes are exotic compact objects characterized by the absence of essential singularities and horizons, acting as slender bridges linking two distinct regions of spacetime. Despite their theoretical significance, they remain however undetected, possibly due to their ability to closely mimic the observational properties of black holes. This study explores whether a static and spherically symmetric wormhole within General Relativity can reproduce the quasi-normal mode spectrum of a Schwarzschild black hole under scalar, electromagnetic, and axial gravitational perturbations, both individually and in combination. To address this, we reformulate the wormhole metric components using a near-throat parametrization. Our analysis concentrates on the fundamental mode and first overtone, estimated via the Wentzel-Kramers-Brillouin method. By employing a customized minimization strategy, we demonstrate that within a specific region of the parameter space, a wormhole can successfully replicate a subset of the black hole quasi-normal mode spectrum.",ワームホールは、シュワルツチャイルドのブラックホールの準ノーマルモードスペクトルをミラーリングできますか？,ワームホールは、本質的な特異性と地平線がないことを特徴とするエキゾチックなコンパクトなオブジェクトであり、時空の2つの異なる領域を結ぶ細い橋として機能します。彼らの理論的意義にもかかわらず、それらは、おそらくブラックホールの観測特性を密接に模倣する能力のために、おそらくそれらは検出されません。この研究では、一般相対性理論内の静的および球体対称のワームホールが、個々と組み合わせの両方で、スカラー、電磁、軸の重力摂動の下でシュワルツチャイルドブラックホールの準ノーマルモードスペクトルを再現できるかどうかを調査します。これに対処するために、腐敗に近いパラメーター化を使用して、ワームホールメトリックコンポーネントを再定式化します。私たちの分析は、基本モードと最初のオーバートーンに集中し、Wentzel-Kramers-Brillouinメソッドを介して推定されます。カスタマイズされた最小化戦略を採用することにより、パラメーター空間の特定の領域内で、ワームホールがブラックホール準正規モードスペクトルのサブセットを正常に複製できることを実証します。
