authors,title,abstract,authors_trans,abstract_trans
"Moin Uddin Maruf, Sungmin Kim, Zeeshan Ahmad",Equivariant Machine Learning Interatomic Potentials with Global Charge Redistribution,"Machine learning interatomic potentials (MLIPs) provide a computationally efficient alternative to quantum mechanical simulations for predicting material properties. Message-passing graph neural networks, commonly used in these MLIPs, rely on local descriptor-based symmetry functions to model atomic interactions. However, such local descriptor-based approaches struggle with systems exhibiting long-range interactions, charge transfer, and compositional heterogeneity. In this work, we develop a new equivariant MLIP incorporating long-range Coulomb interactions through explicit treatment of electronic degrees of freedom, specifically global charge distribution within the system. This is achieved using a charge equilibration scheme based on predicted atomic electronegativities. We systematically evaluate our model across a range of benchmark periodic and non-periodic datasets, demonstrating that it outperforms both short-range equivariant and long-range invariant MLIPs in energy and force predictions. Our approach enables more accurate and efficient simulations of systems with long-range interactions and charge heterogeneity, expanding the applicability of MLIPs in computational materials science.",グローバル電荷再分布を備えた等衛生機械学習間ポテンシャル,機械学習間原子間ポテンシャル（MLIP）は、材料特性を予測するための量子機械シミュレーションに計算的に効率的な代替品を提供します。これらのMLIPで一般的に使用されるメッセージパスグラフニューラルネットワークは、ローカル記述子ベースの対称関数に依存して、原子相互作用をモデル化します。ただし、このようなローカル記述子ベースのアプローチは、長距離相互作用、電荷移動、および組成の不均一性を示すシステムと闘っています。この作業では、電子自由度、特にシステム内のグローバルな電荷分布の明示的な処理を通じて、長距離クーロン相互作用を組み込んだ新しい等量のMLIPを開発します。これは、予測された原子電気存在性に基づいた電荷平衡スキームを使用して達成されます。さまざまなベンチマークの周期および非周期データセットにわたってモデルを体系的に評価し、エネルギーと力の予測における短距離等量および長距離不変MLIPの両方を上回ることを示しています。当社のアプローチにより、長距離相互作用と充電不均一性を備えたシステムのより正確で効率的なシミュレーションが可能になり、計算材料科学におけるMLIPの適用性が拡大します。
"Jinou Dong (1), Xueqin Zhao (1), Lingfeng Xie (1), Xun Pan (1), Haoyuan Tang (1), Zhicheng Xu (1), Guoxiang Zhi (2), Chao Cao (1 and 3), Xiaoqun Wang (1 and 3), Fanlong Ning (1, 3, 4 and 5) ((1) School of Physics, Zhejiang University, Hangzhou, China, (2) Tianmushan Laboratory, Hangzhou, China, (3) Institute for Advanced Study in Physics, Zhejiang University, Hangzhou, China, (4) State Key Laboratory of Silicon and Advanced Semiconductor Materials, Zhejiang University, Hangzhou, China,(5) Collaborative Innovation Center of Advanced Microstructures, Nanjing University, Nanjing, China)",Spin disorder state induced by Mg$^{2+}$ doping in a Kitaev material Na$_{3}$Co$_{2}$SbO$_{6}$,"Due to the dominant Kitaev exchange interactions, the cobaltate, Na$_{3}$Co$_{2}$SbO$_{6}$, has been considered to be approximate to the Kitaev quantum spin liquid (QSL). Here, we investigate both magnetic dilution and chemical pressure effects of Na$_{3}$Co$_{2}$SbO$_{6}$ by the substitutions of Mg$^{2+}$ for Co$^{2+}$ through the structural, optical, magnetic and thermodynamic measurements. No structural transition has been observed, and the bandgaps remain constant in all doping levels. Combining with the magnetic and thermodynamic measurements, we find that the antiferromagnetic transition temperature is continuously suppressed with increasing Mg doping levels and completely disappears at $x=0.2$. Interestingly, when the doping level $x$ is larger than 0.2, neither long-range magnetic order nor spin glass state has been detected, and the specific heat has a residual linear term at zero field. All features indicate that Na$_{3}$(Co$_{2-x}$Mg$_{x}$)SbO$_{6}$ system enters into a novel spin disorder (NSD) state.",Mg $^{2+} $ kitaev Material Na $ _ {3} $ co $ _ {2} $ sbo $ _ {6} $のドーピングによって誘導されるスピン障害状態,支配的なキタエフ交換の相互作用により、コバルト酸塩Na $ _ {3} $ co $ _ {2} $ sbo $ _ {6} $は、Kitaev Quantum Spin Liquid（QSL）に近似していると考えられています。ここでは、構造、光学、磁気、および熱力学的測定値を介してmg $^{2+} $のmg $^{2+} $の置換により、Na $ _ {3} $ co $ _ {2} $ sbo $ _ {6 {6} $の磁気希釈と化学的圧力効果の両方を調査します。構造遷移は観察されておらず、バンドガップはすべてのドーピングレベルで一定のままです。磁気および熱力学的測定と組み合わせることで、反強磁性遷移温度はMgドーピングレベルの増加で継続的に抑制され、$ x = 0.2 $で完全に消失することがわかります。興味深いことに、ドーピングレベルの$ x $が0.2を超えると、長距離磁気順序もスピンガラス状態も検出されず、比熱はゼロフィールドに残留線形項を持っています。すべての機能は、na $ _ {3} $（co $ _ {2-x} $ mg $ _ {x} $）SBO $ _ {6} $システムが新規スピン障害（NSD）状態に入ることを示しています。
"Jayarshi Bhattacharya, Gautam Gangopadhyay, Sunandan Gangopadhyay",Current and quantum transport factor of fermionic system in fermionic bath,"This paper explores the dynamics of current and the quantum transport factor in a fermionic system with a central oscillator interacting with two fermionic reservoirs at different temperatures. We derive the master equation for the system density matrix, accounting for energy exchange between the system and the reservoirs. The current is analyzed in relation to system parameters and reservoir temperatures, revealing that the quantum transport factor differs from classical systems, approaching Carnot efficiency at high temperatures but being different at low temperatures. We also examine the power spectrum of the current, providing insights into current fluctuations and their temperature dependence. Furthermore, we derive the Fokker-Planck equation and the Glauber-Sudarshan P-representation, where the steady-state probability distribution takes a Gaussian form, confirming the system behaves like a harmonic oscillator. This work advances the understanding of quantum transport in fermionic systems and provides a foundation for future research in quantum thermodynamics.",フェルミオン浴のフェルミオンシステムの現在および量子輸送因子,このホワイトペーパーでは、異なる温度で2つのフェルミオン貯留層と相互作用する中央の発振器を備えたフェルミオンシステムの電流と量子輸送係数のダイナミクスを探ります。システム密度マトリックスのマスター方程式を導き出し、システムと貯水池の間のエネルギー交換を説明します。電流はシステムパラメーターと貯水池の温度に関連して分析され、量子輸送因子が古典的なシステムとは異なり、高温でカルノの効率に近づいているが、低温では異なることが明らかになりました。また、電流のパワースペクトルを調べ、電流の変動とその温度依存性に関する洞察を提供します。さらに、Fokker-Planck方程式とGlauber-Sudarshanのp表現を導き出します。そこでは、定常状態の確率分布がガウス形式をとって、システムが調和発振器のように動作するように動作します。この研究は、フェミオンシステムにおける量子輸送の理解を進め、量子熱力学の将来の研究の基盤を提供します。
"Xiaojie Fan, Yukun Yang, Himanshu Gupta, C.R. Ramakrishnan",Distribution and Purification of Entanglement States in Quantum Networks,"We consider problems of distributing high-fidelity entangled states across nodes of a quantum network. We consider a repeater-based network architecture with entanglement swapping (fusion) operations for generating long-distance entanglements, and purification operations that produce high-fidelity states from several lower-fidelity states. The contributions of this paper are two-fold: First, while there have been several works on fidelity-aware routing and incorporating purification into routing for generating EPs, this paper presents the first algorithms for optimal solutions to the high-fidelity EP distribution problem. We provide a dynamic programming algorithm for generating the optimal tree of operations to produce a high-fidelity EP, and an LP-based algorithm for generating an optimal collection of trees. Second, following the EP algorithms, this paper presents the first algorithms for the high-fidelity GHZ-state distribution problem and characterizes its optimality. We evaluate our techniques via simulations over NetSquid, a quantum network simulator.",量子ネットワークにおけるエンタングルメント状態の分布と精製,量子ネットワークのノード全体に高忠実度が絡み合った状態を分配する問題を検討します。長距離の絡み合いを生成するためのエンタングルメントスワッピング（融合）操作を備えたリピーターベースのネットワークアーキテクチャ、およびいくつかの低忠実度状態から高忠実度状態を生成する精製操作を検討します。このペーパーの貢献は2つあります。最初に、忠実度を意識したルーティングとEPSを生成するためのルーティングに浄化を組み込むことに関するいくつかの作業がありましたが、このホワイトペーパーでは、高忠実度のEP分布問題に対する最適なソリューションのための最初のアルゴリズムを提示します。最適な操作ツリーを生成するための動的プログラミングアルゴリズムを提供して、高忠実度EPを生成し、LPベースのアルゴリズムを生成するためのLPベースのアルゴリズムを提供します。第二に、EPアルゴリズムに従って、このペーパーでは、高忠実度GHz状態分布の問題の最初のアルゴリズムを提示し、その最適性を特徴付けます。量子ネットワークシミュレーターであるNetsquidを介したシミュレーションを介して手法を評価します。
Ross Glew,Wavefunction coefficients from Amplitubes,"Given a graph its set of connected subgraphs (tubes) can be defined in two ways: either by considering subsets of edges, or by considering subsets of vertices. We refer to these as binary tubes and unary tubes respectively. Both notions come with a natural compatibility condition between tubes which differ by a simple adjacency constraint. Compatible sets of tubes are refered to as tubings. By considering the set of binary tubes, and summing over all maximal binary-tubings, one is lead to an expression for the flat space wavefunction coefficients relevant for computing cosmological correlators. On the other hand, considering the set of unary tubes, and summing over all maximal unary-tubings, one is lead to expressions recently referred to as amplitubes which resemble the scattering amplitudes of $\text{tr}(\phi^3)$ theory. In this paper we study the two definitions of tubing in order to provide a new formula for the flat space wavefunction coefficient for a single graph as a sum over products of amplitubes. Motivated by our rewriting of the wavefunction coefficient we introduce a new definition of tubing which makes use of both the binary and unary tubes which we refer to as cut tubings. We explain how each cut tubing induces a decorated orientation of the underlying graph satisfying an acyclic condition and demonstrate how the set of all acyclic decorated orientations for a given graph count the number of basis functions appearing in the kinematic flow.",波動関数係数は、アンプリピューブから,グラフが与えられた場合、接続されたサブグラフ（チューブ）のセットは、エッジのサブセットを考慮するか、頂点のサブセットを考慮することにより、2つの方法で定義できます。これらをそれぞれバイナリチューブと単一チューブと呼びます。どちらの概念にも、単純な隣接の制約によって異なるチューブ間の自然な互換性条件があります。互換性のあるチューブセットは、チューブと呼ばれます。バイナリチューブのセットを考慮し、すべての最大バイナリチューブを合計することにより、宇宙論的相関器の計算に関連するフラット波動関数係数の式につながります。一方、unaryチューブのセットを考慮して、すべての最大unaryチューブを合計すると、最近$ \ text {tr}（\ phi^3）$理論の散乱振幅に似たアンプリピューブと呼ばれる表現につながります。このホワイトペーパーでは、アンプリトーブの積の合計として、単一のグラフのフラット空間波動関数係数の新しい式を提供するために、チューブの2つの定義を検討します。波動関数係数の書き換えによって動機付けられているのは、カットチューブと呼ばれるバイナリチューブとunaryチューブの両方を使用するチューブの新しい定義を導入します。各カットチューブが、非環式状態を満たす基礎となるグラフの装飾された方向をどのように誘導し、特定のグラフのすべての非環式装飾された方向のセットが運動の流れに現れる基底関数の数をカウントする方法を示します。
"Matteo Baggioli, Kyoung-Bum Huh, Hyun-Sik Jeong, Xuhao Jiang, Keun-Young Kim, Juan F. Pedraza",Singular Value Decomposition and Its Blind Spot for Quantum Chaos in Non-Hermitian Sachdev-Ye-Kitaev Models,"The study of chaos and complexity in non-Hermitian quantum systems poses significant challenges due to the emergence of complex eigenvalues in their spectra. Recently, the singular value decomposition (SVD) method was proposed to address these challenges. In this work, we identify two critical shortcomings of the SVD approach when analyzing Krylov complexity and spectral statistics in non-Hermitian settings. First, we show that SVD fails to reproduce conventional eigenvalue statistics in the Hermitian limit for systems with non-positive definite spectra, as exemplified by a variant of the Sachdev-Ye-Kitaev (SYK) model. Second, and more fundamentally, Krylov complexity and spectral statistics derived via SVD cannot distinguish chaotic from integrable non-Hermitian dynamics, leading to results that conflict with complex spacing ratio analysis. Our findings reveal that SVD is inadequate for probing quantum chaos in non-Hermitian systems, and we advocate employing more robust methods, such as the bi-Lanczos algorithm, for future research in this direction.",非ヘルミティアンSachdev-Ye-kitaevモデルにおける量子カオスの特異値分解とその死角,非ヘルミティアの量子システムにおけるカオスと複雑さの研究は、そのスペクトルに複雑な固有値が出現するため、大きな課題をもたらします。最近、これらの課題に対処するために、特異値分解（SVD）メソッドが提案されました。この作業では、非ヘルミティア環境でのKrylovの複雑さとスペクトル統計を分析する際に、SVDアプローチの2つの重要な欠点を特定します。まず、SVDは、Sachdev-Ye-Kitaev（Syk）モデルの変形によって例示されるように、非陽性の明確なスペクトルを持つシステムのエルミット制限の従来の固有値統計を再現できないことを示します。第二に、そしてより根本的に、SVDを介して導出されたKrylovの複雑さとスペクトル統計は、混oticと統合可能な非ヘルミティアのダイナミクスを区別することはできず、複雑な間隔比分析と矛盾する結果につながります。私たちの調査結果は、SVDが非ヘルミティアシステムで量子カオスを調査するのに不十分であることを明らかにしており、この方向の将来の研究のために、Bi-Lanczosアルゴリズムなどのより堅牢な方法を採用することを提唱しています。
"Po-Shen Hsin, Ryohei Kobayashi, Carolyn Zhang",Anomalies of Coset Non-Invertible Symmetries,"Anomalies of global symmetries provide important information on the quantum dynamics. We show the dynamical constraints can be organized into three classes: genuine anomalies, fractional topological responses, and integer responses that can be realized in symmetry-protected topological (SPT) phases. Coset symmetry can be present in many physical systems including quantum spin liquids, and the coset symmetry can be a non-invertible symmetry. We introduce twists in coset symmetries, which modify the fusion rules and the generalized Frobenius-Schur indicators. We call such coset symmetries twisted coset symmetries, and they are labeled by the quadruple $(G,K,\omega_{D+1},\alpha_D)$ in $D$ spacetime dimensions where $G$ is a group and $K\subset G$ is a discrete subgroup, $\omega_{D+1}$ is a $(D+1)$-cocycle for group $G$, and $\alpha_{D}$ is a $D$-cochain for group $K$. We present several examples with twisted coset symmetries using lattice models and field theory, including both gapped and gapless systems (such as gapless symmetry-protected topological phases). We investigate the anomalies of general twisted coset symmetry, which presents obstructions to realizing the coset symmetry in (gapped) symmetry-protected topological phases. We show that finite coset symmetry $G/K$ becomes anomalous when $G$ cannot be expressed as the bicrossed product $G=H\Join K$, and such anomalous coset symmetry leads to symmetry-enforced gaplessness in generic spacetime dimensions. We illustrate examples of anomalous coset symmetries with $A_5/\mathbb{Z}_2$ symmetry, with realizations in lattice models.",コセットの非可逆的対称性の異常,グローバル対称性の異常は、量子ダイナミクスに関する重要な情報を提供します。動的な制約は、対称性保護されたトポロジー（SPT）フェーズで実現できる、本物の異常、分数トポロジー応答、および整数応答の3つのクラスに整理できることを示します。コセットの対称性は、量子スピン液を含む多くの物理システムに存在する可能性があり、コセットの対称性は非可変対称性になります。 COSET対称性にTwistsを紹介します。これにより、Fusionルールと一般化されたFrobenius-Schurインジケーターが変更されます。このようなコセットの対称性ツイストコセット対称と呼び、$ d $ g $がグループであり、$ k \ subget g $は$ d $ g $が$ d $ d $ spacetime寸法で四重額（g、k、\ omega_ {d+1}、\ alpha_d）によってラベル付けされています。 $（d+1）$  - グループ$ g $、$ \ alpha_ {d} $はグループ$ k $ k $の$ d $ -cochainです。格子モデルとギャップレスシステム（ギャップレス対称性保護されたトポロジーフェーズなど）を含む格子モデルとフィールド理論を使用して、ねじれたコセット対称性を備えたいくつかの例を示します。一般的なねじれたコセットの対称性の異常を調査します。これは、（gapped）対称性保護されたトポロジーフェーズのコセット対称性を実現するための閉塞を提示します。 $ g $がバイクロス産物$ g = h \ join k $として表現できない場合、有限のコセット対称$ g/k $が異常になることを示します。格子モデルの実現とともに、$ A_5/\ mathbb {z} _2 $対称性を備えた異常なコセット対称性の例を示します。
"Jacqueline Caminiti, Federico Capeccia, Luca Ciambelli, Robert C. Myers",Geometric modular flows in 2d CFT and beyond,"We study geometric modular flows in two-dimensional conformal field theories. We explore which states exhibit a geometric modular flow with respect to a causally complete subregion and, conversely, how to construct a state from a given geometric modular flow. Given suitable boundary conditions, we find that generic geometric modular flows in the Rindler wedge are conformally equivalent. Based on this insight, we show how conformal unitaries can be used to explicitly construct a state for each flow. We analyze these states, deriving general formulas for the energy density and entanglement entropy. We also consider geometric flows beyond the Rindler wedge setting, and in higher dimensions.",2D CFTおよびそれ以降の幾何学的モジュラーフロー,2次元のコンフォーマルフィールド理論で幾何学的モジュラーフローを研究します。因果的に完全なサブ領域に関して、幾何学的モジュラーフローを示す状態と、逆に、特定の幾何学的モジュラーフローから状態を構築する方法を探ります。適切な境界条件を考えると、リンドラーウェッジの一般的な幾何学的モジュラーフローは同等に同等であることがわかります。この洞察に基づいて、各流れの状態を明示的に構築するために、コンフォーマルユニタリーを使用する方法を示します。これらの状態を分析し、エネルギー密度と絡み合いエントロピーの一般的な式を導き出します。また、幾何学的な流れがリンドラーウェッジ設定を越えて、そして高次元であることを検討します。
"Renata Kallosh, Andrei Linde","Double Exponents in $SL(2,\mathbb{Z})$ Cosmology","Recently proposed $SL(2,\mathbb{Z})$ invariant $\alpha$-attractor models have plateau potentials with respect to the inflaton and axion fields. The slope of the potential in the inflaton direction is exponentially suppressed at large values of the inflaton field, but the slope of the potential in the axion direction is double-exponentially suppressed. Therefore, the axion field remains nearly massless and practically does not change during inflation. The inflationary trajectory in such models is stable with respect to quantum fluctuations of the axion field. We show that isocurvature perturbations do not feed into the curvature perturbations during inflation, and discuss the possibility of such transfer at the post-inflationary stage.",$ sl（2、\ mathbb {z}）$ cosmologyの二重指数,最近提案された$ sl（2、\ mathbb {z}）$ Invariant $ \ alpha $ -Attractorモデルには、インフラトンおよび軸界面に関してプラトー電位があります。インフラトン方向の電位の勾配は、インフラトン場の大きな値で指数関数的に抑制されますが、軸方向の電位の勾配は二重に抑制されます。したがって、軸磁場はほぼ質量のないままであり、実際にはインフレ中は変化しません。このようなモデルの膨張軌道は、軸界の量子変動に関して安定しています。 Isocurvatureの摂動は、インフレ中に曲率摂動に供給されないことを示し、膨張後の段階でのそのような移転の可能性について議論します。
